"justiceName","term","caseName","issueArea","majVotes","minVotes","justice","vote","majority"
"PStewart",1975,"AMERICAN ELECTRIC POWER SYSTEM et al. v. SIERRA CLUB et al.",8,7,2,94,1,2
"PStewart",1975,"PASADENA CITY BOARD OF EDUCATION et al. v. SPANGLER et al.",9,6,2,94,1,2
"PStewart",1975,"PASADENA CITY BOARD OF EDUCATION et al. v. SPANGLER et al.",2,6,2,94,1,2
"PStewart",1975,"FITZPATRICK et al. v. BITZER, CHAIRMAN, STATE EMPLOYEES' RETIREMENT COMMISSION et al.",2,9,0,94,1,2
"PStewart",1975,"FITZPATRICK et al. v. BITZER, CHAIRMAN, STATE EMPLOYEES' RETIREMENT COMMISSION et al.",2,9,0,94,1,2
"PStewart",1975,"BITZER, CHAIRMAN, STATE EMPLOYEES' RETIREMENT COMMISSION, et al. v. MATTHEWS et al.",2,9,0,94,1,2
"PStewart",1975,"BITZER, CHAIRMAN, STATE EMPLOYEES' RETIREMENT COMMISSION, et al. v. MATTHEWS et al.",2,9,0,94,1,2
"PStewart",1975,"UTAH v. UNITED STATES",10,8,0,94,1,2
"PStewart",1975,"ANDRESEN v. MARYLAND",1,7,2,94,1,2
"PStewart",1975,"ANDRESEN v. MARYLAND",1,7,2,94,1,2
"PStewart",1975,"MATHEWS, SECRETARY OF HEALTH, EDUCATION, AND WELFARE v. LUCAS et al.",2,6,3,94,1,2
"PStewart",1975,"MATHEWS, SECRETARY OF HEALTH, EDUCATION, AND WELFARE v. LUCAS et al.",2,6,3,94,1,2
"PStewart",1975,"NORTON, A MINOR, BY CHILES v. MATHEWS, SECRETARY OF HEALTH, EDUCATION, AND WELFARE",2,6,3,94,1,2
"PStewart",1975,"NORTON, A MINOR, BY CHILES v. MATHEWS, SECRETARY OF HEALTH, EDUCATION, AND WELFARE",2,6,3,94,1,2
"PStewart",1975,"NEBRASKA PRESS ASSN. et al. v. STUART, JUDGE, et al.",3,9,0,94,4,2
"PStewart",1975,"LUDWIG v. MASSACHUSETTS",1,5,4,94,2,1
"PStewart",1975,"LUDWIG v. MASSACHUSETTS",1,5,4,94,2,1
"PStewart",1975,"NATIONAL HOCKEY LEAGUE et al. v. METROPOLITAN HOCKEY CLUB, INC., et al.",9,6,2,94,1,2
"PStewart",1975,"USERY, SECRETARY OF LABOR, et al. v. TURNER ELKHORN MINING CO. et al.",4,6,2,94,2,1
"PStewart",1975,"TURNER ELKHORN MINING CO. et al. v. USERY, SECRETARY OF LABOR, et al.",4,6,2,94,2,1
"PStewart",1975,"TURNER ELKHORN MINING CO. et al. v. USERY, SECRETARY OF LABOR, et al.",4,6,2,94,2,1
"PStewart",1975,"TURNER ELKHORN MINING CO. et al. v. USERY, SECRETARY OF LABOR, et al.",4,6,2,94,2,1
"PStewart",1975,"PLANNED PARENTHOOD OF CENTRAL MISSOURI et al. v. DANFORTH, ATTORNEY GENERAL OF MISSOURI, et al.",5,5,4,94,3,2
"PStewart",1975,"DANFORTH, ATTORNEY GENERAL OF MISSOURI v. PLANNED PARENTHOOD OF CENTRAL MISSOURI et al.",5,6,3,94,3,2
"PStewart",1975,"SINGLETON, CHIEF, BUREAU OF MEDICAL SERVICES, DEPARTMENT OF HEALTH AND WELFARE OF MISSOURI v. WULFF et al.",9,5,4,94,2,1
"PStewart",1975,"BELLOTTI, ATTORNEY GENERAL OF MASSACHUSETTS, et al. v. BAIRD et al.",9,9,0,94,1,2
"PStewart",1975,"HUNERWADEL v. BAIRD et al.",9,9,0,94,1,2
"PStewart",1975,"GREGG v. GEORGIA",1,7,2,94,5,2
"PStewart",1975,"PROFFITT v. FLORIDA",1,7,2,94,1,2
"PStewart",1975,"JUREK v. TEXAS",1,7,2,94,1,2
"PStewart",1975,"WOODSON et al. v. NORTH CAROLINA",1,5,4,94,5,2
"PStewart",1975,"ROBERTS v. LOUISIANA",1,5,4,94,1,2
"PStewart",1975,"SOUTH DAKOTA v. OPPERMAN",1,5,4,94,2,1
"PStewart",1975,"BUFFALO FORGE CO. v. UNITED STEELWORKERS OF AMERICA, AFL-CIO, et al.",7,5,4,94,1,2
"PStewart",1975,"UNITED STATES et al. v. JANIS",1,5,3,94,2,1
"PStewart",1975,"STONE, WARDEN v. POWELL",1,6,3,94,1,2
"PStewart",1975,"WOLFF, WARDEN v. RICE",1,6,3,94,1,2
"PStewart",1975,"UNITED STATES v. MARTINEZ-FUERTE et al.",1,7,2,94,1,2
"PStewart",1975,"SIFUENTES v. UNITED STATES",1,7,2,94,1,2
"PStewart",1975,"CANTOR, DBA SELDEN DRUGS CO. v. DETROIT EDISON CO.",8,6,3,94,2,1
"PStewart",1976,"UNITED STATES v. MORRISON",1,9,0,94,1,2
"PStewart",1976,"UNITED STATES v. ROSE",1,9,0,94,1,2
"PStewart",1976,"UNITED STATES v. DIETER",1,9,0,94,1,2
"PStewart",1976,"UNITED STATES v. POMPONIO et al.",1,9,0,94,1,2
"PStewart",1976,"UNITED STATES v. SANFORD et al.",1,7,0,94,1,2
"PStewart",1976,"STANDARD OIL CO. OF CALIFORNIA v. UNITED STATES",9,8,0,94,1,2
"PStewart",1976,"MOORE v. UNITED STATES",1,6,0,94,1,2
"PStewart",1976,"IMMIGRATION AND NATURALIZATION SERVICE v. BAGAMASBAD",2,9,0,94,1,2
"PStewart",1976,"HUTTO, ARKANSAS DEPARTMENT OF CORRECTION COMMISSIONER v. ROSS",1,8,1,94,2,1
"PStewart",1976,"UNITED STATES v. FOSTER LUMBER CO., INC.",12,5,4,94,1,2
"PStewart",1976,"SCOTT v. KENTUCKY PAROLE BOARD et al.",9,6,3,94,1,2
"PStewart",1976,"PARKER SEAL CO. v. CUMMINS",3,4,4,94,8,NA
"PStewart",1976,"MASSACHUSETTS et al. v. FEENEY",9,8,0,94,1,2
"PStewart",1976,"TULLY et al. v. GRIFFIN, INC.",9,9,0,94,1,2
"PStewart",1976,"MOODY v. DAGGETT",4,7,2,94,1,2
"PStewart",1976,"ESTELLE, CORRECTIONS DIRECTOR, et al. v. GAMBLE",1,8,1,94,1,2
"PStewart",1976,"ESTELLE, CORRECTIONS DIRECTOR, et al. v. GAMBLE",1,8,1,94,1,2
"PStewart",1976,"BELCHER v. STENGEL et al.",9,9,0,94,1,2
"PStewart",1976,"UNITED STATES v. KOPP",1,9,0,94,1,2
"PStewart",1976,"DAVIS v. GEORGIA",1,6,0,94,1,2
"PStewart",1976,"GENERAL ELECTRIC CO. v. GILBERT et al.",2,6,3,94,3,2
"PStewart",1976,"GILBERT et al. v. GENERAL ELECTRIC CO.",2,6,3,94,3,2
"PStewart",1976,"IDAHO ex rel. ANDRUS, GOVERNOR, et al. v. OREGON et al.",11,9,0,94,1,2
"PStewart",1976,"COOK et al. v. HUDSON et al.",9,9,0,94,1,2
"PStewart",1976,"CITY OF MADISON JOINT SCHOOL DISTRICT NO. 8 et al. v. WISCONSIN EMPLOYMENT RELATIONS COMMISSION et al.",3,9,0,94,4,2
"PStewart",1976,"MATHEWS, SECRETARY OF HEALTH, EDUCATION, AND WELFARE v. DE CASTRO",2,9,0,94,1,2
"PStewart",1976,"MATHEWS, SECRETARY OF HEALTH, EDUCATION, AND WELFARE v. DE CASTRO",2,9,0,94,1,2
"PStewart",1976,"CRAIG et al. v. BOREN, GOVERNOR OF OKLAHOMA, et al.",2,7,2,94,4,2
"PStewart",1976,"CRAIG et al. v. BOREN, GOVERNOR OF OKLAHOMA, et al.",9,7,2,94,4,2
"PStewart",1976,"CRAIG et al. v. BOREN, GOVERNOR OF OKLAHOMA, et al.",2,7,2,94,4,2
"PStewart",1976,"CRAIG et al. v. BOREN, GOVERNOR OF OKLAHOMA, et al.",9,7,2,94,4,2
"PStewart",1976,"INTERNATIONAL UNION OF ELECTRICAL, RADIO & MACHINE WORKERS, AFL-CIO, LOCAL 790 v. ROBBINS & MYERS, INC., et al.",2,9,0,94,4,2
"PStewart",1976,"GUY v. ROBBINS & MYERS, INC.",2,9,0,94,4,2
"PStewart",1976,"CONNALLY v. GEORGIA",4,9,0,94,1,2
"PStewart",1976,"VILLAGE OF ARLINGTON HEIGHTS et al. v. METROPOLITAN HOUSING DEVELOPMENT CORP. et al.",2,5,3,94,1,2
"PStewart",1976,"VILLAGE OF ARLINGTON HEIGHTS et al. v. METROPOLITAN HOUSING DEVELOPMENT CORP. et al.",2,5,3,94,1,2
"PStewart",1976,"MT. HEALTHY CITY SCHOOL DISTRICT BOARD OF EDUCATION v. DOYLE",3,9,0,94,1,2
"PStewart",1976,"MT. HEALTHY CITY SCHOOL DISTRICT BOARD OF EDUCATION v. DOYLE",3,9,0,94,1,2
"PStewart",1976,"MT. HEALTHY CITY SCHOOL DISTRICT BOARD OF EDUCATION v. DOYLE",3,9,0,94,1,2
"PStewart",1976,"KNEBEL, SECRETARY OF AGRICULTURE v. HEIN",2,9,0,94,1,2
"PStewart",1976,"BURNS, COMM'R, DEPT. OF SOCIAL SERVICES OF IOWA, et al. v. HEIN",2,9,0,94,1,2
"PStewart",1976,"BURNS, COMM'R, DEPT. OF SOCIAL SERVICES OF IOWA, et al. v. HEIN",2,9,0,94,1,2
"PStewart",1976,"BURNS, COMM'R, DEPT. OF SOCIAL SERVICES OF IOWA, et al. v. HEIN",2,9,0,94,1,2
"PStewart",1976,"BAYSIDE ENTERPRISES, INC., et al. v. NATIONAL LABOR RELATIONS BOARD",7,9,0,94,1,2
"PStewart",1976,"LOCAL 3489, UNITED STEELWORKERS OF AMERICA, AFL-CIO, et al. v. USERY, SECRETARY OF LABOR",7,6,3,94,2,1
"PStewart",1976,"BOSTON STOCK EXCHANGE et al. v. STATE TAX COMMISSION et al.",8,9,0,94,1,2
"PStewart",1976,"G. M. LEASING CORP. et al. v. UNITED STATES et al.",1,9,0,94,1,2
"PStewart",1976,"G. M. LEASING CORP. et al. v. UNITED STATES et al.",1,9,0,94,1,2
"PStewart",1976,"OREGON ex rel. STATE LAND BOARD v. CORVALLIS SAND & GRAVEL CO.",10,6,3,94,1,2
"PStewart",1976,"CORVALLIS SAND & GRAVEL CO. v. OREGON ex rel. STATE LAND BOARD",10,6,3,94,1,2
"PStewart",1976,"PEARSON v. DODD et al.",9,9,0,94,1,2
"PStewart",1976,"GUSTE, ATTORNEY GENERAL OF LOUISIANA, et al. v. JACKSON et al.",5,9,0,94,1,2
"PStewart",1976,"WALSH, DBA TOM WALSH & CO. v. SCHLECHT et al., TRUSTEES",7,8,1,94,1,2
"PStewart",1976,"WALSH, DBA TOM WALSH & CO. v. SCHLECHT et al., TRUSTEES",7,8,1,94,1,2
"PStewart",1976,"UNITED STATES v. DONOVAN et al.",1,6,3,94,1,2
"PStewart",1976,"UNITED STATES et al. v. COUNTY OF FRESNO",10,8,1,94,1,2
"PStewart",1976,"BRUNSWICK CORP. v. PUEBLO BOWL-O-MAT, INC., et al.",8,9,0,94,1,2
"PStewart",1976,"BRUNSWICK CORP. v. PUEBLO BOWL-O-MAT, INC., et al.",8,9,0,94,1,2
"PStewart",1976,"OREGON v. MATHIASON",1,6,1,94,1,2
"PStewart",1976,"STANTON v. STANTON",2,8,1,94,1,2
"PStewart",1976,"NATIONAL LABOR RELATIONS BOARD v. ENTERPRISE ASSOCIATION OF STEAM, HOT WATER, HYDRAULIC SPRINKLER, PNEUMATIC TUBE, ICE MACHINE & GENERAL PIPEFITTERS OF NEW YORK AND VICINITY, LOCAL UNION NO. 638",7,6,3,94,2,1
"PStewart",1976,"WEATHERFORD, AGENT OF THE SOUTH CAROLINA LAW ENFORCEMENT DIVISION, et al. v. BURSEY",1,7,2,94,1,2
"PStewart",1976,"WEATHERFORD, AGENT OF THE SOUTH CAROLINA LAW ENFORCEMENT DIVISION, et al. v. BURSEY",1,7,2,94,1,2
"PStewart",1976,"DON E. WILLIAMS CO. v. COMMISSIONER OF INTERNAL REVENUE",12,7,2,94,2,1
"PStewart",1976,"WHALEN, COMMISSIONER OF HEALTH OF NEW YORK v. ROE et al.",5,9,0,94,3,2
"PStewart",1976,"UNITED STATES STEEL CORP. et al. v. FORTNER ENTERPRISES, INC.",8,9,0,94,1,2
"PStewart",1976,"CODD, POLICE COMMISSIONER, CITY OF NEW YORK, et al. v. VELGER",4,5,4,94,2,1
"PStewart",1976,"UNITED STATES v. BOARD OF SUPERVISORS OF WARREN COUNTY, MISSISSIPPI, et al.",2,9,0,94,1,2
"PStewart",1976,"DONOVAN v. PENN SHIPPING CO., INC., et al.",9,7,0,94,1,2
"PStewart",1976,"CONCERNED CITIZENS OF SOUTHERN OHIO, INC., et al. v. PINE CREEK CONSERVANCY DISTRICT et al.",9,5,3,94,1,2
"PStewart",1976,"PIPER et al. v. CHRIS-CRAFT INDUSTRIES, INC.",8,7,2,94,1,2
"PStewart",1976,"FIRST BOSTON CORP. v. CHRIS-CRAFT INDUSTRIES, INC.",8,7,2,94,1,2
"PStewart",1976,"BANGOR PUNTA CORP. et al. v. CHRIS-CRAFT INDUSTRIES, INC.",8,7,2,94,1,2
"PStewart",1976,"BANGOR PUNTA CORP. et al. v. CHRIS-CRAFT INDUSTRIES, INC.",9,7,2,94,1,2
"PStewart",1976,"BANGOR PUNTA CORP. et al. v. CHRIS-CRAFT INDUSTRIES, INC.",9,7,2,94,1,2
"PStewart",1976,"BANGOR PUNTA CORP. et al. v. CHRIS-CRAFT INDUSTRIES, INC.",9,7,2,94,1,2
"PStewart",1976,"DELAWARE TRIBAL BUSINESS COMMITTEE et al. v. WEEKS et al.",2,8,1,94,1,2
"PStewart",1976,"ABSENTEE DELAWARE TRIBE OF OKLAHOMA BUSINESS COMMITTEE et al.  v. WEEKS et al.",2,8,1,94,1,2
"PStewart",1976,"ANDRUS, SECRETARY OF THE INTERIOR, et al. v. WEEKS et al.",2,8,1,94,1,2
"PStewart",1976,"WEEKS et al. v. ANDRUS, SECRETARY OF THE INTERIOR, et al.",2,8,1,94,1,2
"PStewart",1976,"CALIFANO, SECRETARY OF HEALTH, EDUCATION, AND WELFARE v. SANDERS",9,8,0,94,4,2
"PStewart",1976,"CALIFANO, SECRETARY OF HEALTH, EDUCATION, AND WELFARE v. SANDERS",9,8,0,94,4,2
"PStewart",1976,"E. I. DU PONT DE NEMOURS & CO. et al. v. TRAIN, ADMINISTRATOR, ENVIRONMENTAL PROTECTION AGENCY, et al.",8,8,0,94,1,2
"PStewart",1976,"E. I. DU PONT DE NEMOURS & CO. et al. v. TRAIN, ADMINISTRATOR, ENVIRONMENTAL PROTECTION AGENCY, et al.",8,8,0,94,1,2
"PStewart",1976,"TRAIN, ADMINISTRATOR, ENVIRONMENTAL PROTECTION AGENCY v. E. I. DU PONT DE NEMOURS & CO. et al.",8,8,0,94,1,2
"PStewart",1976,"CITY OF PHILADELPHIA et al. v. NEW JERSEY et al.",8,5,4,94,2,1
"PStewart",1976,"UNITED STATES v. FLORIDA et al.",10,9,0,94,1,2
"PStewart",1976,"UNITED JEWISH ORGANIZATIONS OF WILLIAMSBURGH, INC., et al. v. CAREY, GOVERNOR OF NEW YORK, et al.",2,7,1,94,4,2
"PStewart",1976,"UNITED JEWISH ORGANIZATIONS OF WILLIAMSBURGH, INC., et al. v. CAREY, GOVERNOR OF NEW YORK, et al.",2,7,1,94,4,2
"PStewart",1976,"UNITED JEWISH ORGANIZATIONS OF WILLIAMSBURGH, INC., et al. v. CAREY, GOVERNOR OF NEW YORK, et al.",2,7,1,94,4,2
"PStewart",1976,"MARKS et al. v. UNITED STATES",3,5,4,94,2,1
"PStewart",1976,"CALIFANO, SECRETARY OF HEALTH, EDUCATION, AND WELFARE v. GOLDFARB",2,5,4,94,2,1
"PStewart",1976,"CALIFANO, SECRETARY OF HEALTH, EDUCATION, AND WELFARE v. GOLDFARB",2,5,4,94,2,1
"PStewart",1976,"NOLDE BROTHERS, INC. v. LOCAL NO. 358, BAKERY & CONFECTIONERY WORKERS UNION, AFL-CIO",7,7,2,94,2,1
"PStewart",1976,"TOWN OF LOCKPORT, NEW YORK, et al. v. CITIZENS FOR COMMUNITY ACTION AT THE LOCAL LEVEL, INC., et al.",2,9,0,94,1,2
"PStewart",1976,"COMPLETE AUTO TRANSIT, INC. v. BRADY, CHAIRMAN, MISSISSIPPI TAX COMMISSION",8,9,0,94,1,2
"PStewart",1976,"FARMER, SPECIAL ADMININISTRATOR v. UNITED BROTHERHOOD OF CARPENTERS & JOINERS OF AMERICA, LOCAL 25, et al.",10,9,0,94,1,2
"PStewart",1976,"OKLAHOMA PUBLISHING CO. v. DISTRICT COURT IN AND FOR OKLAHOMA COUNTY, OKLAHOMA, et al.",3,9,0,94,1,2
"PStewart",1976,"CALIFANO, SECRETARY OF HEALTH, EDUCATION, AND WELFARE v. WEBSTER",2,9,0,94,4,2
"PStewart",1976,"CALIFANO, SECRETARY OF HEALTH, EDUCATION, AND WELFARE v. WEBSTER",2,9,0,94,4,2
"PStewart",1976,"MORALES v. TURMAN et al.",9,9,0,94,1,2
"PStewart",1976,"COSTELLO et al. v. WAINWRIGHT, SECRETARY, FLORIDA DEPARTMENT OF OFFENDER REHABILITATION, et al.",9,9,0,94,1,2
"PStewart",1976,"JUIDICE et al., JUDGES v. VAIL et al.",9,6,3,94,2,1
"PStewart",1976,"JUIDICE et al., JUDGES v. VAIL et al.",9,6,3,94,2,1
"PStewart",1976,"GARDNER v. FLORIDA",1,8,1,94,1,2
"PStewart",1976,"GARDNER v. FLORIDA",1,7,2,94,1,2
"PStewart",1976,"SWAIN, REFORMATORY SUPERINTENDENT v. PRESSLEY",1,9,0,94,1,2
"PStewart",1976,"SWAIN, REFORMATORY SUPERINTENDENT v. PRESSLEY",1,9,0,94,1,2
"PStewart",1976,"BREWER, WARDEN v. WILLIAMS",1,5,4,94,1,2
"PStewart",1976,"BREWER, WARDEN v. WILLIAMS",1,5,4,94,1,2
"PStewart",1976,"ATLAS ROOFING CO., INC. v. OCCUPATIONAL SAFETY AND HEALTH REVIEW COMMISSION et al.",1,8,0,94,1,2
"PStewart",1976,"FRANK IREY, JR., INC. v. OCCUPATIONAL SAFETY AND HEALTH REVIEW COMMISSION et al.",1,8,0,94,1,2
"PStewart",1976,"SANTA FE INDUSTRIES, INC., et al. v. GREEN et al.",8,8,1,94,1,2
"PStewart",1976,"CASTANEDA, SHERIFF v. PARTIDA",2,5,4,94,2,1
"PStewart",1976,"JONES, DIRECTOR, DEPARTMENT OF WEIGHTS AND MEASURES, RIVERSIDE COUNTY v. RATH PACKING CO. et al.",10,7,2,94,2,1
"PStewart",1976,"JONES, DIRECTOR, DEPARTMENT OF WEIGHTS AND MEASURES, RIVERSIDE COUNTY v. RATH PACKING CO. et al.",10,7,2,94,2,1
"PStewart",1976,"JONES, DIRECTOR, DEPARTMENT OF WEIGHTS AND MEASURES, RIVERSIDE COUNTY  v. GENERAL MILLS, INC., et al.",10,7,2,94,2,1
"PStewart",1976,"JONES, DIRECTOR, DEPARTMENT OF WEIGHTS AND MEASURES, RIVERSIDE COUNTY  v. GENERAL MILLS, INC., et al.",10,7,2,94,2,1
"PStewart",1976,"MANESS v. WAINWRIGHT, SECRETARY, DEPARTMENT OF OFFENDER REHABILITATION OF FLORIDA",9,9,0,94,1,2
"PStewart",1976,"NATIONAL GEOGRAPHIC SOCIETY v. CALIFORNIA BOARD OF EQUALIZATION",8,7,0,94,1,2
"PStewart",1976,"NATIONAL GEOGRAPHIC SOCIETY v. CALIFORNIA BOARD OF EQUALIZATION",8,7,0,94,1,2
"PStewart",1976,"UNITED STATES v. MARTIN LINEN SUPPLY CO. et al.",1,7,1,94,1,2
"PStewart",1976,"ROSEBUD SIOUX TRIBE v. KNEIP, GOVERNOR OF SOUTH DAKOTA, et al.",2,6,3,94,2,1
"PStewart",1976,"ALEXANDER, SECRETARY OF THE ARMY v. FIOTO",2,8,0,94,1,2
"PStewart",1976,"ALEXANDER, SECRETARY OF THE ARMY v. FIOTO",2,8,0,94,1,2
"PStewart",1976,"UNITED STATES v. ANTELOPE et al.",2,9,0,94,1,2
"PStewart",1976,"INGRAHAM et al. v. WRIGHT et al.",1,5,4,94,1,2
"PStewart",1976,"INGRAHAM et al. v. WRIGHT et al.",4,5,4,94,1,2
"PStewart",1976,"VORCHHEIMER v. SCHOOL DISTRICT OF PHILADELPHIA et al.",2,4,4,94,8,NA
"PStewart",1976,"DARDEN v. FLORIDA",1,7,2,94,1,2
"PStewart",1976,"WOOLEY, CHIEF OF POLICE OF LEBANON, et al. v. MAYNARD ET UX.",3,6,3,94,1,2
"PStewart",1976,"WOOLEY, CHIEF OF POLICE OF LEBANON, et al. v. MAYNARD ET UX.",9,6,3,94,1,2
"PStewart",1976,"GRAVITT, EXECUTRIX et al. v. SOUTHWESTERN BELL TELEPHONE CO. et al.",9,9,0,94,1,2
"PStewart",1976,"UNITED STATES v. CONSUMER LIFE INSURANCE CO.",12,7,2,94,1,2
"PStewart",1976,"FIRST RAILROAD & BANKING CO. OF GEORGIA v. UNITED STATES",12,7,2,94,1,2
"PStewart",1976,"UNITED STATES v. PENN SECURITY LIFE INSURANCE CO.",12,7,2,94,1,2
"PStewart",1976,"TRIMBLE et al. v. GORDON et al.",2,5,4,94,2,1
"PStewart",1976,"FIALLO, A MINOR, BY RODRIGUEZ, et al. v. BELL, ATTORNEY GENERAL, et al.",2,6,3,94,1,2
"PStewart",1976,"FIALLO, A MINOR, BY RODRIGUEZ, et al. v. BELL, ATTORNEY GENERAL, et al.",2,6,3,94,1,2
"PStewart",1976,"BOUNDS, CORRECTION COMMISSIONER, et al. v. SMITH et al.",4,6,3,94,2,1
"PStewart",1976,"UNITED STATES TRUST COMPANY OF NEW YORK, TRUSTEE v. NEW JERSEY et al.",8,4,3,94,NA,NA
"PStewart",1976,"BLACKLEDGE, WARDEN, et al. v. ALLISON",1,8,0,94,1,2
"PStewart",1976,"LINMARK ASSOCIATES, INC., et al. v. TOWNSHIP OF WILLINGBORO et al.",3,8,0,94,1,2
"PStewart",1976,"ENVIRONMENTAL PROTECTION AGENCY v. BROWN, GOVERNOR OF CALIFORNIA, et al.",9,8,1,94,1,2
"PStewart",1976,"ENVIRONMENTAL PROTECTION AGENCY v. MARYLAND",9,8,1,94,1,2
"PStewart",1976,"VIRGINIA ex rel. STATE AIR POLLUTION CONTROL BOARD v. COSTLE, ADMINISTRATOR, ENVIRONMENTAL PROTECTION AGENCY",9,8,1,94,1,2
"PStewart",1976,"COSTLE, ADMINISTRATOR, ENVIRONMENTAL PROTECTION AGENCY v. DISTRICT OF COLUMBIA et al.",9,8,1,94,1,2
"PStewart",1976,"DIXON, SECRETARY OF STATE OF ILLINOIS v. LOVE",4,8,0,94,1,2
"PStewart",1976,"KREMENS, HOSPITAL DIRECTOR, et al. v. BARTLEY et al.",9,7,2,94,1,2
"PStewart",1976,"HENDERSON, CORRECTIONAL SUPERINTENDENT v. KIBBE",1,8,0,94,1,2
"PStewart",1976,"PRESSLER, MEMBER, U.S. HOUSE OF REPRESENTATIVES v. BLUMENTHAL, SECRETARY OF THE TREASURY, et al.",9,8,1,94,1,2
"PStewart",1976,"ASHCROFT, ATTORNEY GENERAL OF MISSOURI v. MATTIS",9,9,0,94,1,2
"PStewart",1976,"CHAPPELLE v. GREATER BATON ROUGE AIRPORT DISTRICT et al.",2,8,1,94,1,2
"PStewart",1976,"TEXAS v. LOUISIANA",11,9,0,94,1,2
"PStewart",1976,"UNITED STATES v. WONG",1,9,0,94,1,2
"PStewart",1976,"UNITED STATES v. WASHINGTON",1,7,2,94,1,2
"PStewart",1976,"TERRITORY OF GUAM v. OLSEN",9,5,4,94,2,1
"PStewart",1976,"ABOOD et al. v. DETROIT BOARD OF EDUCATION et al.",7,9,0,94,1,2
"PStewart",1976,"DOUGLAS, COMMISSIONER, VIRGINIA MARINE RESOURCES COMMISSION v. SEACOAST PRODUCTS, INC., et al.",10,9,0,94,1,2
"PStewart",1976,"SMITH v. UNITED STATES",3,5,4,94,2,1
"PStewart",1976,"SMITH v. UNITED STATES",3,5,4,94,2,1
"PStewart",1976,"MASSACHUSETTS v. WESTCOTT",10,9,0,94,1,2
"PStewart",1976,"INTERNATIONAL BROTHERHOOD OF TEAMSTERS v. UNITED STATES et al.",2,7,2,94,1,2
"PStewart",1976,"T.I.M.E.-D.C., INC. v. UNITED STATES et al.",2,7,2,94,1,2
"PStewart",1976,"EAST TEXAS MOTOR FREIGHT SYSTEM, INC. v. RODRIGUEZ et al.",9,9,0,94,1,2
"PStewart",1976,"CONNOR et al. v. FINCH, GOVERNOR OF MISSISSIPPI, et al.",2,7,1,94,1,2
"PStewart",1976,"FINCH, GOVERNOR OF MISSISSIPPI, et al. v. CONNOR et al.",2,7,1,94,1,2
"PStewart",1976,"UNITED STATES v. FINCH, GOVERNOR OF MISSISSIPPI, et al.",2,7,1,94,1,2
"PStewart",1976,"CONNOR et al. v. FINCH, GOVERNOR OF MISSISSIPPI, et al.",2,7,1,94,1,2
"PStewart",1976,"TRAINOR, DIRECTOR, ILLINOIS DEPARTMENT OF PUBLIC AID, et al. v. HERNANDEZ ET UX.",9,5,4,94,2,1
"PStewart",1976,"OHIO BUREAU OF EMPLOYMENT SERVICES et al. v. HODORY",2,8,0,94,1,2
"PStewart",1976,"OHIO BUREAU OF EMPLOYMENT SERVICES et al. v. HODORY",2,8,0,94,1,2
"PStewart",1976,"OHIO BUREAU OF EMPLOYMENT SERVICES et al. v. HODORY",2,8,0,94,1,2
"PStewart",1976,"MOORE v. CITY OF EAST CLEVELAND, OHIO",8,5,4,94,2,1
"PStewart",1976,"UNITED AIR LINES, INC. v. EVANS",2,7,2,94,1,2
"PStewart",1976,"SCARBOROUGH v. UNITED STATES",1,7,1,94,2,1
"PStewart",1976,"ALABAMA POWER CO. v. DAVIS",2,9,0,94,1,2
"PStewart",1976,"SPLAWN v. CALIFORNIA",3,5,4,94,2,1
"PStewart",1976,"SPLAWN v. CALIFORNIA",3,5,4,94,2,1
"PStewart",1976,"UNITED STATES v. RAMSEY et al.",1,6,3,94,1,2
"PStewart",1976,"UNITED STATES v. RAMSEY et al.",1,6,3,94,1,2
"PStewart",1976,"ROBERTS v. LOUISIANA",1,5,4,94,1,2
"PStewart",1976,"ABNEY et al. v. UNITED STATES",1,9,0,94,1,2
"PStewart",1976,"ABNEY et al. v. UNITED STATES",1,9,0,94,1,2
"PStewart",1976,"STENCEL AERO ENGINEERING CORP. v. UNITED STATES",8,7,2,94,1,2
"PStewart",1976,"CAREY, GOVERNOR OF NEW YORK, et al. v. POPULATION SERVICES INTERNATIONAL et al.",5,7,2,94,1,2
"PStewart",1976,"CAREY, GOVERNOR OF NEW YORK, et al. v. POPULATION SERVICES INTERNATIONAL et al.",5,7,2,94,1,2
"PStewart",1976,"CAREY, GOVERNOR OF NEW YORK, et al. v. POPULATION SERVICES INTERNATIONAL et al.",5,7,2,94,1,2
"PStewart",1976,"ILLINOIS BRICK CO. et al. v. ILLINOIS et al.",8,6,3,94,1,2
"PStewart",1976,"WARD v. ILLINOIS",3,5,4,94,2,1
"PStewart",1976,"UNITED STATES v. LOVASCO",1,8,1,94,1,2
"PStewart",1976,"LEFKOWITZ, ATTORNEY GENERAL OF NEW YORK v. CUNNINGHAM et al.",1,7,1,94,1,2
"PStewart",1976,"SMITH, ADMINISTRATOR, NEW YORK CITY HUMAN RESOURCES ADMINISTRATION, et al. v. ORGANIZATION OF FOSTER FAMILIES FOR EQUALITY & REFORM et al.",4,9,0,94,4,2
"PStewart",1976,"SHAPIRO, EXECUTIVE DIRECTOR, NEW YORK STATE BOARD OF SOCIAL WELFARE, et al. v. ORGANIZATION OF FOSTER FAMILIES FOR EQUALITY & REFORM et al.",4,9,0,94,4,2
"PStewart",1976,"RODRIGUEZ et al. v. ORGANIZATION OF FOSTER FAMILIES FOR EQUALITY & REFORM et al.",4,9,0,94,4,2
"PStewart",1976,"GANDY et al. v. ORGANIZATION OF FOSTER FAMILIES FOR EQUALITY & REFORM et al.",4,9,0,94,4,2
"PStewart",1976,"UNITED STATES et al. v. LARIONOFF et al.",2,5,4,94,1,2
"PStewart",1976,"NYQUIST, COMMISSIONER OF EDUCATION OF NEW YORK, et al. v. MAUCLET et al.",2,5,4,94,2,1
"PStewart",1976,"LEE v. UNITED STATES",1,8,1,94,1,2
"PStewart",1976,"UNITED STATES v. CALIFORNIA",10,9,0,94,1,2
"PStewart",1976,"NATIONAL SOCIALIST PARTY OF AMERICA et al. v. VILLAGE OF SKOKIE",3,5,4,94,2,1
"PStewart",1976,"E.I. DU PONT DE NEMOURS & CO. et al. v. COLLINS et al.",8,7,1,94,1,2
"PStewart",1976,"SECURITIES AND EXCHANGE COMMISSION v. COLLINS et al.",8,7,1,94,1,2
"PStewart",1976,"TRANS WORLD AIRLINES, INC. v. HARDISON et al.",2,7,2,94,1,2
"PStewart",1976,"INTERNATIONAL ASSN. OF MACHINISTS & AEROSPACE WORKERS, AFL-CIO, et al. v. HARDISON et al.",2,7,2,94,1,2
"PStewart",1976,"MANSON, CORRECTION COMMISSIONER v. BRATHWAITE",1,7,2,94,1,2
"PStewart",1976,"JEFFERS v. UNITED STATES",1,5,4,94,2,1
"PStewart",1976,"JEFFERS v. UNITED STATES",1,8,1,94,4,2
"PStewart",1976,"BROWN v. OHIO",1,6,3,94,1,2
"PStewart",1976,"MANDEL, GOVERNOR OF MARYLAND, et al. v. BRADLEY et al.",2,7,1,94,1,2
"PStewart",1976,"JONES v. HILDEBRANT et al.",9,6,3,94,1,2
"PStewart",1976,"PATTERSON v. NEW YORK",4,5,3,94,1,2
"PStewart",1976,"HANKERSON v. NORTH CAROLINA",1,8,0,94,1,2
"PStewart",1976,"NORTHEAST MARINE TERMINAL CO., INC., et al. v. CAPUTO et al.",8,9,0,94,1,2
"PStewart",1976,"INTERNATIONAL TERMINAL OPERATING CO., INC. v. BLUNDO et al.",8,9,0,94,1,2
"PStewart",1976,"DOBBERT v. FLORIDA",1,6,3,94,1,2
"PStewart",1976,"THIRD NATIONAL BANK IN NASHVILLE v. IMPAC LIMITED, INC., et al.",2,6,3,94,1,2
"PStewart",1976,"HUNT, GOVERNOR OF NORTH CAROLINA, et al. v. WASHINGTON STATE APPLE ADVERTISING COMMISSION",8,8,0,94,1,2
"PStewart",1976,"HUNT, GOVERNOR OF NORTH CAROLINA, et al. v. WASHINGTON STATE APPLE ADVERTISING COMMISSION",8,8,0,94,1,2
"PStewart",1976,"HUNT, GOVERNOR OF NORTH CAROLINA, et al. v. WASHINGTON STATE APPLE ADVERTISING COMMISSION",8,8,0,94,1,2
"PStewart",1976,"OCCIDENTAL LIFE INSURANCE COMPANY OF CALIFORNIA v. EQUAL EMPLOYMENT OPPORTUNITY COMMISSION",2,7,2,94,1,2
"PStewart",1976,"UNITED AIRLINES, INC. v. MCDONALD",9,5,3,94,1,2
"PStewart",1976,"BRISCOE, GOVERNOR OF TEXAS, et al. v. BELL, ATTORNEY GENERAL, et al.",2,9,0,94,1,2
"PStewart",1976,"BRISCOE, GOVERNOR OF TEXAS, et al. v. BELL, ATTORNEY GENERAL, et al.",2,9,0,94,1,2
"PStewart",1976,"BRISCOE, GOVERNOR OF TEXAS, et al. v. BELL, ATTORNEY GENERAL, et al.",9,9,0,94,1,2
"PStewart",1976,"BATTERTON, SECRETARY, DEPARTMENT OF HUMAN RESOURCES OF MARYLAND, et al. v. FRANCIS et al.",2,5,4,94,1,2
"PStewart",1976,"BEAL, SECRETARY, DEPARTMENT OF PUBLIC WELFARE OF PENNSYLVANIA, et al. v. DOE et al.",5,6,3,94,1,2
"PStewart",1976,"MAHER, COMMISSIONER OF SOCIAL SERVICES OF CONNECTICUT v. ROE et al.",5,6,3,94,1,2
"PStewart",1976,"MORRIS et al. v. GRESSETTE, PRESIDENT PRO TEM, SOUTH CAROLINA SENATE, et al.",2,6,3,94,1,2
"PStewart",1976,"POELKER, MAYOR OF ST. LOUIS, et al. v. DOE",5,6,3,94,1,2
"PStewart",1976,"MAHER, COMMISSIONER OF SOCIAL SERVICES OF CONNECTICUT v. DOE et al.",2,9,0,94,1,2
"PStewart",1976,"UNITED STATES v. CHADWICK et al.",1,7,2,94,1,2
"PStewart",1976,"MIREE et al. v. DEKALB COUNTY, GEORGIA, et al.",8,9,0,94,1,2
"PStewart",1976,"PHILLIPS v. DEKALB COUNTY, GEORGIA, et al.",8,9,0,94,1,2
"PStewart",1976,"FIREMAN'S FUND INSURANCE CO. v. DEKALB COUNTY, GEORGIA, et al.",8,9,0,94,1,2
"PStewart",1976,"FIELDS v. DEKALB COUNTY, GEORGIA, et al.",8,9,0,94,1,2
"PStewart",1976,"CONTINENTAL T.V., INC., et al. v. GTE SYLVANIA INC.",8,6,2,94,1,2
"PStewart",1976,"WAINWRIGHT, SECRETARY, DEPARTMENT OF OFFENDER REHABILITATION OF FLORIDA v. SYKES",1,7,2,94,1,2
"PStewart",1976,"JONES, SECRETARY, DEPARTMENT OF CORRECTION OF NORTH CAROLINA, et al. v. NORTH CAROLINA PRISONERS' LABOR UNION, INC.",3,7,2,94,1,2
"PStewart",1976,"JONES, SECRETARY, DEPARTMENT OF CORRECTION OF NORTH CAROLINA, et al. v. NORTH CAROLINA PRISONERS' LABOR UNION, INC.",3,7,2,94,1,2
"PStewart",1976,"COMMISSIONER OF INTERNAL REVENUE v. STANDARD LIFE & ACCIDENT INSURANCE CO.",12,8,0,94,NA,NA
"PStewart",1976,"PUYALLUP TRIBE, INC., et al. v. DEPARTMENT OF GAME OF WASHINGTON et al.",2,7,2,94,1,2
"PStewart",1976,"SHAFFER et al. v. HEITNER",4,7,1,94,1,2
"PStewart",1976,"WOLMAN et al. v. WALTER et al.",3,7,2,94,1,2
"PStewart",1976,"WOLMAN et al. v. WALTER et al.",3,8,1,94,1,2
"PStewart",1976,"MILLIKEN, GOVERNOR OF MICHIGAN, et al. v. BRADLEY et al.",2,9,0,94,1,2
"PStewart",1976,"MILLIKEN, GOVERNOR OF MICHIGAN, et al. v. BRADLEY et al.",2,9,0,94,1,2
"PStewart",1976,"MILLIKEN, GOVERNOR OF MICHIGAN, et al. v. BRADLEY et al.",2,9,0,94,1,2
"PStewart",1976,"HAZELWOOD SCHOOL DISTRICT et al. v. UNITED STATES",2,8,1,94,1,2
"PStewart",1976,"DOTHARD, DIRECTOR, DEPARTMENT OF PUBLIC SAFETY OF ALABAMA, et al. v. RAWLINSON et al.",2,7,2,94,1,2
"PStewart",1976,"DOTHARD, DIRECTOR, DEPARTMENT OF PUBLIC SAFETY OF ALABAMA, et al. v. RAWLINSON et al.",2,8,1,94,1,2
"PStewart",1976,"BATES et al. v. STATE BAR OF ARIZONA",6,5,4,94,2,1
"PStewart",1976,"BATES et al. v. STATE BAR OF ARIZONA",6,5,4,94,2,1
"PStewart",1976,"DAYTON BOARD OF EDUCATION et al. v. BRINKMAN et al.",2,8,0,94,1,2
"PStewart",1976,"NIXON v. ADMINISTRATOR OF GENERAL SERVICES et al.",3,7,2,94,1,2
"PStewart",1976,"NIXON v. ADMINISTRATOR OF GENERAL SERVICES et al.",3,7,2,94,1,2
"PStewart",1976,"NIXON v. ADMINISTRATOR OF GENERAL SERVICES et al.",3,7,2,94,1,2
"PStewart",1976,"NIXON v. ADMINISTRATOR OF GENERAL SERVICES et al.",3,7,2,94,1,2
