usCite,caseName
429 U.S. 163,"IDAHO ex rel. ANDRUS, GOVERNOR, et al. v. OREGON et al."
429 U.S. 165,COOK et al. v. HUDSON et al.
429 U.S. 167,CITY OF MADISON JOINT SCHOOL DISTRICT NO. 8 et al. v. WISCONSIN EMPLOYMENT RELATIONS COMMISSION et al.
429 U.S. 181,"MATHEWS, SECRETARY OF HEALTH, EDUCATION, AND WELFARE v. DE CASTRO"
429 U.S. 190,"CRAIG et al. v. BOREN, GOVERNOR OF OKLAHOMA, et al."
429 U.S. 229,"INTERNATIONAL UNION OF ELECTRICAL, RADIO & MACHINE WORKERS, AFL-CIO, LOCAL 790 v. ROBBINS & MYERS, INC., et al."
429 U.S. 229,"GUY v. ROBBINS & MYERS, INC."
429 U.S. 245,CONNALLY v. GEORGIA
429 U.S. 252,VILLAGE OF ARLINGTON HEIGHTS et al. v. METROPOLITAN HOUSING DEVELOPMENT CORP. et al.
429 U.S. 274,MT. HEALTHY CITY SCHOOL DISTRICT BOARD OF EDUCATION v. DOYLE
429 U.S. 288,"KNEBEL, SECRETARY OF AGRICULTURE v. HEIN"
429 U.S. 288,"BURNS, COMM'R, DEPT. OF SOCIAL SERVICES OF IOWA, et al. v. HEIN"
429 U.S. 298,"BAYSIDE ENTERPRISES, INC., et al. v. NATIONAL LABOR RELATIONS BOARD"
429 U.S. 305,"LOCAL 3489, UNITED STEELWORKERS OF AMERICA, AFL-CIO, et al. v. USERY, SECRETARY OF LABOR"
429 U.S. 318,BOSTON STOCK EXCHANGE et al. v. STATE TAX COMMISSION et al.
429 U.S. 338,G. M. LEASING CORP. et al. v. UNITED STATES et al.
429 U.S. 363,OREGON ex rel. STATE LAND BOARD v. CORVALLIS SAND & GRAVEL CO.
429 U.S. 363,CORVALLIS SAND & GRAVEL CO. v. OREGON ex rel. STATE LAND BOARD
429 U.S. 396,PEARSON v. DODD et al.
429 U.S. 399,"GUSTE, ATTORNEY GENERAL OF LOUISIANA, et al. v. JACKSON et al."
429 U.S. 401,"WALSH, DBA TOM WALSH & CO. v. SCHLECHT et al., TRUSTEES"
429 U.S. 413,UNITED STATES v. DONOVAN et al.
429 U.S. 452,UNITED STATES et al. v. COUNTY OF FRESNO
429 U.S. 477,"BRUNSWICK CORP. v. PUEBLO BOWL-O-MAT, INC., et al."
429 U.S. 492,OREGON v. MATHIASON
429 U.S. 501,STANTON v. STANTON
429 U.S. 507,"NATIONAL LABOR RELATIONS BOARD v. ENTERPRISE ASSOCIATION OF STEAM, HOT WATER, HYDRAULIC SPRINKLER, PNEUMATIC TUBE, ICE MACHINE & GENERAL PIPEFITTERS OF NEW YORK AND VICINITY, LOCAL UNION NO. 638"
429 U.S. 545,"WEATHERFORD, AGENT OF THE SOUTH CAROLINA LAW ENFORCEMENT DIVISION, et al. v. BURSEY"
429 U.S. 569,DON E. WILLIAMS CO. v. COMMISSIONER OF INTERNAL REVENUE
429 U.S. 589,"WHALEN, COMMISSIONER OF HEALTH OF NEW YORK v. ROE et al."
429 U.S. 610,"UNITED STATES STEEL CORP. et al. v. FORTNER ENTERPRISES, INC."
429 U.S. 624,"CODD, POLICE COMMISSIONER, CITY OF NEW YORK, et al. v. VELGER"
429 U.S. 642,"UNITED STATES v. BOARD OF SUPERVISORS OF WARREN COUNTY, MISSISSIPPI, et al."
429 U.S. 648,"DONOVAN v. PENN SHIPPING CO., INC., et al."
429 U.S. 651,"CONCERNED CITIZENS OF SOUTHERN OHIO, INC., et al. v. PINE CREEK CONSERVANCY DISTRICT et al."
430 U.S. 1,"PIPER et al. v. CHRIS-CRAFT INDUSTRIES, INC."
430 U.S. 1,"FIRST BOSTON CORP. v. CHRIS-CRAFT INDUSTRIES, INC."
430 U.S. 1,"BANGOR PUNTA CORP. et al. v. CHRIS-CRAFT INDUSTRIES, INC."
430 U.S. 73,DELAWARE TRIBAL BUSINESS COMMITTEE et al. v. WEEKS et al.
430 U.S. 73,ABSENTEE DELAWARE TRIBE OF OKLAHOMA BUSINESS COMMITTEE et al. v. WEEKS et al.
430 U.S. 73,"ANDRUS, SECRETARY OF THE INTERIOR, et al. v. WEEKS et al."
430 U.S. 73,"WEEKS et al. v. ANDRUS, SECRETARY OF THE INTERIOR, et al."
430 U.S. 99,"CALIFANO, SECRETARY OF HEALTH, EDUCATION, AND WELFARE v. SANDERS"
430 U.S. 112,"E. I. DU PONT DE NEMOURS & CO. et al. v. TRAIN, ADMINISTRATOR, ENVIRONMENTAL PROTECTION AGENCY, et al."
430 U.S. 112,"E. I. DU PONT DE NEMOURS & CO. et al. v. TRAIN, ADMINISTRATOR, ENVIRONMENTAL PROTECTION AGENCY, et al."
430 U.S. 112,"TRAIN, ADMINISTRATOR, ENVIRONMENTAL PROTECTION AGENCY v. E. I. DU PONT DE NEMOURS & CO. et al."
430 U.S. 141,CITY OF PHILADELPHIA et al. v. NEW JERSEY et al.
430 U.S. 140,UNITED STATES v. FLORIDA et al.
430 U.S. 144,"UNITED JEWISH ORGANIZATIONS OF WILLIAMSBURGH, INC., et al. v. CAREY, GOVERNOR OF NEW YORK, et al."
430 U.S. 188,MARKS et al. v. UNITED STATES
430 U.S. 199,"CALIFANO, SECRETARY OF HEALTH, EDUCATION, AND WELFARE v. GOLDFARB"
430 U.S. 243,"NOLDE BROTHERS, INC. v. LOCAL NO. 358, BAKERY & CONFECTIONERY WORKERS UNION, AFL-CIO"
430 U.S. 259,"TOWN OF LOCKPORT, NEW YORK, et al. v. CITIZENS FOR COMMUNITY ACTION AT THE LOCAL LEVEL, INC., et al."
430 U.S. 274,"COMPLETE AUTO TRANSIT, INC. v. BRADY, CHAIRMAN, MISSISSIPPI TAX COMMISSION"
430 U.S. 290,"FARMER, SPECIAL ADMININISTRATOR v. UNITED BROTHERHOOD OF CARPENTERS & JOINERS OF AMERICA, LOCAL 25, et al."
430 U.S. 308,"OKLAHOMA PUBLISHING CO. v. DISTRICT COURT IN AND FOR OKLAHOMA COUNTY, OKLAHOMA, et al."
430 U.S. 313,"CALIFANO, SECRETARY OF HEALTH, EDUCATION, AND WELFARE v. WEBSTER"
430 U.S. 322,MORALES v. TURMAN et al.
430 U.S. 325,"COSTELLO et al. v. WAINWRIGHT, SECRETARY, FLORIDA DEPARTMENT OF OFFENDER REHABILITATION, et al."
430 U.S. 327,"JUIDICE et al., JUDGES v. VAIL et al."
430 U.S. 349,GARDNER v. FLORIDA
430 U.S. 372,"SWAIN, REFORMATORY SUPERINTENDENT v. PRESSLEY"
430 U.S. 387,"BREWER, WARDEN v. WILLIAMS"
430 U.S. 442,"ATLAS ROOFING CO., INC. v. OCCUPATIONAL SAFETY AND HEALTH REVIEW COMMISSION et al."
430 U.S. 442,"FRANK IREY, JR., INC. v. OCCUPATIONAL SAFETY AND HEALTH REVIEW COMMISSION et al."
430 U.S. 462,"SANTA FE INDUSTRIES, INC., et al. v. GREEN et al."
430 U.S. 482,"CASTANEDA, SHERIFF v. PARTIDA"
430 U.S. 519,"JONES, DIRECTOR, DEPARTMENT OF WEIGHTS AND MEASURES, RIVERSIDE COUNTY v. RATH PACKING CO. et al."
430 U.S. 519,"JONES, DIRECTOR, DEPARTMENT OF WEIGHTS AND MEASURES, RIVERSIDE COUNTY v. GENERAL MILLS, INC., et al."
430 U.S. 550,"MANESS v. WAINWRIGHT, SECRETARY, DEPARTMENT OF OFFENDER REHABILITATION OF FLORIDA"
430 U.S. 551,NATIONAL GEOGRAPHIC SOCIETY v. CALIFORNIA BOARD OF EQUALIZATION
430 U.S. 564,UNITED STATES v. MARTIN LINEN SUPPLY CO. et al.
430 U.S. 584,"ROSEBUD SIOUX TRIBE v. KNEIP, GOVERNOR OF SOUTH DAKOTA, et al."
430 U.S. 634,"ALEXANDER, SECRETARY OF THE ARMY v. FIOTO"
430 U.S. 641,UNITED STATES v. ANTELOPE et al.
430 U.S. 651,INGRAHAM et al. v. WRIGHT et al.
430 U.S. 703,VORCHHEIMER v. SCHOOL DISTRICT OF PHILADELPHIA et al.
430 U.S. 704,DARDEN v. FLORIDA
430 U.S. 705,"WOOLEY, CHIEF OF POLICE OF LEBANON, et al. v. MAYNARD ET UX."
430 U.S. 723,"GRAVITT, EXECUTRIX et al. v. SOUTHWESTERN BELL TELEPHONE CO. et al."
430 U.S. 725,UNITED STATES v. CONSUMER LIFE INSURANCE CO.
430 U.S. 725,FIRST RAILROAD & BANKING CO. OF GEORGIA v. UNITED STATES
430 U.S. 725,UNITED STATES v. PENN SECURITY LIFE INSURANCE CO.
430 U.S. 762,TRIMBLE et al. v. GORDON et al.
430 U.S. 787,"FIALLO, A MINOR, BY RODRIGUEZ, et al. v. BELL, ATTORNEY GENERAL, et al."
430 U.S. 817,"BOUNDS, CORRECTION COMMISSIONER, et al. v. SMITH et al."
431 U.S. 1,"UNITED STATES TRUST COMPANY OF NEW YORK, TRUSTEE v. NEW JERSEY et al."
431 U.S. 63,"BLACKLEDGE, WARDEN, et al. v. ALLISON"
431 U.S. 85,"LINMARK ASSOCIATES, INC., et al. v. TOWNSHIP OF WILLINGBORO et al."
431 U.S. 99,"ENVIRONMENTAL PROTECTION AGENCY v. BROWN, GOVERNOR OF CALIFORNIA, et al."
431 U.S. 99,ENVIRONMENTAL PROTECTION AGENCY v. MARYLAND
431 U.S. 99,"VIRGINIA ex rel. STATE AIR POLLUTION CONTROL BOARD v. COSTLE, ADMINISTRATOR, ENVIRONMENTAL PROTECTION AGENCY"
431 U.S. 99,"COSTLE, ADMINISTRATOR, ENVIRONMENTAL PROTECTION AGENCY v. DISTRICT OF COLUMBIA et al."
431 U.S. 105,"DIXON, SECRETARY OF STATE OF ILLINOIS v. LOVE"
431 U.S. 119,"KREMENS, HOSPITAL DIRECTOR, et al. v. BARTLEY et al."
431 U.S. 145,"HENDERSON, CORRECTIONAL SUPERINTENDENT v. KIBBE"
431 U.S. 169,"PRESSLER, MEMBER, U.S. HOUSE OF REPRESENTATIVES v. BLUMENTHAL, SECRETARY OF THE TREASURY, et al."
431 U.S. 171,"ASHCROFT, ATTORNEY GENERAL OF MISSOURI v. MATTIS"
431 U.S. 159,CHAPPELLE v. GREATER BATON ROUGE AIRPORT DISTRICT et al.
431 U.S. 161,TEXAS v. LOUISIANA
431 U.S. 174,UNITED STATES v. WONG
431 U.S. 181,UNITED STATES v. WASHINGTON
431 U.S. 195,TERRITORY OF GUAM v. OLSEN
431 U.S. 209,ABOOD et al. v. DETROIT BOARD OF EDUCATION et al.
431 U.S. 265,"DOUGLAS, COMMISSIONER, VIRGINIA MARINE RESOURCES COMMISSION v. SEACOAST PRODUCTS, INC., et al."
431 U.S. 291,SMITH v. UNITED STATES
431 U.S. 322,MASSACHUSETTS v. WESTCOTT
431 U.S. 324,INTERNATIONAL BROTHERHOOD OF TEAMSTERS v. UNITED STATES et al.
431 U.S. 324,"T.I.M.E.-D.C., INC. v. UNITED STATES et al."
431 U.S. 395,"EAST TEXAS MOTOR FREIGHT SYSTEM, INC. v. RODRIGUEZ et al."
431 U.S. 407,"CONNOR et al. v. FINCH, GOVERNOR OF MISSISSIPPI, et al."
431 U.S. 407,"FINCH, GOVERNOR OF MISSISSIPPI, et al. v. CONNOR et al."
431 U.S. 407,"UNITED STATES v. FINCH, GOVERNOR OF MISSISSIPPI, et al."
431 U.S. 407,"CONNOR et al. v. FINCH, GOVERNOR OF MISSISSIPPI, et al."
431 U.S. 434,"TRAINOR, DIRECTOR, ILLINOIS DEPARTMENT OF PUBLIC AID, et al. v. HERNANDEZ ET UX."
431 U.S. 471,OHIO BUREAU OF EMPLOYMENT SERVICES et al. v. HODORY
431 U.S. 494,"MOORE v. CITY OF EAST CLEVELAND, OHIO"
431 U.S. 553,"UNITED AIR LINES, INC. v. EVANS"
431 U.S. 563,SCARBOROUGH v. UNITED STATES
431 U.S. 581,ALABAMA POWER CO. v. DAVIS
431 U.S. 595,SPLAWN v. CALIFORNIA
431 U.S. 606,UNITED STATES v. RAMSEY et al.
431 U.S. 633,ROBERTS v. LOUISIANA
431 U.S. 651,ABNEY et al. v. UNITED STATES
431 U.S. 666,STENCEL AERO ENGINEERING CORP. v. UNITED STATES
431 U.S. 678,"CAREY, GOVERNOR OF NEW YORK, et al. v. POPULATION SERVICES INTERNATIONAL et al."
431 U.S. 720,ILLINOIS BRICK CO. et al. v. ILLINOIS et al.
431 U.S. 767,WARD v. ILLINOIS
431 U.S. 783,UNITED STATES v. LOVASCO
431 U.S. 801,"LEFKOWITZ, ATTORNEY GENERAL OF NEW YORK v. CUNNINGHAM et al."
431 U.S. 816,"SMITH, ADMINISTRATOR, NEW YORK CITY HUMAN RESOURCES ADMINISTRATION, et al. v. ORGANIZATION OF FOSTER FAMILIES FOR EQUALITY & REFORM et al."
431 U.S. 816,"SHAPIRO, EXECUTIVE DIRECTOR, NEW YORK STATE BOARD OF SOCIAL WELFARE, et al. v. ORGANIZATION OF FOSTER FAMILIES FOR EQUALITY & REFORM et al."
431 U.S. 816,RODRIGUEZ et al. v. ORGANIZATION OF FOSTER FAMILIES FOR EQUALITY & REFORM et al.
431 U.S. 816,GANDY et al. v. ORGANIZATION OF FOSTER FAMILIES FOR EQUALITY & REFORM et al.
431 U.S. 864,UNITED STATES et al. v. LARIONOFF et al.
432 U.S. 1,"NYQUIST, COMMISSIONER OF EDUCATION OF NEW YORK, et al. v. MAUCLET et al."
432 U.S. 23,LEE v. UNITED STATES
432 U.S. 40,UNITED STATES v. CALIFORNIA
432 U.S. 43,NATIONAL SOCIALIST PARTY OF AMERICA et al. v. VILLAGE OF SKOKIE
432 U.S. 46,E.I. DU PONT DE NEMOURS & CO. et al. v. COLLINS et al.
432 U.S. 46,SECURITIES AND EXCHANGE COMMISSION v. COLLINS et al.
432 U.S. 63,"TRANS WORLD AIRLINES, INC. v. HARDISON et al."
432 U.S. 63,"INTERNATIONAL ASSN. OF MACHINISTS & AEROSPACE WORKERS, AFL-CIO, et al. v. HARDISON et al."
432 U.S. 98,"MANSON, CORRECTION COMMISSIONER v. BRATHWAITE"
432 U.S. 137,JEFFERS v. UNITED STATES
432 U.S. 161,BROWN v. OHIO
432 U.S. 173,"MANDEL, GOVERNOR OF MARYLAND, et al. v. BRADLEY et al."
432 U.S. 183,JONES v. HILDEBRANT et al.
432 U.S. 197,PATTERSON v. NEW YORK
432 U.S. 233,HANKERSON v. NORTH CAROLINA
432 U.S. 249,"NORTHEAST MARINE TERMINAL CO., INC., et al. v. CAPUTO et al."
432 U.S. 249,"INTERNATIONAL TERMINAL OPERATING CO., INC. v. BLUNDO et al."
432 U.S. 282,DOBBERT v. FLORIDA
432 U.S. 312,"THIRD NATIONAL BANK IN NASHVILLE v. IMPAC LIMITED, INC., et al."
432 U.S. 333,"HUNT, GOVERNOR OF NORTH CAROLINA, et al. v. WASHINGTON STATE APPLE ADVERTISING COMMISSION"
432 U.S. 355,OCCIDENTAL LIFE INSURANCE COMPANY OF CALIFORNIA v. EQUAL EMPLOYMENT OPPORTUNITY COMMISSION
432 U.S. 385,"UNITED AIRLINES, INC. v. MCDONALD"
432 U.S. 404,"BRISCOE, GOVERNOR OF TEXAS, et al. v. BELL, ATTORNEY GENERAL, et al."
432 U.S. 416,"BATTERTON, SECRETARY, DEPARTMENT OF HUMAN RESOURCES OF MARYLAND, et al. v. FRANCIS et al."
432 U.S. 438,"BEAL, SECRETARY, DEPARTMENT OF PUBLIC WELFARE OF PENNSYLVANIA, et al. v. DOE et al."
432 U.S. 464,"MAHER, COMMISSIONER OF SOCIAL SERVICES OF CONNECTICUT v. ROE et al."
432 U.S. 491,"MORRIS et al. v. GRESSETTE, PRESIDENT PRO TEM, SOUTH CAROLINA SENATE, et al."
432 U.S. 519,"POELKER, MAYOR OF ST. LOUIS, et al. v. DOE"
432 U.S. 526,"MAHER, COMMISSIONER OF SOCIAL SERVICES OF CONNECTICUT v. DOE et al."
433 U.S. 1,UNITED STATES v. CHADWICK et al.
433 U.S. 25,"MIREE et al. v. DEKALB COUNTY, GEORGIA, et al."
433 U.S. 25,"PHILLIPS v. DEKALB COUNTY, GEORGIA, et al."
433 U.S. 25,"FIREMAN'S FUND INSURANCE CO. v. DEKALB COUNTY, GEORGIA, et al."
433 U.S. 25,"FIELDS v. DEKALB COUNTY, GEORGIA, et al."
433 U.S. 36,"CONTINENTAL T.V., INC., et al. v. GTE SYLVANIA INC."
433 U.S. 72,"WAINWRIGHT, SECRETARY, DEPARTMENT OF OFFENDER REHABILITATION OF FLORIDA v. SYKES"
433 U.S. 119,"JONES, SECRETARY, DEPARTMENT OF CORRECTION OF NORTH CAROLINA, et al. v. NORTH CAROLINA PRISONERS' LABOR UNION, INC."
433 U.S. 148,COMMISSIONER OF INTERNAL REVENUE v. STANDARD LIFE & ACCIDENT INSURANCE CO.
433 U.S. 165,"PUYALLUP TRIBE, INC., et al. v. DEPARTMENT OF GAME OF WASHINGTON et al."
433 U.S. 186,SHAFFER et al. v. HEITNER
433 U.S. 229,WOLMAN et al. v. WALTER et al.
433 U.S. 267,"MILLIKEN, GOVERNOR OF MICHIGAN, et al. v. BRADLEY et al."
433 U.S. 299,HAZELWOOD SCHOOL DISTRICT et al. v. UNITED STATES
433 U.S. 321,"DOTHARD, DIRECTOR, DEPARTMENT OF PUBLIC SAFETY OF ALABAMA, et al. v. RAWLINSON et al."
433 U.S. 350,BATES et al. v. STATE BAR OF ARIZONA
433 U.S. 406,DAYTON BOARD OF EDUCATION et al. v. BRINKMAN et al.
433 U.S. 425,NIXON v. ADMINISTRATOR OF GENERAL SERVICES et al.
433 U.S. 562,ZACCHINI v. SCRIPPS-HOWARD BROADCASTING CO.
433 U.S. 584,COKER v. GEORGIA
433 U.S. 623,VENDO CO. v. LEKTRO-VEND CORP. et al.
433 U.S. 667,SCHOOL DISTRICT OF OMAHA et al. v. UNITED STATES et al.
433 U.S. 672,BRENNAN et al. v. ARMSTRONG et al.
433 U.S. 676,FINCH v. UNITED STATES
433 U.S. 682,HARRIS v. OKLAHOMA
434 U.S. 1,NEW HAMPSHIRE v. MAINE
434 U.S. 5,"COUNTY BOARD OF ARLINGTON COUNTY, VIRGINIA, et al. v. RICHARDS et al."
434 U.S. 9,SOUTHERN OVERLYING CARRIER CHAPTER OF THE CALIFORNIA DUMP TRUCK OWNERS ASSOCIATION et al. v. PUBLIC UTILITIES COMMISSION OF CALIFORNIA
434 U.S. 12,"GENERAL ATOMIC CO. v. FELTER, JUDGE, et al."
434 U.S. 22,RINALDI v. UNITED STATES
434 U.S. 35,CITIZENS & SOUTHERN NATIONAL BANK v. BOUGAS
434 U.S. 47,"CALIFANO, SECRETARY OF HEALTH, EDUCATION, AND WELFARE v. JOBST"
434 U.S. 59,KEY et al. v. DOYLE et al.
434 U.S. 77,COMMISSIONER OF INTERNAL REVENUE v. KOWALSKI ET UX.
434 U.S. 99,SHELL OIL CO. v. DARTT
434 U.S. 100,IDAHO DEPARTMENT OF EMPLOYMENT v. SMITH
434 U.S. 106,PENNSYLVANIA v. MIMMS
434 U.S. 125,NEW YORK v. CATHEDRAL ACADEMY
434 U.S. 136,NASHVILLE GAS CO. v. SATTY
434 U.S. 158,RICHMOND UNIFIED SCHOOL DISTRICT v. BERG
434 U.S. 159,UNITED STATES v. NEW YORK TELEPHONE CO.
434 U.S. 192,"UNITED AIR LINES, INC. v. MCMANN"
434 U.S. 220,MOORE v. ILLINOIS
434 U.S. 236,CHASE MANHATTAN BANK (NATIONAL ASSOCIATION) v. SOUTH ACRES DEVELOPMENT CO.
434 U.S. 241,"PHILADELPHIA NEWSPAPERS, INC., et al. v. JEROME, JUDGE"
434 U.S. 241,"EQUITABLE PUBLISHING CO., INC., et al. v. HONEYMAN, JUDGE"
434 U.S. 241,"MONTGOMERY PUBLISHING CO. v. HONEYMAN, JUDGE"
434 U.S. 241,"EQUITABLE PUBLISHING CO., INC., et al. v. BROWN, JUDGE"
434 U.S. 241,"MONTGOMERY PUBLISHING CO. v. BROWN, JUDGE"
434 U.S. 246,QUILLOIN v. WALCOTT ET VIR
434 U.S. 257,"BROWDER v. DIRECTOR, DEPARTMENT OF CORRECTIONS OF ILLINOIS"
434 U.S. 275,ADAMO WRECKING CO. v. UNITED STATES
434 U.S. 308,PFIZER INC. et al. v. GOVERNMENT OF INDIA et al.
434 U.S. 332,"SMITH v. DIGMON, WARDEN, ET AL"
434 U.S. 335,"NATIONAL LABOR RELATIONS BOARD v. LOCAL UNION NO. 103, INTERNATIONAL ASSOCIATION OF BRIDGE, STRUCTURAL & ORNAMENTAL IRON WORKERS, AFL-CIO, et al."
434 U.S. 356,"CARTER, PUBLIC VEHICLE LICENSE COMMISSIONER OF CHICAGO v. MILLER"
434 U.S. 357,"BORDENKIRCHER, PENITENTIARY SUPERINTENDENT v. HAYES"
434 U.S. 374,"ZABLOCKI, MILWAUKEE COUNTY CLERK v. REDHAIL"
434 U.S. 412,CHRISTIANSBURG GARMENT CO. v. EQUAL EMPLOYMENT OPPORTUNITY COMMISSION
434 U.S. 425,VENDO CO. v. LEKTRO-VEND CORP. et al.
434 U.S. 429,"RAYMOND MOTOR TRANSPORTATION, INC., et al. v. RICE, SECRETARY, DEPARTMENT OF TRANSPORTATION OF WISCONSIN, et al."
434 U.S. 452,UNITED STATES STEEL CORP. et al. v. MULTISTATE TAX COMMISSION et al.
434 U.S. 497,ARIZONA et al. v. WASHINGTON
434 U.S. 528,"FULMAN et al., TRUSTEES v. UNITED STATES"
434 U.S. 542,DURST et al. v. UNITED STATES
434 U.S. 555,"PROCUNIER, CORRECTIONS DIRECTOR, et al. v. NAVARETTE"
434 U.S. 575,"LORILLARD, A DIVISION OF LOEW'S THEATRES, INC. v. PONS"
434 U.S. 586,"J. W. BATESON CO., INC., et al. v. UNITED STATES ex rel. BOARD OF TRUSTEES OF THE NATIONAL AUTOMATIC SPRINKLER INDUSTRY PENSION FUND et al."
435 U.S. 1,"CALIFANO, SECRETARY OF HEALTH, EDUCATION, AND WELFARE v. TORRES"
435 U.S. 1,"CALIFANO, SECRETARY OF HEALTH, EDUCATION, AND WELFARE v. COLON et al."
435 U.S. 6,SIMPSON v. UNITED STATES
435 U.S. 6,SIMPSON et al. v. UNITED STATES
435 U.S. 21,CENTRAL ILLINOIS PUBLIC SERVICE CO. v. UNITED STATES
435 U.S. 40,FEDERAL MARITIME COMMISSION et al. v. PACIFIC MARITIME ASSN. et al.
435 U.S. 78,BOARD OF CURATORS OF THE UNIVERSITY OF MISSOURI et al. v. HOROWITZ
435 U.S. 110,"UNITED STATES v. BOARD OF COMMISSIONERS OF SHEFFIELD, ALABAMA, et al."
435 U.S. 151,"RAY, GOVERNOR OF WASHINGTON, et al. v. ATLANTIC RICHFIELD CO. et al."
435 U.S. 191,OLIPHANT v. SUQUAMISH INDIAN TRIBE et al.
435 U.S. 213,"CLELAND, ADMINISTRATOR OF VETERANS' ADMINISTRATION, et al. v. NATIONAL COLLEGE OF BUSINESS"
435 U.S. 223,BALLEW v. GEORGIA
435 U.S. 247,CAREY et al. v. PIPHUS et al.
435 U.S. 268,UNITED STATES v. CECCOLINI
435 U.S. 291,"FOLEY v. CONNELIE, SUPERINTENDENT OF NEW YORK STATE POLICE, et al."
435 U.S. 313,UNITED STATES v. WHEELER
435 U.S. 333,LAKESIDE v. OREGON
435 U.S. 349,STUMP et al. v. SPARKMAN ET VIR
435 U.S. 371,UNITED STATES v. CULBERT
435 U.S. 381,BANKERS TRUST CO. v. MALLIS et al.
435 U.S. 389,"CITY OF LAFAYETTE, LOUISIANA, et al. v. LOUISIANA POWER & LIGHT CO."
435 U.S. 444,MASSACHUSETTS v. UNITED STATES
435 U.S. 475,HOLLOWAY et al. v. ARKANSAS
435 U.S. 497,"MALONE, COMMISSIONER OF LABOR AND INDUSTRY FOR MINNESOTA v. WHITE MOTOR CORP. et al."
435 U.S. 519,"VERMONT YANKEE NUCLEAR POWER CORP. v. NATURAL RESOURCES DEFENSE COUNCIL, INC., et al."
435 U.S. 519,CONSUMERS POWER CO. v. AESCHLIMAN et al.
435 U.S. 559,"PROCTOR v. WARDEN, MARYLAND PENITENTIARY"
435 U.S. 561,FRANK LYON CO. v. UNITED STATES
435 U.S. 589,"NIXON v. WARNER COMMUNICATIONS, INC., et al."
435 U.S. 618,MCDANIEL v. PATY et al.
435 U.S. 647,"ELKINS, PRESIDENT, UNIVERSITY OF MARYLAND v. MORENO et al."
435 U.S. 679,NATIONAL SOCIETY OF PROFESSIONAL ENGINEERS v. UNITED STATES
435 U.S. 702,CITY OF LOS ANGELES DEPARTMENT OF WATER AND POWER et al. v. MANHART et al.
435 U.S. 734,DEPARTMENT OF REVENUE OF WASHINGTON v. ASSOCIATION OF WASHINGTON STEVEDORING COMPANIES et al.
435 U.S. 765,"FIRST NATIONAL BANK OF BOSTON et al. v. BELLOTTI, ATTORNEY GENERAL OF MASSACHUSETTS"
435 U.S. 829,"LANDMARK COMMUNICATIONS, INC. v. VIRGINIA"
435 U.S. 850,UNITED STATES v. MACDONALD
436 U.S. 1,"MEMPHIS LIGHT, GAS & WATER DIVISION et al. v. CRAFT et al."
436 U.S. 31,"UNITED STATES v. JACOBS, AKA 'MRS. KRAMER'"
436 U.S. 32,UNITED STATES v. CALIFORNIA
436 U.S. 49,SANTA CLARA PUEBLO et al. v. MARTINEZ et al.
436 U.S. 84,"KULKO v. SUPERIOR COURT OF CALIFORNIA IN AND FOR THE CITY AND COUNTY OF SAN FRANCISCO (HORN, REAL PARTY IN INTEREST)"
436 U.S. 103,SECURITIES AND EXCHANGE COMMISSION v. SLOAN
436 U.S. 128,SCOTT et al. v. UNITED STATES
436 U.S. 149,"FLAGG BROS., INC., et al. v. BROOKS et al."
436 U.S. 149,"LEFKOWITZ, ATTORNEY GENERAL OF NEW YORK v. BROOKS et al."
436 U.S. 149,AMERICAN WAREHOUSEMEN'S ASSN. et al. v. BROOKS et al.
436 U.S. 180,"SEARS, ROEBUCK & CO. v. SAN DIEGO COUNTY DISTRICT COUNCIL OF CARPENTERS"
436 U.S. 238,SLODOV v. UNITED STATES
436 U.S. 268,UNITED STATES v. SOTELO ET UX.
436 U.S. 293,"PINKUS, DBA ROSSLYN NEWS CO. et al. v. UNITED STATES"
436 U.S. 307,"MARSHALL, SECRETARY OF LABOR, et al. v. BARLOW'S, INC."
436 U.S. 340,UNITED STATES v. MAURO et al.
436 U.S. 340,UNITED STATES v. FORD
436 U.S. 371,BALDWIN et al. v. FISH AND GAME COMMISSION OF MONTANA et al.
436 U.S. 407,"VITEK, DIRECTOR, DEPARTMENT OF CORRECTIONAL SERVICES, et al. v. JONES et al."
436 U.S. 412,In re PRIMUS
436 U.S. 447,OHRALIK v. OHIO STATE BAR ASSN.
436 U.S. 478,TAYLOR v. KENTUCKY
436 U.S. 493,"GENERAL ATOMIC CO. v. FELTER, JUDGE, et al."
436 U.S. 499,MICHIGAN v. TYLER et al.
436 U.S. 519,CALIFORNIA et al. v. SOUTHLAND ROYALTY CO. et al.
436 U.S. 519,EL PASO NATURAL GAS CO. v. SOUTHLAND ROYALTY CO. et al.
436 U.S. 519,FEDERAL ENERGY REGULATORY COMMISSION v. SOUTHLAND ROYALTY CO. et al.
436 U.S. 547,"ZURCHER, CHIEF OF POLICE OF PALO ALTO, et al. v. STANFORD DAILY et al."
436 U.S. 547,"BERGNA, DISTRICT ATTORNEY OF SANTA CLARA COUNTY, et al. v. STANFORD DAILY et al."
436 U.S. 584,"ROBERTSON v. WEGMANN, EXECUTOR, et al."
436 U.S. 604,"ANDRUS, SECRETARY OF THE INTERIOR v. CHARLESTONE STONE PRODUCTS CO."
436 U.S. 618,"MOBIL OIL CORP. v. HIGGINBOTHAM, ADMINISTRATRIX, et al."
436 U.S. 631,MOBIL ALASKA PIPELINE CO. v. UNITED STATES et al.
436 U.S. 631,EXXON PIPELINE CO. v. UNITED STATES et al.
436 U.S. 631,"BP PIPELINES, INC. v. UNITED STATES et al."
436 U.S. 631,ARCO PIPE LINE CO. v. UNITED STATES et al.
436 U.S. 658,MONELL et al. v. DEPARTMENT OF SOCIAL SERVICES OF THE CITY OF NEW YORK et al.
436 U.S. 725,"QUERN, DIRECTOR, DEPARTMENT OF PUBLIC AID OF ILLINOIS, et al. v. MANDLEY et al."
436 U.S. 725,"CALIFANO, SECRETARY OF HEALTH, EDUCATION, AND WELFARE v. MANDLEY et al."
436 U.S. 748,AGOSTO v. IMMIGRATION AND NATURALIZATION SERVICE
436 U.S. 775,FEDERAL COMMUNICATIONS COMMISSION v. NATIONAL CITIZENS COMMITTEE FOR BROADCASTING et al.
436 U.S. 775,CHANNEL TWO TELEVISION CO. et al. v. NATIONAL CITIZENS COMMITTEE FOR BROADCASTING
436 U.S. 775,NATIONAL ASSOCIATION OF BROADCASTERS v. FEDERAL COMMUNICATIONS COMMISSION et al.
436 U.S. 775,AMERICAN NEWSPAPER PUBLISHERS ASSN. v. NATIONAL CITIZENS COMMITTEE FOR BROADCASTING et al.
436 U.S. 775,"ILLINOIS BROADCASTING CO., INC., et al. v. NATIONAL CITIZENS COMMITTEE FOR BROADCASTING et al."
436 U.S. 775,POST CO. et al. v. NATIONAL CITIZENS COMMITTEE FOR BROADCASTING et al.
436 U.S. 816,NATIONAL BROILER MARKETING ASSN. v. UNITED STATES
436 U.S. 850,"TERK v. GORDON, DIRECTOR, NEW MEXICO DEPARTMENT OF FISH AND GAME, et al."
437 U.S. 1,BURKS v. UNITED STATES
437 U.S. 19,"GREENE v. MASSEY, CORRECTIONAL SUPERINTENDENT"
437 U.S. 28,"CRIST, WARDEN, et al. v. BRETZ et al."
437 U.S. 54,SANABRIA v. UNITED STATES
437 U.S. 82,UNITED STATES v. SCOTT
437 U.S. 117,EXXON CORP. et al. v. GOVERNOR OF MARYLAND et al.
437 U.S. 117,SHELL OIL CO. v. GOVERNOR OF MARYLAND et al.
437 U.S. 117,CONTINENTAL OIL CO. et al. v. GOVERNOR OF MARYLAND et al.
437 U.S. 117,GULF OIL CORP. v. GOVERNOR OF MARYLAND et al.
437 U.S. 117,"ASHLAND OIL, INC., et al. v. GOVERNOR OF MARYLAND et al."
437 U.S. 153,TENNESSEE VALLEY AUTHORITY v. HILL et al.
437 U.S. 214,NATIONAL LABOR RELATIONS BOARD v. ROBBINS TIRE & RUBBER CO.
437 U.S. 255,FIRST FEDERAL SAVINGS & LOAN ASSOCIATION OF BOSTON et al. v. TAX COMMISSION OF MASSACHUSETTS et al.
437 U.S. 267,"MOORMAN MANUFACTURING CO. v. BAIR, DIRECTOR OF REVENUE OF IOWA"
437 U.S. 298,UNITED STATES et al. v. LASALLE NATIONAL BANK et al.
437 U.S. 322,"GREYHOUND CORP. et al. v. MT. HOOD STAGES, INC., DBA PACIFIC TRAILWAYS"
437 U.S. 340,"OPPENHEIMER FUND, INC., et al. v. SANDERS et al."
437 U.S. 365,"OWEN EQUIPMENT & ERECTION CO. v. KROGER, ADMINISTRATRIX"
437 U.S. 385,MINCEY v. ARIZONA
437 U.S. 411,"AMERICAN BROADCASTING COMPANIES, INC., et al. v. WRITERS GUILD OF AMERICA, WEST, INC., et al."
437 U.S. 411,"ASSOCIATION OF MOTION PICTURE & TELEVISION PRODUCERS, INC. v. WRITERS GUILD OF AMERICA, WEST, INC., et al."
437 U.S. 411,"NATIONAL LABOR RELATIONS BOARD v. WRITERS GUILD OF AMERICA, WEST, INC., et al."
437 U.S. 443,ZENITH RADIO CORP. v. UNITED STATES
437 U.S. 463,COOPERS & LYBRAND v. LIVESAY et al.
437 U.S. 478,GARDNER v. WESTINGHOUSE BROADCASTING CO.
437 U.S. 483,BETH ISRAEL HOSPITAL v. NATIONAL LABOR RELATIONS BOARD
437 U.S. 518,"HICKLIN et al. v. ORBECK, COMMISSIONER, DEPARTMENT OF LABOR OF ALASKA, et al."
437 U.S. 535,"WISE, MAYOR OF DALLAS, et al. v. LIPSCOMB et al."
437 U.S. 556,"EASTEX, INC. v. NATIONAL LABOR RELATIONS BOARD"
437 U.S. 584,"PARKER, ACTING COMMISSIONER OF PATENTS AND TRADEMARKS v. FLOOK"
437 U.S. 601,CALIFORNIA v. TEXAS
437 U.S. 617,CITY OF PHILADELPHIA et al. v. NEW JERSEY et al.
437 U.S. 634,UNITED STATES v. JOHN et al.
437 U.S. 634,JOHN et al. v. MISSISSIPPI
437 U.S. 655,"WILL, U. S. DISTRICT JUDGE v. CALVERT FIRE INSURANCE CO. et al."
437 U.S. 678,HUTTO et al. v. FINNEY et al.
438 U.S. 1,"HOUCHINS, SHERIFF OF THE COUNTY OF ALAMEDA, CALIFORNIA v. KQED, INC., et al."
438 U.S. 41,UNITED STATES v. GRAYSON
438 U.S. 59,"DUKE POWER CO. v. CAROLINA ENVIRONMENTAL STUDY GROUP, INC., et al."
438 U.S. 59,"UNITED STATES NUCLEAR REGULATORY COMMISSION et al. v. CAROLINA ENVIRONMENTAL STUDY GROUP, INC., et al."
438 U.S. 104,PENN CENTRAL TRANSPORTATION CO. et al. v. NEW YORK CITY et al.
438 U.S. 154,FRANKS v. DELAWARE
438 U.S. 190,BERRY et al. v. DOLES et al.
438 U.S. 189,"MCADAMS, EXECUTOR, et al. v. MCSURELY ET UX."
438 U.S. 204,"SWISHER, STATE'S ATTORNEY FOR BALTIMORE CITY, et al. v. BRADY et al."
438 U.S. 234,"ALLIED STRUCTURAL STEEL CO. v. SPANNAUS, ATTORNEY GENERAL OF MINNESOTA, et al."
438 U.S. 265,REGENTS OF THE UNIVERSITY OF CALIFORNIA v. BAKKE
438 U.S. 422,UNITED STATES v. UNITED STATES GYPSUM CO. et al.
438 U.S. 478,BUTZ et al. v. ECONOMOU et al.
438 U.S. 531,ST. PAUL FIRE & MARINE INSURANCE CO. et al. v. BARRY et al.
438 U.S. 567,FURNCO CONSTRUCTION CORP. v. WATERS et al.
438 U.S. 586,LOCKETT v. OHIO
438 U.S. 637,BELL v. OHIO
438 U.S. 645,CALIFORNIA et al. v. UNITED STATES
438 U.S. 696,UNITED STATES v. NEW MEXICO
438 U.S. 726,FEDERAL COMMUNICATIONS COMMISSION v. PACIFICA FOUNDATION et al.
438 U.S. 781,ALABAMA et al. v. PUGH et al.
439 U.S. 1,LONG ISLAND RAIL ROAD CO. v. ABERDEEN & ROCKFISH RAILROAD CO. et al.
439 U.S. 8,"CAREY, STATE'S ATTORNEY OF COOK COUNTY, ILLINOIS v. WYNN et al."
439 U.S. 8,DIAMOND v. WYNN et al.
439 U.S. 9,NATIONAL LABOR RELATIONS BOARD v. BAYLOR UNIVERSITY MEDICAL CENTER
439 U.S. 14,PRESNELL v. GEORGIA
439 U.S. 24,BOARD OF TRUSTEES OF KEENE STATE COLLEGE et al. v. SWEENEY
439 U.S. 30,UNITED STATES v. CALIFORNIA
439 U.S. 32,"DOUGHERTY COUNTY, GEORGIA, BOARD OF EDUCATION et al. v. WHITE"
