usCite,caseName
500 U.S. 305,DWIGHT H. OWEN v. HELEN OWEN
500 U.S. 322,"SUMMIT HEALTH, LTD., et al. v. SIMON J. PINHAS"
500 U.S. 344,THOMAS BRAXTON v. UNITED STATES
500 U.S. 352,DIONISIO HERNANDEZ v. NEW YORK
500 U.S. 380,STATE OF ILLINOIS v. COMMONWEALTH OF KENTUCKY
500 U.S. 391,"DALE ROBERT YATES v. PARKER EVATT, COMMISSIONER, SOUTH CAROLINA DEPARTMENT OF CORRECTIONS, et al."
500 U.S. 415,DAWUD MAJID MU'MIN v. VIRGINIA
500 U.S. 453,"RICHARD L. CHAPMAN, JOHN M. SCHOENECKER AND PATRICK BRUMM v. UNITED STATES"
500 U.S. 478,CATHY BURNS v. RICK REED
500 U.S. 507,JAMES P. LEHNERT et al. v. FERRIS FACULTY ASSOCIATION et al.
500 U.S. 565,CALIFORNIA v. CHARLES STEVEN ACEVEDO
500 U.S. 603,"EXXON CORPORATION v. CENTRAL GULF LINES, INC., et al."
500 U.S. 614,"THADDEUS DONALD EDMONSON v. LEESVILLE CONCRETE CO., INC."
500 U.S. 646,"JANICE G. CLARK et al. v. CHARLES 'BUDDY' ROEMER, GOVERNOR OF LOUISIANA, et al."
501 U.S. 1,CONNECTICUT AND JOHN F. DIGIOVANNI v. BRIAN K. DOEHR
501 U.S. 32,"G. RUSSELL CHAMBERS v. NASCO, INC."
501 U.S. 78,CURTIS REED JOHNSON v. HOME STATE BANK
501 U.S. 89,"ZAKHAR MELKONYAN v. LOUIS W. SULLIVAN, SECRETARY OF HEALTH AND HUMAN SERVICES"
501 U.S. 104,ASTORIA FEDERAL SAVINGS AND LOAN ASSOCIATION v. ANGELO J. SOLIMINO
501 U.S. 115,"KEITH R. GOLLUST, et al. v. IRA L. MENDELL, ETC., et al."
501 U.S. 129,WILLIAM J. BURNS v. UNITED STATES
501 U.S. 157,SHELDON BARUCH TOIBB v. STUART J. RADLOFF
501 U.S. 171,PAUL MCNEIL v. WISCONSIN
501 U.S. 190,"LITTON FINANCIAL PRINTING DIVISION, A DIVISION OF LITTON BUSINESS SYSTEMS, INC. v. NATIONAL LABOR RELATIONS BOARD, et al."
501 U.S. 221,STATES OF OKLAHOMA AND TEXAS &NBSP;v. STATE OF NEW MEXICO
501 U.S. 252,"METROPOLITAN WASHINGTON AIRPORTS AUTHORITY, et al. v. CITIZENS FOR THE ABATEMENT OF AIRCRAFT NOISE, INC., et al."
501 U.S. 294,"PEARLY L. WILSON v. RICHARD SEITER, et al."
501 U.S. 312,"LOUISE RENNE, SAN FRANCISCO CITY ATTORNEY, et al. v. BOB GEARY, et al."
501 U.S. 350,"LAMPF, PLEVA, LIPKIND, PRUPIS & PETIGROW v. JOHN GILBERTSON, et al."
501 U.S. 380,"RONALD CHISOM, et al. v. CHARLES E. ROEMER, GOVERNOR OF LOUISIANA, et al."
501 U.S. 380,"UNITED STATES v. ROEMER, GOVERNOR OF LOUISIANA, et al."
501 U.S. 419,"HOUSTON LAWYERS' ASSOCIATION, et al. v. ATTORNEY GENERAL OF TEXAS, et al."
501 U.S. 419,LEAGUE OF UNITED LATIN AMERICAN CITIZENS et al. v. ATTORNEY GENERAL OF TEXAS et al.
501 U.S. 429,FLORIDA v. BOSTICK
501 U.S. 452,"ELLIS GREGORY, JR. AND ANTHONY P. NUGENT, JR., JUDGES v. JOHN D. ASHCROFT, GOVERNOR OF MISSOURI"
501 U.S. 496,"JEFFREY M. MASSON v. NEW YORKER MAGAZINE, INC., ALFRED A. KNOPF, INC. AND JANET MALCOLM"
501 U.S. 529,JAMES B. BEAM DISTILLING CO. v. GEORGIA et al.
501 U.S. 560,"MICHAEL BARNES, PROSECUTING ATTORNEY OF ST. JOSEPH COUNTY, INDIANA, et al. v. GLEN THEATRE, INC., et al."
501 U.S. 597,"WISCONSIN PUBLIC INTERVENOR, et al. v. RALPH MORTIER, et al."
501 U.S. 624,"EDWARD HAROLD SCHAD, JR. v. ARIZONA"
501 U.S. 663,"COHEN v. COWLES MEDIA CO., DBA MINNEAPOLIS STAR & TRIBUNE CO., et al."
501 U.S. 680,"HARRIET PAULEY, SURVIVOR OF JOHN C. PAULEY v. BETHENERGY MINES, INC., ET AL"
501 U.S. 680,"CLINCHFIELD COAL CO. v. DIRECTOR, OFFICE OF WORKERS' COMPENSATION PROGRAMS, UNITED STATES DEPARTMENT OF LABOR, et al."
501 U.S. 680,"CONSOLIDATION COAL CO. v. DIRECTOR, OFFICE OF WORKERS' COMPENSATION PROGRAMS, UNITED STATES DEPARTMENT OF LABOR, et al."
501 U.S. 722,"ROGER KEITH COLEMAN v. CHARLES E. THOMPSON, WARDEN"
501 U.S. 775,"EDGAR BLATCHFORD, COMMISSIONER, DEPARTMENT OF COMMUNITY AND REGIONAL AFFAIRS OF ALASKA v. NATIVE VILLAGE OF NOATAK AND CIRCLE VILLAGE"
501 U.S. 797,"EDDIE S. YLST, WARDEN v. OWEN DUANE NUNNEMAKER"
501 U.S. 808,PERVIS TYRONE PAYNE v. TENNESSEE
501 U.S. 868,"THOMAS FREYTAG, et al. v. COMMISSIONER OF INTERNAL REVENUE"
501 U.S. 923,PERETZ v. UNITED STATES
501 U.S. 957,RONALD ALLEN HARMELIN v. MICHIGAN
501 U.S. 1030,DOMINIC P. GENTILE v. STATE BAR OF NEVADA
501 U.S. 1083,"VIRGINIA BANKSHARES, INC., et al. v. DORIS I. SANDBERG, et al."
502 U.S. 1,UNITED STATES v. ALEJANDRO GARCIA IBARRA
502 U.S. 9,RAYMOND MIRELES v. HOWARD WACO
502 U.S. 16,VLADIMIR ZATKO v. CALIFORNIA
502 U.S. 16,VLADIMIR ZATKO v. UNITED STATES DISTRICT COURT FOR THE NORTHERN DISTRICT OF CALIFORNIA
502 U.S. 16,VLADIMIR ZATKO v. UNITED STATES DISTRICT COURT FOR THE NORTHERN DISTRICT OF CALIFORNIA
502 U.S. 16,VLADIMIR ZATKO v. UNITED STATES
502 U.S. 16,JAMES L. MARTIN v. SALLY MRVOS
502 U.S. 16,"JAMES L. MARTIN v. EDWARD C. SMITH, et al."
502 U.S. 16,"JAMES L. MARTIN v. DELAWARE LAW SCHOOL OF WIDENER UNIVERSITY, INC., et al."
502 U.S. 16,"JAMES L. MARTIN v. JOHN D. WALMER, et al."
502 U.S. 16,"JAMES L. MARTIN v. STEPHEN W. TOWNSEND, et al."
502 U.S. 16,JAMES L. MARTIN v. SUPREME COURT OF NEW JERSEY
502 U.S. 16,VLADIMIR ZATKO v. CALIFORNIA
502 U.S. 16,JAMES MARTIN v. BAR OF THE DISTRICT OF COLUMBIA COURT OF APPEALS
502 U.S. 16,JAMES MARTIN v. DANIEL HUYETT
502 U.S. 16,VLADIMIR ZATKO v. UNITED STATES DISTRICT COURT FOR THE NORTHERN DISTRICT OF CALIFORNIA
502 U.S. 16,VLADIMIR ZATKO v. UNITED STATES DISTRICT COURT FOR THE NORTHERN DISTRICT OF CALIFORNIA
502 U.S. 16,VLADIMIR ZATKO v. CALIFORNIA
502 U.S. 16,VLADIMIR ZATKO v. CALIFORNIA
502 U.S. 21,"BARBARA HAFER v. JAMES C. MELO, JR., et al."
502 U.S. 32,"BOARD OF GOVERNORS OF THE FEDERAL RESERVE SYSTEM OF THE UNITED STATES v. MCORP FINANCIAL, INC., et al."
502 U.S. 32,"MCORP, et al. v. BOARD OF GOVERNORS OF THE FEDERAL RESERVE SYSTEM OF THE UNITED STATES"
502 U.S. 46,DIANE GRIFFIN v. UNITED STATES
502 U.S. 62,"WAYNE ESTELLE, WARDEN v. MARK OWEN MCGUIRE"
502 U.S. 81,"SOUTHWEST MARINE, INC. v. BYRON GIZONI"
502 U.S. 93,"GUY WOODDELL, JR. v. INTERNATIONAL BROTHERHOOD OF ELECTRICAL WORKERS, LOCAL 71, et al."
502 U.S. 104,"ROBERT E. GIBSON v. FLORIDA BAR, et al."
502 U.S. 105,"SIMON & SCHUSTER, INC. v. MEMBERS OF THE NEW YORK STATE CRIME VICTIMS BOARD, et al."
502 U.S. 129,RAFEH-RAFIE ARDESTANI v. IMMIGRATION AND NATURALIZATION SERVICE
502 U.S. 151,"UNION BANK v. HERBERT WOLAS, CHAPTER 7 TRUSTEE FOR THE ESTATE OF ZZZZ BEST CO., INC."
502 U.S. 164,UNITED STATES DEPARTMENT OF STATE v. MICHAEL D. RAY et al.
502 U.S. 183,"IMMIGRATION AND NATURALIZATION SERVICE, et al. v. NATIONAL CENTER FOR IMMIGRANTS' RIGHTS, INC., et al."
502 U.S. 197,KENNETH HILTON v. SOUTH CAROLINA PUBLIC RAILWAYS COMMISSION
502 U.S. 215,WILLIAM 'SKY' KING v. ST. VINCENT'S HOSPITAL
502 U.S. 224,"BRIAN v. HUNTER AND JEFFERY JORDAN v. JAMES v. BRYANT, JR."
502 U.S. 236,"In re JAMES BLODGETT, SUPERINTENDENT, WASHINGTON STATE PENITENTIARY, et al."
502 U.S. 244,"WILLIAM LEWIS SMITH v. WAYNE S. BARRY, et al."
502 U.S. 251,"COUNTY OF YAKIMA, et al. v. CONFEDERATED TRIBES AND BANDS OF THE YAKIMA INDIAN NATION"
502 U.S. 251,"CONFEDERATED TRIBES AND BANDS OF THE YAKIMA INDIAN NATION v. COUNTY OF YAKIMA AND DALE A. GRAY, YAKIMA COUNTY TREASURER"
502 U.S. 279,"BARBARA J. NORMAN, et al. v. DOROTHY REED, et al."
502 U.S. 279,"COOK COUNTY OFFICERS ELECTORAL BOARD, et al. v. DOROTHY REED, et al."
502 U.S. 301,"SHIRLEY M. MOLZOF, PERSONAL REPRESENTATIVE OF THE ESTATE OF ROBERT E. MOLZOF v. UNITED STATES"
502 U.S. 314,IMMIGRATION AND NATURALIZATION SERVICE v. JOSEPH PATRICK DOHERTY
502 U.S. 346,RANDALL D. WHITE v. ILLINOIS
502 U.S. 367,"ROBERT C. RUFO, SHERIFF OF SUFFOLK COUNTY, et al. v. INMATES OF THE SUFFOLK COUNTY JAIL, et al."
502 U.S. 367,"THOMAS C. RAPONE, COMMISSIONER OF CORRECTION OF MASSACHUSETTS v. INMATES OF THE SUFFOLK COUNTY JAIL, et al."
502 U.S. 410,"ALETHA DEWSNUP v. LOUIS L. TIMM, et al."
502 U.S. 437,STATE OF WYOMING v. STATE OF OKLAHOMA
502 U.S. 478,IMMIGRATION AND NATURALIZATION SERVICE v. JAIRO JONATHAN ELIAS-ZACARIAS
502 U.S. 491,"LAWRENCE C. PRESLEY, ETC. v. ETOWAH COUNTY COMMISSION et al."
502 U.S. 491,"ED PETER MACK AND NATHANIEL GOSHA, III, ETC. v. RUSSELL COUNTY COMMISSION et al."
502 U.S. 527,"LECHMERE, INC. v. NATIONAL LABOR RELATIONS BOARD"
503 U.S. 1,"KEITH J. HUDSON v. JACK MCMILLIAN, et al."
503 U.S. 30,"UNITED STATES v. NORDIC VILLAGE INC., DAVID O. SIMON, TRUSTEE"
503 U.S. 47,"HOLYWELL CORPORATION, et al. v. FRED STANTON SMITH, ETC., et al."
503 U.S. 47,"UNITED STATES v. FRED STANTON SMITH, et al."
503 U.S. 60,CHRISTINE FRANKLIN v. GWINNETT COUNTY PUBLIC SCHOOLS AND WILLIAM PRESCOTT.
503 U.S. 79,"INDOPCO, INC. v. COMMISSIONER OF INTERNAL REVENUE."
503 U.S. 91,"ARKANSAS, et al. v. OKLAHOMA, et al."
503 U.S. 91,"ENVIRONMENTAL PROTECTION AGENCY v. OKLAHOMA, et al."
503 U.S. 115,"MYRA JO COLLINS v. CITY OF HARKER HEIGHTS, TEXAS."
503 U.S. 131,"DONALD J. WILLY v. COASTAL CORPORATION, et al."
503 U.S. 140,"JOHN J. MCCARTHY v. LARRY MADIGAN, et al."
503 U.S. 159,DAVID DAWSON v. DELAWARE
503 U.S. 181,"GENERAL MOTORS CORPORATION, et al. v. EVERT ROMEIN et al."
503 U.S. 193,JOSEPH WILLIAMS v. UNITED STATES
503 U.S. 222,"JAMES R. STRINGER v. LEE ROY BLACK, COMMISSIONER, MISSISSIPPI DEPARTMENT OF CORRECTIONS, et al."
503 U.S. 249,"CONNECTICUT NATIONAL BANK v. THOMAS M. GERMAIN, TRUSTEE FOR THE ESTATE OF O'SULLIVAN'S FUEL OIL CO., INC."
503 U.S. 257,"PFZ PROPERTIES, INC. v. RENE ALBERTO RODRIGUEZ et al."
503 U.S. 258,"ROBERT G. HOLMES, JR. v. SECURITIES INVESTOR PROTECTION CORPORATION, et al."
503 U.S. 291,UNITED STATES v. R. L. C.
503 U.S. 318,"NATIONWIDE MUTUAL INSURANCE COMPANY, et al. v. ROBERT T. DARDEN"
503 U.S. 329,UNITED STATES v. RICHARD WILSON
503 U.S. 347,"SUE SUTER, et al. v. ARTIST M., et al."
503 U.S. 378,UNITED STATES v. FRANK DENNIS FELIX
503 U.S. 393,"WILLIAM BARNHILL v. ELLIOT JOHNSON, TRUSTEE"
503 U.S. 407,"NATIONAL RAILROAD PASSENGER CORPORATION, et al. v. BOSTON AND MAINE CORPORATION, et al."
503 U.S. 407,"INTERSTATE COMMERCE COMMISSION AND UNITED STATES v. BOSTON AND MAINE CORPORATION, et al."
503 U.S. 429,"F. DALE ROBERTSON, CHIEF, UNITED STATES FOREST SERVICE, ET. AL. v. SEATTLE AUDUBON SOCIETY et al."
503 U.S. 442,"UNITED STATES DEPARTMENT OF COMMERCE, et al. v. MONTANA, et al."
503 U.S. 467,"ROBERT R. FREEMAN, et al. v. WILLIE EUGENE PITTS, et al."
503 U.S. 519,"JOHN K. YEE, et al. v. CITY OF ESCONDIDO, CALIFORNIA"
503 U.S. 540,KEITH JACOBSON v. UNITED STATES
503 U.S. 562,JOE MARIO TREVINO v. TEXAS
503 U.S. 569,UNITED STATES OF AMERICA v. STATE OF ALASKA ON BILL OF COMPLAINT
503 U.S. 594,"KEYTON E. BARKER AND PAULINE BARKER, et al., PEITTIONERS v. KANSAS, et al."
503 U.S. 607,"UNITED STATES DEPARTMENT OF ENERGY v. OHIO, et al."
503 U.S. 607,"OHIO, et al. v. UNITED STATES DEPARTMENT OF ENERGY"
503 U.S. 638,"ROBERT J. TAYLOR, TRUSTEE v. FREELAND & KRONZ, WENDELL G. FREELAND AND RICHARD F. KRONZ"
503 U.S. 653,"JAMES GOMEZ AND DANIEL VASQUEZ v. UNITED STATES DISTRICT COURT FOR THE NORTHERN DISTRICT OF CALIFORNIA, et al."
504 U.S. 1,"J. C. KEENEY, SUPERINTENDENT, OREGON STATE PENITENTIARY v. JOSE TAMAYO-REYES"
504 U.S. 25,"GEORGE F. DENTON, DIRECTOR OF CORRECTIONS OF CALIFORNIA, et al. v. MIKE HERNANDEZ"
504 U.S. 36,"UNITED STATES v. JOHN H. WILLIAMS, JR."
504 U.S. 71,TERRY FOUCHA v. LOUISIANA
504 U.S. 127,DAVID RIGGINS v. NEVADA
504 U.S. 158,"HOWARD WYATT v. BILL COLE AND JOHN ROBBINS, II"
504 U.S. 181,HAROLD RAY WADE v. UNITED STATES
504 U.S. 188,"ROGER KEITH COLEMAN v. CHARLES E. THOMPSON, WARDEN, et al."
504 U.S. 191,"CHARLES W. BURSON, ATTORNEY GENERAL AND REPORTER FOR TENNESSEE v. MARY REBECCA FREEMAN"
504 U.S. 229,"UNITED STATES v. THERESE A. BURKE, CYNTHIA R. CENTER, AND LINDA G. GIBBS"
504 U.S. 255,"JOHN H. EVANS, JR. v. UNITED STATES"
504 U.S. 298,"QUILL CORPORATION v. NORTH DAKOTA BY AND THROUGH ITS TAX COMMISSIONER, HEIDI HEITKAMP"
504 U.S. 334,"CHEMICAL WASTE MANAGEMENT, INC. v. GUY HUNT, GOVERNOR OF ALABAMA et al."
504 U.S. 353,"FORT GRATIOT SANITARY LANDFILL, INC. v. MICHIGAN DEPARTMENT OF NATURAL RESOURCES et al."
504 U.S. 374,"DAN MORALES, ATTORNEY GENERAL OF TEXAS v. TRANS WORLD AIRLINES, INC., et al."
504 U.S. 428,"ALAN B. BURDICK v. MORRIS TAKUSHI, DIRECTOR OF ELECTIONS OF HAWAII, et al."
504 U.S. 451,"EASTMAN KODAK COMPANY v. IMAGE TECHNICAL SERVICES, INC., et al."
504 U.S. 505,UNITED STATES v. THOMPSON/CENTER ARMS COMPANY
504 U.S. 527,DENNIS SOCHOR v. FLORIDA
504 U.S. 555,"MANUEL LUJAN, JR., SECRETARY OF THE INTERIOR v. DEFENDERS OF WILDLIFE, et al."
504 U.S. 607,"REPUBLIC OF ARGENTINA AND BANCO CENTRAL DE LA REPUBLICA ARGENTINA v. WELTOVER, INC., et al."
504 U.S. 621,"FEDERAL TRADE COMMISSION v. TICOR TITLE INSURANCE COMPANY, et al."
504 U.S. 648,BURLINGTON NORTHERN RAILROAD COMPANY v. WILLIAM D. FORD AND THOMAS L. JOHNSON
504 U.S. 655,UNITED STATES v. HUMBERTO ALVAREZ-MACHAIN
504 U.S. 689,"CAROL ANKENBRANDT, AS NEXT FRIEND AND MOTHER OF L. R. AND S. R. v. JON A. RICHARDS AND DEBRA KESLER"
504 U.S. 719,DERRICK MORGAN v. ILLINOIS
504 U.S. 753,"JOHN R. PATTERSON, TRUSTEE v. JOSEPH B. SHUMATE, JR."
504 U.S. 768,"ALLIED-SIGNAL, INC., AS SUCCESSOR-IN-INTEREST TO THE BENDIX CORPORATION v. DIRECTOR, DIVISION OF TAXATION"
505 U.S. 1,"STEPHANIE NORDLINGER v. KENNETH HAHN, IN HIS CAPACITY AS TAX ASSESSOR FOR LOS ANGELES COUNTY, et al."
505 U.S. 42,"GEORGIA v. THOMAS MCCOLLUM, WILLIAM JOSEPH MCCOLLUM AND ELLA HAMPTON MCCOLLUM"
505 U.S. 71,"KRAFT GENERAL FOODS, INC. v. IOWA DEPARTMENT OF REVENUE AND FINANCE"
505 U.S. 88,"MARY GADE, DIRECTOR, ILLINOIS ENVIRONMENTAL PROTECTION AGENCY v. NATIONAL SOLID WASTES MANAGEMENT ASSOCIATION"
505 U.S. 123,"FORSYTH COUNTY, GEORGIA v. THE NATIONALIST MOVEMENT"
505 U.S. 144,NEW YORK v. UNITED STATES et al.
505 U.S. 144,"COUNTY OF ALLEGANY, NEW YORK v. UNITED STATES et al."
505 U.S. 144,"COUNTY OF CORTLAND, NEW YORK v. UNITED STATES et al."
505 U.S. 214,"WISCONSIN DEPARTMENT OF REVENUE v. WILLIAM WRIGLEY, JR., CO."
505 U.S. 247,AMERICAN NATIONAL RED CROSS v. S. G. AND A. E.
505 U.S. 277,"ELLIS B. WRIGHT, JR., WARDEN AND MARY SUE TERRY, ATTORNEY GENERAL OF VIRGINIA v. FRANK ROBERT WEST, JR."
505 U.S. 317,"UNITED STATES v. ANTHONY SALERNO, et al."
505 U.S. 333,"ROBERT WAYNE SAWYER v. JOHN WHITLEY, WARDEN"
505 U.S. 377,"R. A. V. v. CITY OF ST. PAUL, MINNESOTA"
505 U.S. 437,"TEOFILO MEDINA, JR. v. CALIFORNIA"
505 U.S. 469,"ESTATE OF FLOYD COWART v. NICKLOS DRILLING COMPANY, et al."
505 U.S. 504,"THOMAS CIPOLLONE, INDIVIDUALLY AND AS EXECUTOR OF THE ESTATE OF ROSE D. CIPOLLONE v. LIGGETT GROUP, INC., et al."
505 U.S. 557,"CITY OF BURLINGTON v. ERNEST DAGUE, SR., et al."
505 U.S. 577,"ROBERT E. LEE, INDIVIDUALLY AND AS PRINCIPAL OF NATHAN BISHOP MIDDLE SCHOOL, et al. v. DANIEL WEISMAN ETC."
505 U.S. 647,MARC GILBERT DOGGETT v. UNITED STATES
505 U.S. 672,"INTERNATIONAL SOCIETY FOR KRISHNA CONSCIOUSNESS, INC., AND BRIAN RUMBAUGH v. WALTER LEE"
505 U.S. 717,"UNITED STATES v. KIRK FORDICE, GOVERNOR OF MISSISSIPPI, et al."
505 U.S. 717,"JAKE AYERS, et al. v. KIRK FORDICE, GOVERNOR OF MISSISSIPPI, et al."
505 U.S. 763,"TWO PESOS, INC. v. TACO CABANA, INC."
505 U.S. 788,"BARBARA FRANKLIN, SECRETARY OF COMMERCE, et al. v. MASSACHUSETTS et al."
505 U.S. 830,"WALTER LEE, SUPERINTENDENT OF PORT AUTHORITY POLICE v. INTERNATIONAL SOCIETY FOR KRISHNA CONSCIOUSNESS, INC., et al."
505 U.S. 833,"PLANNED PARENTHOOD OF SOUTHEASTERN PENNSYLVANIA, et al. v. ROBERT P. CASEY, et al., ETC."
505 U.S. 833,"ROBERT P. CASEY, et al., ETC. v. PLANNED PARENTHOOD OF SOUTHEASTERN PENNSYLVANIA et al."
505 U.S. 1003,DAVID H. LUCAS v. SOUTH CAROLINA COASTAL COUNCIL
505 U.S. 1079,HENRY JOSE ESPINOSA v. FLORIDA
505 U.S. 1084,"LEONA BENTEN, et al. v. DAVID KESSLER, COMMISSIONER, FOOD AND DRUG ADMINISTRATION, et al."
506 U.S. 1,"JAMES L. MARTIN v. DISTRICT OF COLUMBIA COURT OF APPEALS, et al."
506 U.S. 1,"JAMES L. MARTIN v. CHRISTINE MCDERMOTT, et al."
506 U.S. 5,MONTANA v. DONALD GLENN IMLAY
506 U.S. 9,CHURCH OF SCIENTOLOGY OF CALIFORNIA v. UNITED STATES AND FRANK S. ZOLIN
506 U.S. 19,VERL HADLEY v. UNITED STATES
506 U.S. 20,"AL C. PARKE, WARDEN v. RICKY HAROLD RALEY"
506 U.S. 40,"WILLIE LEE RICHMOND v. SAMUEL A. LEWIS, DIRECTOR, ARIZONA DEPARTMENT OF CORRECTIONS, et al."
506 U.S. 56,"EDWARD SOLDAL, ET UX. v. COOK COUNTY, ILLINOIS et al."
506 U.S. 73,"MISSISSIPPI, et al. v. LOUISIANA et al."
506 U.S. 80,REPUBLIC NATIONAL BANK OF MIAMI v. UNITED STATES
506 U.S. 103,"DALE FARRAR AND PAT SMITH, CO-ADMINISTRATORS OF ESTATE OF JOSEPH D. FARRAR, DECEASED v. WILLIAM P. HOBBY, JR."
506 U.S. 125,"THE DISTRICT OF COLUMBIA AND SHARON PRATT KELLY, MAYOR v. THE GREATER WASHINGTON BOARD OF TRADE"
506 U.S. 139,"PUERTO RICO AQUEDUCT AND SEWER AUTHORITY v. METCALF & EDDY, INC."
506 U.S. 153,"BATH IRON WORKS CORPORATION, et al. v. DIRECTOR, OFFICE OF WORKERS' COMPENSATION PROGRAMS, ETC., et al."
506 U.S. 168,COMMISSIONER OF INTERNAL REVENUE v. NADER E. SOLIMAN
506 U.S. 194,"JAMES ROWLAND, FORMER DIRECTOR, CALIFORNIA DEPARTMENT OF CORRECTIONS, et al. v. CALIFORNIA MEN'S COLONY, UNIT II MEN'S ADVISORY COUNCIL"
506 U.S. 224,WALTER L. NIXON v. UNITED STATES et al.
506 U.S. 255,MICHAEL CROSBY v. UNITED STATES
506 U.S. 263,"JAYNE BRAY, et al. v. ALEXANDRIA WOMEN'S HEALTH CLINIC et al."
506 U.S. 357,"WILBURN DOBBS v. WALTER D. ZANT, WARDEN"
506 U.S. 364,"A. L. LOCKHART, DIRECTOR, ARKANSAS DEPARTMENT OF CORRECTION v. BOBBY RAY FRETWELL"
506 U.S. 390,"LEONEL TORRES HERRERA v. JAMES A. COLLINS, DIRECTOR, TEXAS DEPARTMENT OF CRIMINAL JUSTICE, INSTITUTIONAL DIVISION"
506 U.S. 447,"SPECTRUM SPORTS, INC., et al. v. SHIRLEY MCQUILLAN, ET VIR, DBA SORBOTURF ENTERPRISES"
506 U.S. 461,"GARY GRAHAM v. JAMES A. COLLINS, DIRECTOR, TEXAS DEPARTMENT OF CRIMINAL JUSTICE, INSTITUTIONAL DIVISION"
506 U.S. 523,SHELDON B. BUFFERD v. COMMISSIONER OF INTERNAL REVENUE
506 U.S. 534,"GLORIA ZAFIRO, JOSE MARTINEZ, SALVADOR GARCIA AND ALFONSO SOTO v. UNITED STATES"
506 U.S. 546,"UNITED STATES v. WILLIAM F. HILL, ET UX."
507 U.S. 1,UNITED STATES v. JERRY J. NACHTIGAL
507 U.S. 7,"UNITED STATES OF AMERICA v. STATE OF LOUISIANA, et al. (ALABAMA AND MISSISSIPPI BOUNDARY CASE)"
507 U.S. 25,"JOAN GROWE, SECRETARY OF STATE OF MINNESOTA, et al. v. JAMES EMISON, et al."
507 U.S. 43,WILLIAM FEX v. MICHIGAN
507 U.S. 60,"ITEL CONTAINERS INTERNATIONAL CORPORATION v. JOE HUDDLESTON, COMMISSIONER OF REVENUE OF TENNESSEE"
507 U.S. 87,UNITED STATES v. SHARON DUNNIGAN
507 U.S. 99,"EMERY L. NEGONSOTT v. HAROLD SAMUELS, WARDEN, et al."
507 U.S. 111,"UNITED STATES v. A PARCEL OF LAND, BUILDINGS, APPURTENANCES AND IMPROVEMENTS, KNOWN AS 92 BUENA VISTA AVENUE, RUMSON, NEW JERSEY, et al."
507 U.S. 146,"GEORGE VOINOVICH, GOVERNOR OF OHIO, et al. v. BARNEY QUILTER, SPEAKER PRO TEMPORE OF OHIO HOUSE OF REPRESENTATIVES, et al."
507 U.S. 163,"CHARLENE LEATHERMAN, et al. v. TARRANT COUNTY NARCOTICS INTELLIGENCE AND COORDINATION UNIT, et al."
507 U.S. 170,"BOB REVES, et al. v. ERNST & YOUNG"
507 U.S. 197,SANDRA JEAN SMITH v. UNITED STATES
507 U.S. 218,"BUILDING AND CONSTRUCTION TRADES COUNCIL OF THE METROPOLITAN DISTRICT v. ASSOCIATED BUILDERS AND CONTRACTORS OF MASSACHUSETTS/RHODE ISLAND, INC., et al."
507 U.S. 218,"MASSACHUSETTS WATER RESOURCES AUTHORITY, et al. v. ASSOCIATED BUILDERS AND CONTRACTORS OF MASSACHUSETTS/RHODE ISLAND, INC., et al."
507 U.S. 234,JOSE ANTONIO ORTEGA-RODRIGUEZ v. UNITED STATES
507 U.S. 258,"PETER C. REITER, et al. v. LANGDON M. COOPER, TRUSTEE FOR CAROLINA MOTOR EXPRESS, INC., et al."
507 U.S. 272,"PAUL DELO, SUPERINTENDENT, POTOSI CORRECTIONAL CENTER v. FREDERICK LASHLEY"
507 U.S. 290,"JOHN ROBERT DEMOS, JR. v. MICHAEL C. STORRIE, et al."
507 U.S. 292,"JANET RENO, ATTORNEY GENERAL, et al. v. JENNY LISETTE FLORES et al."
507 U.S. 349,"SAUDI ARABIA, KING FAISAL SPECIALIST HOSPITAL AND ROYSPEC v. SCOTT NELSON ET UX."
507 U.S. 380,PIONEER INVESTMENT SERVICES COMPANY v. BRUNSWICK ASSOCIATES LIMITED PARTNERSHIP et al.
507 U.S. 410,"CITY OF CINCINNATI v. DISCOVERY NETWORK, INC., et al."
507 U.S. 447,UNITED STATES BY AND THROUGH INTERNAL REVENUE SERVICE v. BRUCE J. MCDERMOTT et al.
507 U.S. 463,"A. J. ARAVE, WARDEN v. THOMAS E. CREECH"
507 U.S. 490,"STATE OF DELAWARE v. STATE OF NEW YORK, et al."
507 U.S. 511,"THOMAS F. CONROY v. WALTER ANISKOFF, JR., et al."
507 U.S. 529,"UNITED STATES, et al. v. TEXAS et al."
507 U.S. 545,UNITED STATES v. LOWELL GREEN
507 U.S. 546,"NEWARK MORNING LEDGER CO., AS SUCCESSOR TO THE HERALD COMPANY v. UNITED STATES"
507 U.S. 584,STATE OF NEBRASKA v. STATES OF WYOMING AND COLORADO
507 U.S. 604,"HAZEN PAPER COMPANY, et al. v. WALTER F. BIGGINS"
507 U.S. 619,"TODD A. BRECHT v. GORDON A. ABRAHAMSON, SUPERINTENDENT, DODGE CORRECTIONAL INSTITUTION"
507 U.S. 658,"CSX TRANSPORTATION, INC. v. LIZZIE BEATRICE EASTERWOOD"
507 U.S. 658,"LIZZIE BEATRICE EASTERWOOD v. CSX TRANSPORTATION, INC."
507 U.S. 680,"PAMELA WITHROW v. ROBERT ALLEN WILLIAMS, JR."
507 U.S. 725,"UNITED STATES v. GUY W. OLANO, JR., AND RAYMOND M. GRAY"
507 U.S. 746,UNITED STATES v. CALIFORNIA AND CALIFORNIA STATE BOARD OF EQUALIZATION
507 U.S. 761,"FRED H. EDENFIELD, et al. v. SCOTT FANE"
508 U.S. 1,"UNITED STATES v. IDAHO, ex rel. DIRECTOR, IDAHO DEPARTMENT OF WATER RESOURCES"
508 U.S. 10,"HENRY G. CISNEROS, SECRETARY OF HOUSING AND URBAN DEVELOPMENT, et al. v. ALPINE RIDGE GROUP et al."
508 U.S. 22,"LYNWOOD MOREAU, ETC., et al. v. JOHNNY KLEVENHAGEN, SHERIFF, HARRIS COUNTY, TEXAS, et al."
508 U.S. 36,TERRY LYNN STINSON v. UNITED STATES
508 U.S. 49,"PROFESSIONAL REAL ESTATE INVESTORS, INC., et al. v. COLUMBIA PICTURES INDUSTRIES, INC., et al."
508 U.S. 77,UNITED STATES v. XAVIER v. PADILLA et al.
508 U.S. 83,"CARDINAL CHEMICAL COMPANY, ETC., et al. v. MORTON INTERNATIONAL, INC."
508 U.S. 106,WILLIAM MCNEIL v. UNITED STATES
508 U.S. 114,OKLAHOMA TAX COMMISSION v. SAC AND FOX NATION
508 U.S. 129,THOMAS LEE DEAL v. UNITED STATES
508 U.S. 147,"EL VOCERO DE PUERTO RICO (CARIBBEAN INTERNATIONAL NEWS CORP.), et al. v. PUERTO RICO, et al."
508 U.S. 152,"COMMISSIONER OF INTERNAL REVENUE v. KEYSTONE CONSOLIDATED INDUSTRIES, INC."
508 U.S. 165,"UNITED STATES DEPARTMENT OF JUSTICE, et al. v. VINCENT JAMES LANDANO"
508 U.S. 182,"MICHAEL E. LINCOLN, ACTING DIRECTOR OF THE INDIAN HEALTH SERVICE, et al. v. GROVER VIGIL et al."
508 U.S. 200,KEENE CORPORATION v. UNITED STATES
508 U.S. 223,JOHN ANGUS SMITH v. UNITED STATES
508 U.S. 248,"WILLIAM J. MERTENS, ALEX W. BANDROWSKI, JAMES A. CLARK, AND RUSSELL FRANZ v. HEWITT ASSOCIATES"
508 U.S. 275,JOHN SULLIVAN v. LOUISIANA
508 U.S. 286,"MUSICK, PEELER & GARRETT, et al. v. EMPLOYERS INSURANCE OF WAUSAU et al."
508 U.S. 307,"FEDERAL COMMUNICATIONS COMMISSION AND UNITED STATES v. BEACH COMMUNICATIONS, INC., et al."
508 U.S. 324,"LEONARD NOBELMAN, ET UX. v. AMERICAN SAVINGS BANK et al."
508 U.S. 333,JERRY D. GILMORE v. KEVIN TAYLOR
508 U.S. 366,MINNESOTA v. TIMOTHY DICKERSON
508 U.S. 384,LAMB'S CHAPEL AND JOHN STEIGERWALD v. CENTER MORICHES UNION FREE SCHOOL DISTRICT et al.
508 U.S. 402,"GOOD SAMARITAN HOSPITAL, et al. v. DONNA E. SHALALA, SECRETARY OF HEALTH AND HUMAN SERVICES"
508 U.S. 429,"JEFFERY ANTOINE v. BYERS & ANDERSON, INC., et al."
508 U.S. 439,"UNITED STATES NATIONAL BANK OF OREGON v. INDEPENDENT INSURANCE AGENTS OF AMERICA, INC., et al."
508 U.S. 439,"EUGENE R. LUDWIG, COMPTROLLER OF THE CURRENCY, et al. v. INDEPENDENT INSURANCE AGENTS OF AMERICA, INC., et al."
508 U.S. 464,"DONALD NEAL RAKE, et al. v. WILLIAM J. WADE, TRUSTEE"
508 U.S. 476,WISCONSIN v. TODD MITCHELL
508 U.S. 491,"UNITED STATES DEPARTMENT OF THE TREASURY AND MITCHELL A. LEVINE, ASSISTANT COMMISSIONER v. GEORGE FABE, SUPERINTENDENT OF INSURANCE OF OHIO"
508 U.S. 520,"CHURCH OF THE LUKUMI BABALU AYE, INC. AND ERNESTO PICHARDO v. CITY OF HIALEAH"
508 U.S. 581,"LOCAL 144 NURSING HOME PENSION FUND, et al. v. NICHOLAS DEMISAY et al."
508 U.S. 602,"CONCRETE PIPE AND PRODUCTS OF CALIFORNIA, INC. v. CONSTRUCTION LABORERS PENSION TRUST FOR SOUTHERN CALIFORNIA"
508 U.S. 656,"NORTHEASTERN FLORIDA CHAPTER OF THE ASSOCIATED GENERAL CONTRACTORS OF AMERICA v. CITY OF JACKSONVILLE, FLORIDA, et al."
508 U.S. 679,"SOUTH DAKOTA v. GREGG BOURLAND, ETC., et al."
509 U.S. 1,"LARRY ZOBREST, ET UX., et al. v. CATALINA FOOTHILLS SCHOOL DISTRICT"
509 U.S. 25,"DONALD L. HELLING, et al. v. WILLIAM MCKINNEY"
509 U.S. 43,"JANET RENO, ATTORNEY GENERAL, et al. v. CATHOLIC SOCIAL SERVICES, INC., et al."
509 U.S. 86,"HENRY HARPER, et al. v. VIRGINIA DEPARTMENT OF TAXATION"
509 U.S. 137,"R. GORDON DARBY, et al. v. HENRY G. CISNEROS, SECRETARY OF HOUSING AND URBAN DEVELOPMENT, et al."
509 U.S. 155,"CHRIS SALE, ACTING COMMISSIONER, IMMIGRATION AND NATURALIZATION SERVICE, et al. v. HAITIAN CENTERS COUNCIL, INC., et al."
509 U.S. 209,BROOKE GROUP LTD. v. BROWN & WILLIAMSON TOBACCO CORPORATION
509 U.S. 259,STEPHEN BUCKLEY v. MICHAEL FITZSIMMONS et al.
509 U.S. 292,"DONNA E. SHALALA, SECRETARY OF HEALTH AND HUMAN SERVICES v. RICHARD H. SCHAEFER"
509 U.S. 312,"LEONARD HELLER, SECRETARY, KENTUCKY CABINET FOR HUMAN RESOURCES v. SAMUEL DOE, BY HIS MOTHER AND NEXT FRIEND, MARY DOE, et al."
509 U.S. 350,"DORSIE LEE JOHNSON, JR. v. TEXAS"
509 U.S. 389,"SALVADOR GODINEZ, WARDEN v. RICHARD ALLAN MORAN"
509 U.S. 418,UNITED STATES AND FEDERAL COMMUNICATIONS COMMISSION v. EDGE BROADCASTING COMPANY T/A POWER 94
509 U.S. 443,"TXO PRODUCTION CORP. v. ALLIANCE RESOURCES CORP., et al."
509 U.S. 502,"ST. MARY'S HONOR CENTER, et al. v. MELVIN HICKS"
509 U.S. 544,"FERRIS J. ALEXANDER, SR. v. UNITED STATES"
509 U.S. 579,"WILLIAM DAUBERT, ET UX., ETC., et al. v. MERRELL DOW PHARMACEUTICALS, INC."
509 U.S. 602,RICHARD LYLE AUSTIN v. UNITED STATES
509 U.S. 630,"RUTH O. SHAW, et al. v. JANET RENO, ATTORNEY GENERAL, et al."
509 U.S. 688,UNITED STATES v. ALVIN J. DIXON AND MICHAEL FOSTER
509 U.S. 764,"HARTFORD FIRE INSURANCE CO., et al. v. CALIFORNIA et al."
509 U.S. 764,"MERRETT UNDERWRITING AGENCY MANAGEMENT LIMITED, et al. v. CALIFORNIA et al."
509 U.S. 823,"PAUL DELO, SUPERINTENDENT, POTOSI CORRECTIONAL CENTER v. WALTER J. BLAIR"
510 U.S. 1,ROY A. DAY v. DONALD P. DAY
510 U.S. 1,"ROY A. DAY v. VINCENT BEKIEMPIS, JR."
510 U.S. 1,ROY A. DAY v. WALTER C. HEINRICH et al.
510 U.S. 1,ROY A. DAY v. GAF BUILDING MATERIALS CORP.
510 U.S. 1,"ROY A. DAY v. WILLIAM J. CLINTON, PRESIDENT OF THE UNITED STATES"
510 U.S. 1,ROY A. DAY v. NORMAN W. BLACK et al.
510 U.S. 1,ROY A. DAY v. J. TERRY DEASON et al.
510 U.S. 1,ROY A. DAY v. DONALD P. DAY
510 U.S. 4,In re GEORGE SASSOWER
510 U.S. 4,"GEORGE SASSOWER v. MEAD DATA CENTRAL INC., et al."
