usCite,caseName
373 U.S. 668,"MCNEESE et al. v. BOARD OF EDUCATION FOR COMMUNITY UNIT SCHOOL DISTRICT 187, CAHOKIA, ILLINOIS, et al."
373 U.S. 683,"GOSS et al. v. BOARD OF EDUCATION OF KNOXVILLE, TENNESSEE, et al."
373 U.S. 690,"LOCAL 100, UNITED ASSOCIATION OF JOURNEYMEN & APPRENTICES, v. BORDEN"
373 U.S. 701,"LOCAL NO. 207, INTERNATIONAL ASSOCIATION OF BRIDGE, STRUCTURAL AND ORNAMENTAL IRON WORKERS UNION, et al. v. PERKO"
373 U.S. 709,"UNITED STATES v. CARLO BIANCHI & CO., INC."
373 U.S. 723,RIDEAU v. LOUISIANA
373 U.S. 734,NATIONAL LABOR RELATIONS BOARD v. GENERAL MOTORS CORP.
373 U.S. 746,"RETAIL CLERKS INTERNATIONAL ASSOCIATION, LOCAL 1625, AFL-CIO, et al. v. SCHERMERHORN et al."
374 U.S. 1,SHENKER v. BALTIMORE & OHIO RAILROAD CO.
374 U.S. 16,"FITZGERALD, PUBLIC ADMINISTRATOR, v. UNITED STATES LINES CO."
374 U.S. 23,KER et ux. v. CALIFORNIA
374 U.S. 65,BRAUNSTEIN et al. v. COMMISSIONER OF INTERNAL REVENUE
374 U.S. 74,"DIVISION 1287, AMALGAMATED ASSOCIATION OF STREET, ELECTRIC RAILWAY & MOTOR COACH EMPLOYEES OF AMERICA et al. v. MISSOURI"
374 U.S. 84,UNITED STATES v. PIONEER AMERICAN INSURANCE CO. et al.
374 U.S. 109,YELLIN v. UNITED STATES
374 U.S. 150,UNITED STATES v. MUNIZ et al.
374 U.S. 167,"MOSELEY, DOING BUSINESS AS MOSELEY PLUMBING & HEATING CO., v. ELECTRONIC & MISSILE FACILITIES, INC., et al."
374 U.S. 174,UNITED STATES v. SINGER MANUFACTURING CO.
374 U.S. 203,"SCHOOL DISTRICT OF ABINGTON TOWNSHIP, PENNSYLVANIA, et al. v. SCHEMPP et al."
374 U.S. 203,"MURRAY et al. v. CURLETT et al., CONSTITUTING THE BOARD OF SCHOOL COMMISSIONERS OF BALTIMORE CITY"
374 U.S. 321,UNITED STATES v. PHILADELPHIA NATIONAL BANK et al.
374 U.S. 398,"SHERBERT v. VERNER et al., MEMBERS OF SOUTH CAROLINA EMPLOYMENT SECURITY COMMISSION, et al."
374 U.S. 424,"HEAD, DOING BUSINESS AS LEA COUNTY PUBLISHING CO., et al. v. NEW MEXICO BOARD OF EXAMINERS IN OPTOMETRY"
374 U.S. 449,"ROSENBERG, DISTRICT DIRECTOR, IMMIGRATION AND NATURALIZATION SERVICE, v. FLEUTI"
374 U.S. 469,"GASTELUM-QUINONES v. KENNEDY, ATTORNEY GENERAL"
374 U.S. 469,"GASTELUM-QUINONES v. KENNEDY, ATTORNEY GENERAL"
374 U.S. 97,RANDOLPH et al. v. VIRGINIA
374 U.S. 101,MARCHESE v. UNITED STATES et al.
374 U.S. 498,DEARHART v. VIRGINIA.
374 U.S. 500,DANIELS et al. v. VIRGINIA.
374 U.S. 503,BONE v. UNITED STATES.
375 U.S. 29,PANICO v. UNITED STATES
375 U.S. 34,"TIPTON v. SOCONY MOBIL OIL CO., INC."
375 U.S. 39,"SHENANDOAH VALLEY BROADCASTING, INC., et al. v. AMERICAN SOCIETY OF COMPOSERS, AUTHORS AND PUBLISHERS"
375 U.S. 52,BARTONE v. UNITED STATES
375 U.S. 21,NEWSOME v. NORTH CAROLINA
375 U.S. 2,"PICKELSIMER v. WAINWRIGHT, CORRECTIONS DIRECTOR"
375 U.S. 2,"MIHELCICH v. WAINWRIGHT, CORRECTIONS DIRECTOR"
375 U.S. 2,"COWAN v. WAINWRIGHT, CORRECTIONS DIRECTOR"
375 U.S. 2,"DUMOND v. WAINWRIGHT, CORRECTIONS DIRECTOR"
375 U.S. 2,"SHARP v. WAINWRIGHT, CORRECTIONS DIRECTOR"
375 U.S. 2,"BAKER v. WAINWRIGHT, CORRECTIONS DIRECTOR"
375 U.S. 2,"HEARD v. WAINWRIGHT, CORRECTIONS DIRECTOR"
375 U.S. 2,"CAMPBELL v. WAINWRIGHT, CORRECTIONS DIRECTOR"
375 U.S. 2,"MITCHELL v. WAINWRIGHT, CORRECTIONS DIRECTOR"
375 U.S. 2,"KITCHENS v. WAINWRIGHT, CORRECTIONS DIRECTOR"
375 U.S. 22,SHOCKEY v. ILLINOIS
375 U.S. 24,AUSBIE v. CALIFORNIA
375 U.S. 1,DAEGELE v. KANSAS
375 U.S. 26,"HERREAR v. HEINZE, WARDEN"
375 U.S. 27,TABB v. CALIFORNIA
375 U.S. 28,BARNES v. NORTH CAROLINA
375 U.S. 32,EVOLA v. UNITED STATES
375 U.S. 32,SANTORA v. UNITED STATES
375 U.S. 32,GENOVESE v. UNITED STATES
375 U.S. 32,GIGANTE v. UNITED STATES
375 U.S. 32,DIPALERMO v. UNITED STATES
375 U.S. 32,DIPALERMO v. UNITED STATES
375 U.S. 32,MAZZIE v. UNITED STATES
375 U.S. 32,POLIZZANO et al. v. UNITED STATES
375 U.S. 32,BARCELLONA v. UNITED STATES
375 U.S. 50,"CREWS v. WAINWRIGHT, CORRECTIONS DIRECTOR"
375 U.S. 51,"BANKS v. WAINWRIGHT, CORRECTIONS DIRECTOR"
375 U.S. 59,UNITED STATES v. ZACKS ET UX.
375 U.S. 71,"PARSONS, UNITED STATES DISTRICT JUDGE, v. CHESAPEAKE & OHIO RAILWAY CO."
375 U.S. 79,GOTTHILF v. SILLS et al.
375 U.S. 85,FAHY v. CONNECTICUT
375 U.S. 96,"RETAIL CLERKS INTERNATIONAL ASSOCIATION, LOCAL 1625, AFL-CIO, et al. v. SCHERMERHORN et al."
375 U.S. 106,DURFEE et ux. v. DUKE
375 U.S. 118,"UNITED STATES v. STAPF et al., EXECUTORS AND TRUSTEES"
375 U.S. 136,DRESNER et al. v. CITY OF TALLAHASSEE
375 U.S. 150,CHICAGO & EASTERN ILLINOIS RAILROAD CO. et al. v. UNITED STATES et al.
375 U.S. 162,UNITED STATES v. BEHRENS
375 U.S. 169,COREY v. UNITED STATES
375 U.S. 180,"SECURITIES AND EXCHANGE COMMISSION v. CAPITAL GAINS RESEARCH BUREAU, INC., et al."
375 U.S. 208,DENNIS v. DENVER & RIO GRANDE WESTERN RAILROAD CO.
375 U.S. 160,MEEKER et ux. v. AMBASSADOR OIL CORP.
375 U.S. 217,FOTI v. IMMIGRATION AND NATURALIZATION SERVICE
375 U.S. 233,MEYER v. UNITED STATES
375 U.S. 249,ALDRICH v. ALDRICH et al.
375 U.S. 253,EICHEL v. NEW YORK CENTRAL RAILROAD CO.
375 U.S. 248,FIELDS et al. v. CITY OF FAIRFIELD.
375 U.S. 261,"CAREY, PRESIDENT OF THE INTERNATIONAL UNION OF ELECTRICAL, RADIO & MACHINE WORKERS, AFL-CIO, v. WESTINGHOUSE ELECTRIC CORP."
375 U.S. 277,HARDY v. UNITED STATES
375 U.S. 301,"LINER et al. v. JAFCO, INC., et al."
375 U.S. 311,"NATIONAL EQUIPMENT RENTAL, LTD., v. SZUKHENT et al."
375 U.S. 335,HUMPHREY et al. v. MOORE et al.
375 U.S. 335,"GENERAL DRIVERS, WAREHOUSEMEN & HELPERS, LOCAL UNION NO. 89, v. MOORE et al."
375 U.S. 361,"POLAR ICE CREAM & CREAMERY CO. v. ANDREWS et al., CONSTITUTING THE FLORIDA MILK COMMISSION, et al."
375 U.S. 384,THOMPSON v. IMMIGRATION AND NATURALIZATION SERVICE
375 U.S. 391,GRIFFIN et al. v. COUNTY SCHOOL BOARD OF PRINCE EDWARD COUNTY et al.
375 U.S. 399,ANDERSON et al. v. MARTIN
375 U.S. 405,NATIONAL LABOR RELATIONS BOARD v. EXCHANGE PARTS CO.
375 U.S. 411,ENGLAND et al. v. LOUISIANA STATE BOARD OF MEDICAL EXAMINERS et al.
375 U.S. 440,"REISMAN et al., DOING BUSINESS AS TRAMMELL, RAND & NATHAN, v. CAPLIN et al."
376 U.S. 1,"WESBERRY et al. v. SANDERS, GOVERNOR OF GEORGIA, et al."
376 U.S. 52,"WRIGHT et al. v. ROCKEFELLER, GOVERNOR OF NEW YORK, et al."
376 U.S. 75,UNITED STATES v. HEALY et al.
376 U.S. 86,UNITED STATES v. WIESENFELD WAREHOUSE CO.
376 U.S. 93,SOUTHERN RAILWAY CO. v. NORTH CAROLINA et al.
376 U.S. 93,UNITED STATES et al. v. NORTH CAROLINA et al.
376 U.S. 120,COSTELLO v. IMMIGRATION AND NATURALIZATION SERVICE
376 U.S. 149,GREENE v. UNITED STATES
376 U.S. 169,TILTON et al. v. MISSOURI PACIFIC RAILROAD CO.
376 U.S. 182,BROOKS v. MISSOURI PACIFIC RAILROAD CO.
376 U.S. 189,CITY OF NEW ORLEANS et al. v. BARTHE et al.
376 U.S. 192,UNITED STATES v. MERZ et al.
376 U.S. 192,"2,872.88 ACRES OF LAND et al. v. UNITED STATES"
376 U.S. 203,"WOLFSOHN, EXECUTRIX, v. HANKIN et al."
376 U.S. 205,FEDERAL POWER COMMISSION v. SOUTHERN CALIFORNIA EDISON CO. et al.
376 U.S. 205,CITY OF COLTON v. SOUTHERN CALIFORNIA EDISON CO. et al.
376 U.S. 201,DIAMOND v. LOUISIANA.
376 U.S. 222,"MARTIN, SECRETARY OF STATE OF TEXAS, et al. v. BUSH et al."
376 U.S. 221,KREZNAR et al. v. UNITED STATES.
376 U.S. 225,"SEARS, ROEBUCK & CO. v. STIFFEL COMPANY"
376 U.S. 234,"COMPCO CORPORATION v. DAY-BRITE LIGHTING, INC."
376 U.S. 240,"PLATT, CHIEF JUDGE, U.S. DISTRICT COURT, v. MINNESOTA MINING & MANUFACTURING CO."
376 U.S. 247,"LOCAL UNION NO. 721, UNITED PACKINGHOUSE, FOOD & ALLIED WORKERS, AFL-CIO, v. NEEDHAM PACKING CO., DOING BUSINESS AS SIOUX CITY DRESSED BEEF"
376 U.S. 254,NEW YORK TIMES CO. v. SULLIVAN
376 U.S. 254,ABERNATHY et al. v. SULLIVAN
376 U.S. 306,"YIATCHOS v. YIATCHOS, EXECUTRIX, et al."
376 U.S. 315,"ITALIA SOCIETA PER AZIONI DI NAVIGAZIONE v. OREGON STEVEDORING CO., INC."
376 U.S. 327,UNITED STATES v. WARD BAKING CO. et al.
376 U.S. 336,ARCENEAUX v. LOUISIANA
376 U.S. 354,SMITH v. PENNSYLVANIA
376 U.S. 356,"MICHAELS ENTERPRISES, INC., et al. v. UNITED STATES"
376 U.S. 340,ARIZONA v. CALIFORNIA et al.
376 U.S. 339,SHUTTLESWORTH v. CITY OF BIRMINGHAM.
376 U.S. 358,BRUNING v. UNITED STATES
376 U.S. 364,PRESTON v. UNITED STATES
376 U.S. 369,"HUMBLE PIPE LINE CO. v. WAGGONNER, SHERIFF"
376 U.S. 369,"NATURAL GAS & OIL CORP. et al. v. WAGGONNER, SHERIFF"
376 U.S. 375,"A. L. MECHLING BARGE LINES, INC., et al. v. UNITED STATES et al."
376 U.S. 375,BOARD OF TRADE OF THE CITY OF CHICAGO v. UNITED STATES et al.
376 U.S. 389,"UNITED STATES et al. v. J. B. MONTGOMERY, INC."
376 U.S. 398,"BANCO NACIONAL DE CUBA v. SABBATINO, RECEIVER, et al."
376 U.S. 473,"BOIRE, REGIONAL DIRECTOR, TWELFTH REGION, NATIONAL LABOR RELATIONS BOARD, v. GREYHOUND CORPORATION"
376 U.S. 483,STONER v. CALIFORNIA
376 U.S. 492,"UNITED STEELWORKERS OF AMERICA, AFL-CIO, et al. v. NATIONAL LABOR RELATIONS BOARD et al."
376 U.S. 503,JACKSON et al. v. UNITED STATES
376 U.S. 515,FEDERAL POWER COMMISSION v. HUNT et al.
376 U.S. 528,RUGENDORF v. UNITED STATES
376 U.S. 543,"JOHN WILEY & SONS, INC., v. LIVINGSTON, PRESIDENT OF DISTRICT 65, RETAIL, WHOLESALE AND DEPARTMENT STORE UNION, AFL-CIO"
376 U.S. 560,"MRVICA v. ESPERDY, DISTRICT DIRECTOR, IMMIGRATION AND NATURALIZATION SERVICE"
376 U.S. 575,"UNGAR v. SARAFITE, JUDGE OF THE COURT OF GENERAL SESSIONS OF THE COUNTY OF NEW YORK"
376 U.S. 605,"RABINOWITZ et al. v. KENNEDY, ATTORNEY GENERAL"
376 U.S. 612,"VAN DUSEN, U.S. DISTRICT JUDGE, et al. v. BARRACK, ADMINISTRATRIX, et al."
376 U.S. 612,"VAN DUSEN, U.S. DISTRICT JUDGE, et al. v. BARRACK, ADMINISTRATRIX, et al."
376 U.S. 650,HAMILTON v. ALABAMA
376 U.S. 665,UNITED STATES v. FIRST NATIONAL BANK & TRUST CO. OF LEXINGTON et al.
376 U.S. 651,UNITED STATES v. EL PASO NATURAL GAS CO. et al.
376 U.S. 681,UNITED STATES v. BARNETT et al.
376 U.S. 773,ARNOLD et al. v. NORTH CAROLINA
376 U.S. 776,HENRY et al. v. CITY OF ROCK HILL
376 U.S. 775,PUBLISHERS' ASSOCIATION OF NEW YORK CITY v. NEW YORK MAILERS' UNION NUMBER SIX
377 U.S. 1,BROTHERHOOD OF RAILROAD TRAINMEN v. VIRGINIA ex rel. VIRGINIA STATE BAR
377 U.S. 13,SIMPSON v. UNION OIL CO. OF CALIFORNIA
377 U.S. 33,FEDERAL POWER COMMISSION v. TEXACO INC. et al.
377 U.S. 46,"NATIONAL LABOR RELATIONS BOARD v. SERVETTE, INC."
377 U.S. 58,"NATIONAL LABOR RELATIONS BOARD v. FRUIT & VEGETABLE PACKERS & WAREHOUSEMEN, LOCAL 760, et al."
377 U.S. 95,UNITED STATES v. WELDEN
377 U.S. 126,"HATTIESBURG BUILDING & TRADES COUNCIL et al. v. BROOME, DOING BUSINESS AS BROOME CONSTRUCTION & MAINTENANCE CO., et al."
377 U.S. 129,COLEMAN v. ALABAMA
377 U.S. 134,MISSOURI PACIFIC RAILROAD CO. v. ELMORE & STAHL
377 U.S. 152,MERCER v. THERIOT
377 U.S. 159,"WILLIS SHAW FROZEN EXPRESS, INC., v. UNITED STATES et al."
377 U.S. 158,CLINTON v. VIRGINIA
377 U.S. 161,UNITED STATES v. CONTINENTAL OIL CO.
377 U.S. 163,"SCHNEIDER v. RUSK, SECRETARY OF STATE"
377 U.S. 179,"CLAY v. SUN INSURANCE OFFICE, LTD."
377 U.S. 184,PARDEN et al. v. TERMINAL RAILWAY OF THE ALABAMA STATE DOCKS DEPARTMENT et al.
377 U.S. 201,MASSIAH v. UNITED STATES
377 U.S. 218,GRIFFIN et al. v. COUNTY SCHOOL BOARD OF PRINCE EDWARD COUNTY et al.
377 U.S. 235,MASSACHUSETTS TRUSTEES OF EASTERN GAS & FUEL ASSOCIATES v. UNITED STATES
377 U.S. 252,"LOCAL 20, TEAMSTERS, CHAUFFEURS & HELPERS UNION v. MORTON, DOING BUSINESS AS LESTER MORTON TRUCKING CO."
377 U.S. 263,CALHOUN et al. v. LATIMER et al.
377 U.S. 266,NAGELBERG v. UNITED STATES
377 U.S. 214,"MARKS v. ESPERDY, DISTRICT DIRECTOR, IMMIGRATION AND NATURALIZATION SERVICE."
377 U.S. 271,UNITED STATES v. ALUMINUM CO. OF AMERICA et al.
377 U.S. 288,"NATIONAL ASSOCIATION FOR THE ADVANCEMENT OF COLORED PEOPLE v. ALABAMA ex rel. FLOWERS, ATTORNEY GENERAL"
377 U.S. 311,"RED BALL MOTOR FREIGHT, INC., et al. v. SHANNON et al., DOING BUSINESS AS E. & R. SHANNON"
377 U.S. 311,UNITED STATES et al. v. SHANNON et al.
377 U.S. 324,HOSTETTER et al. v. IDLEWILD BON VOYAGE LIQUOR CORP.
377 U.S. 341,DEPARTMENT OF REVENUE v. JAMES B. BEAM DISTILLING CO.
377 U.S. 351,UNITED STATES v. VERMONT et al.
377 U.S. 360,BAGGETT et al. v. BULLITT et al.
377 U.S. 386,"HUDSON DISTRIBUTORS, INC., v. ELI LILLY & CO."
377 U.S. 386,"HUDSON DISTRIBUTORS, INC., v. UPJOHN COMPANY"
377 U.S. 407,MARDER v. MASSACHUSETTS
377 U.S. 402,CHAMBERLIN et al. v. DADE COUNTY BOARD OF PUBLIC INSTRUCTION et al.
377 U.S. 408,DONOVAN et al. v. CITY OF DALLAS et al.
377 U.S. 422,WILBUR-ELLIS CO. et al. v. KUTHER
377 U.S. 426,J. I. CASE CO. et al. v. BORAK
377 U.S. 436,GENERAL MOTORS CORP. v. WASHINGTON et al.
377 U.S. 463,UNITED STATES v. TATEO
377 U.S. 476,"ARO MANUFACTURING CO., INC., et al. v. CONVERTIBLE TOP REPLACEMENT CO., INC."
377 U.S. 405,MEEKS v. GEORGIA SOUTHERN & FLORIDA RAILWAY CO.
377 U.S. 405,"BRASWELL, ADMINISTRATRIX, v. NEW YORK, CHICAGO & ST. LOUIS RAILROAD CO."
377 U.S. 533,"REYNOLDS, JUDGE, et al. v. SIMS et al."
377 U.S. 533,"VANN et al. v. BAGGETT, SECRETARY OF STATE OF ALABAMA, et al."
377 U.S. 533,"MCCONNELL et al. v. BAGGETT, SECRETARY OF STATE OF ALABAMA, et al."
377 U.S. 633,"WMCA, INC., et al. v. LOMENZO, SECRETARY OF STATE OF NEW YORK, et al."
377 U.S. 656,"MARYLAND COMMITTEE FOR FAIR REPRESENTATION et al. v. TAWES, GOVERNOR OF MARYLAND, et al."
377 U.S. 678,"DAVIS, SECRETARY, STATE BOARD OF ELECTIONS, et al. v. MANN et al."
377 U.S. 695,"ROMAN, CLERK OF THE PEACE, et al. v. SINCOCK et al."
377 U.S. 713,LUCAS et al. v. FORTY-FOURTH GENERAL ASSEMBLY OF COLORADO et al.
378 U.S. 1,"MALLOY v. HOGAN, SHERIFF"
378 U.S. 52,MURPHY et al. v. WATERFRONT COMMISSION OF NEW YORK HARBOR
378 U.S. 39,"UNITED STATES et al. v. BOYD, COMMISSIONER"
378 U.S. 108,AGUILAR v. TEXAS
378 U.S. 124,"DEPARTMENT OF ALCOHOLIC BEVERAGE CONTROL FOR CALIFORNIA et al. v. AMMEX WAREHOUSE CO. OF SAN YSIDRO, INC., et al."
378 U.S. 123,VIKING THEATRE CORP. v. PARAMOUNT FILM DISTRIBUTING CORP. et al.
378 U.S. 130,GRIFFIN et al. v. MARYLAND
378 U.S. 139,FALLEN v. UNITED STATES
378 U.S. 146,BARR et al. v. CITY OF COLUMBIA
378 U.S. 153,ROBINSON et al. v. FLORIDA
378 U.S. 158,UNITED STATES v. PENN-OLIN CHEMICAL CO. et al.
378 U.S. 184,JACOBELLIS v. OHIO
378 U.S. 205,A QUANTITY OF COPIES OF BOOKS et al. v. KANSAS
378 U.S. 226,BELL et al. v. MARYLAND
378 U.S. 347,BOUIE et al. v. CITY OF COLUMBIA
378 U.S. 368,"JACKSON v. DENNO, WARDEN"
378 U.S. 441,UNITED STATES v. CONTINENTAL CAN CO. et al.
378 U.S. 478,ESCOBEDO v. ILLINOIS
378 U.S. 500,APTHEKER et al. v. SECRETARY OF STATE
378 U.S. 530,BERMAN v. UNITED STATES
378 U.S. 539,DRESNER et al. v. CITY OF TALLAHASSEE.
378 U.S. 540,ALDRICH v. ALDRICH et al.
378 U.S. 554,"MEYERS, SECRETARY OF STATE OF WASHINGTON, v. THIGPEN et al."
378 U.S. 558,"WILLIAMS, TREASURER OF OKLAHOMA, et al. v. MOSS et al."
378 U.S. 558,OKLAHOMA FARM BUREAU et al. v. MOSS et al.
378 U.S. 558,BALDWIN et al. v. MOSS
378 U.S. 544,LEONARD v. UNITED STATES
378 U.S. 546,"COOPER v. PATE, WARDEN"
378 U.S. 547,DREWS et al. v. MARYLAND
378 U.S. 553,"SWANN v. ADAMS, SECRETARY OF STATE OF FLORIDA, et al."
378 U.S. 576,"TRALINS v. GERSTEIN, STATE ATTORNEY"
378 U.S. 560,"GERMANO et al. v. KERNER, GOVERNOR OF ILLINOIS, et al."
378 U.S. 550,GREEN et al. v. VIRGINIA
378 U.S. 577,"GROVE PRESS, INC., v. GERSTEIN, STATE ATTORNEY, et al."
378 U.S. 561,"MARSHALL et al. v. HARE, SECRETARY OF STATE OF MICHIGAN, et al."
378 U.S. 582,MCLEOD v. OHIO.
378 U.S. 566,LATHAN v. NEW YORK
378 U.S. 584,"SMITH v. CROUSE, WARDEN"
378 U.S. 589,ETCHIESON v. TEXAS
378 U.S. 585,RUARK v. COLORADO
379 U.S. 21,"NATIONAL LABOR RELATIONS BOARD v. BURNUP & SIMS, INC."
379 U.S. 29,BRULOTTE et al. v. THYS CO.
379 U.S. 40,"SCRANTON, GOVERNOR OF PENNSYLVANIA, et al. v. DREW et al."
379 U.S. 43,"BOLES, WARDEN v. STEVENSON"
379 U.S. 48,UNITED STATES et al. v. POWELL et al.
379 U.S. 61,RYAN v. UNITED STATES
379 U.S. 64,GARRISON v. LOUISIANA
379 U.S. 89,BECK v. OHIO
379 U.S. 104,"SCHLAGENHAUF v. HOLDER, U.S. DISTRICT JUDGE FOR THE SOUTHERN DISTRICT OF INDIANA"
379 U.S. 26,"BROTHERHOOD OF RAILWAY & STEAMSHIP CLERKS, FREIGHT HANDLERS, EXPRESS & STATION EMPLOYES v. UNITED AIR LINES, INC."
379 U.S. 134,"CALHOON, PRESIDENT, OR PETERS, SECRETARY-TREASURER OF DISTRICT NO. 1, NATIONAL MARINE ENGINEERS' BENEFICIAL ASSOCIATION, AFL-CIO v. HARVEY et al."
379 U.S. 148,"GILLESPIE, ADMINISTRATRIX v. UNITED STATES STEEL CORP."
379 U.S. 171,AMERICAN FEDERATION OF MUSICIANS OF THE UNITED STATES AND CANADA et al. v. WITTSTEIN et al.
379 U.S. 184,MCLAUGHLIN et al. v. FLORIDA
379 U.S. 203,FIBREBOARD PAPER PRODUCTS CORP. v. NATIONAL LABOR RELATIONS BOARD et al.
379 U.S. 227,FARMER v. ARABIAN AMERICAN OIL CO.
379 U.S. 227,ARABIAN AMERICAN OIL CO. v. FARMER
379 U.S. 241,"HEART OF ATLANTA MOTEL, INC. v. UNITED STATES et al."
379 U.S. 294,"KATZENBACH, ACTING ATTORNEY GENERAL, et al. v. MCCLUNG et al."
379 U.S. 306,HAMM v. CITY OF ROCK HILL
379 U.S. 306,LUPPER et al. v. ARKANSAS
379 U.S. 329,"KING, EXECUTRIX, et al. v. UNITED STATES"
379 U.S. 343,"ALL STATES FREIGHT, INC., et al. v. NEW YORK, NEW HAVEN & HARTFORD RAILROAD CO. et al."
379 U.S. 130,"INDEPENDENT PETROLEUM WORKERS OF AMERICA, INC. v. AMERICAN OIL CO."
379 U.S. 199,RAILWAY LABOR EXECUTIVES' ASSOCIATION et al. v. UNITED STATES et al.
379 U.S. 359,"PARSONS, TOWN CLERK OF THE TOWN OF HUBBARDTON, et al. v. BUCKLEY et al."
379 U.S. 359,"HOFF, GOVERNOR OF VERMONT, et al. v. BUCKLEY et al."
379 U.S. 366,CALIFORNIA et al. v. LO-VACA GATHERING CO. et al.
379 U.S. 366,SOUTHERN CALIFORNIA GAS CO. et al. v. LO-VACA GATHERING CO. et al.
379 U.S. 366,FEDERAL POWER COMMISSION v. LO-VACA GATHERING CO. et al.
379 U.S. 378,UNITED STATES v. FIRST NATIONAL CITY BANK
379 U.S. 411,WHITNEY NATIONAL BANK IN JEFFERSON PARISH v. BANK OF NEW ORLEANS & TRUST CO. et al.
379 U.S. 411,"SAXON, COMPTROLLER OF THE CURRENCY v. BANK OF NEW ORLEANS & TRUST CO. et al."
379 U.S. 433,"FORTSON, SECRETARY OF STATE OF GEORGIA v. DORSEY et al."
379 U.S. 443,HENRY v. MISSISSIPPI
379 U.S. 466,TURNER v. LOUISIANA
379 U.S. 476,STANFORD v. TEXAS
379 U.S. 487,"JANKOVICH et al., DOING BUSINESS AS CALUMET AVIATION CO. v. INDIANA TOLL ROAD COMMISSION"
379 U.S. 497,CITY OF EL PASO v. SIMMONS
379 U.S. 536,COX v. LOUISIANA
379 U.S. 559,COX v. LOUISIANA
379 U.S. 594,SECURITIES AND EXCHANGE COMMISSION v. AMERICAN TRAILER RENTALS CO.
379 U.S. 621,"FORTSON, SECRETARY OF STATE OF GEORGIA, et al. v. TOOMBS et al."
379 U.S. 650,REPUBLIC STEEL CORP. v. MADDOX
379 U.S. 671,DAVIS v. BALTIMORE & OHIO RAILROAD CO.
379 U.S. 674,TEXAS v. NEW JERSEY et al.
379 U.S. 684,BLOW et al. v. NORTH CAROLINA
379 U.S. 687,FEDERAL POWER COMMISSION v. AMERADA PETROLEUM CORP. et al.
380 U.S. 1,"UDALL, SECRETARY OF THE INTERIOR v. TALLMAN et al."
380 U.S. 24,SINGER v. UNITED STATES
380 U.S. 39,CRIDER v. ZURICH INSURANCE CO.
380 U.S. 51,FREEDMAN v. MARYLAND
380 U.S. 63,UNITED STATES v. GAINEY
380 U.S. 89,CARRINGTON v. RASH et al.
380 U.S. 102,UNITED STATES v. VENTRESCA
379 U.S. 694,"HUGHES et al. v. WMCA, INC., et al."
379 U.S. 694,"DAVIS, SECRETARY, STATE BOARD OF ELECTIONS, et al. v. MANN et al."
379 U.S. 693,FORTY-FOURTH GENERAL ASSEMBLY OF COLORADO et al. v. LUCAS et al.
380 U.S. 145,LOUISIANA et al. v. UNITED STATES
380 U.S. 128,UNITED STATES v. MISSISSIPPI et al.
380 U.S. 157,UNITED STATES v. BOSTON & MAINE RAILROAD et al.
380 U.S. 163,UNITED STATES v. SEEGER
380 U.S. 163,UNITED STATES v. JAKOBSON
380 U.S. 163,PETER v. UNITED STATES
380 U.S. 194,"DEPARTMENT OF MENTAL HYGIENE OF CALIFORNIA v. KIRCHNER, ADMINISTRATRIX"
380 U.S. 202,SWAIN v. ALABAMA
380 U.S. 255,"RADIO & TELEVISION BROADCAST TECHNICIANS LOCAL UNION 1264, INTERNATIONAL BROTHERHOOD OF ELECTRICAL WORKERS, AFL-CIO, et al. v. BROADCAST SERVICE OF MOBILE, INC."
380 U.S. 248,"HUGHES TOOL CO. et al. v. TRANS WORLD AIRLINES, INC."
380 U.S. 249,"HUGHES TOOL CO. v. TRANS WORLD AIRLINES, INC., et al."
380 U.S. 251,"DAVIS, ASSESSOR-COLLECTOR OF TAXES, BEXAR COUNTY, TEXAS, et al. v. MABRY et al."
380 U.S. 263,TEXTILE WORKERS UNION OF AMERICA v. DARLINGTON MANUFACTURING CO. et al.
380 U.S. 263,NATIONAL LABOR RELATIONS BOARD v. DARLINGTON MANUFACTURING CO. et al.
380 U.S. 278,"NATIONAL LABOR RELATIONS BOARD v. BROWN et al., DBA BROWN FOOD STORE, et al."
380 U.S. 300,AMERICAN SHIP BUILDING CO. v. NATIONAL LABOR RELATIONS BOARD
380 U.S. 343,SANSONE v. UNITED STATES
380 U.S. 356,HENRY v. COLLINS
380 U.S. 356,HENRY v. PEARSON
380 U.S. 359,"O'KEEFFE, DEPUTY COMMISSIONER, BUREAU OF EMPLOYEES' COMPENSATION, U.S. DEPARTMENT OF LABOR v. SMITH, HINCHMAN & GRYLLS ASSOCIATES, INC., et al."
380 U.S. 374,FEDERAL TRADE COMMISSION v. COLGATE-PALMOLIVE CO. et al.
380 U.S. 400,POINTER v. TEXAS
380 U.S. 415,DOUGLAS v. ALABAMA
380 U.S. 424,BURNETT v. NEW YORK CENTRAL RAILROAD CO.
380 U.S. 438,NATIONAL LABOR RELATIONS BOARD v. METROPOLITAN LIFE INSURANCE CO.
380 U.S. 445,JENKINS v. UNITED STATES
380 U.S. 258,"RESERVE LIFE INSURANCE CO. v. BOWERS, TAX COMMISSIONER OF OHIO."
380 U.S. 451,AMERICAN OIL CO. v. NEILL et al.
380 U.S. 460,"HANNA v. PLUMER, EXECUTOR"
380 U.S. 479,"DOMBROWSKI et al. v. PFISTER, CHAIRMAN, JOINT LEGISLATIVE COMMITTEE ON UNAMERICAN ACTIVITIES OF THE LOUISIANA LEGISLATURE, et al."
380 U.S. 503,AMERICAN COMMITTEE FOR PROTECTION OF FOREIGN BORN v. SUBVERSIVE ACTIVITIES CONTROL BOARD
380 U.S. 513,VETERANS OF THE ABRAHAM LINCOLN BRIGADE v. SUBVERSIVE ACTIVITIES CONTROL BOARD
380 U.S. 518,TEXAS v. NEW JERSEY et al.
380 U.S. 528,HARMAN et al. v. FORSSENIUS et al.
380 U.S. 545,ARMSTRONG v. MANZO ET UX.
380 U.S. 553,GENERAL MOTORS CORP. v. DISTRICT OF COLUMBIA
380 U.S. 563,COMMISSIONER OF INTERNAL REVENUE v. BROWN et al.
380 U.S. 592,FEDERAL TRADE COMMISSION v. CONSOLIDATED FOODS CORP.
380 U.S. 609,GRIFFIN v. CALIFORNIA
380 U.S. 624,"PARAGON JEWEL COAL CO., INC. v. COMMISSIONER OF INTERNAL REVENUE"
380 U.S. 624,COMMISSIONER OF INTERNAL REVENUE v. MERRITT et al.
380 U.S. 650,"BROTHERHOOD OF RAILWAY & STEAMSHIP CLERKS, FREIGHT HANDLERS, EXPRESS & STATION EMPLOYEES v. ASSOCIATION FOR THE BENEFIT OF NON-CONTRACT EMPLOYEES"
380 U.S. 650,"UNITED AIR LINES, INC. v. NATIONAL MEDIATION BOARD et al."
380 U.S. 650,NATIONAL MEDIATION BOARD et al. v. ASSOCIATION FOR THE BENEFIT OF NON-CONTRACT EMPLOYEES
380 U.S. 447,ABERNATHY et al. v. ALABAMA.
380 U.S. 448,"CHICAGO & NORTH WESTERN RAILWAY CO. v. CHICAGO, MILWAUKEE, ST. PAUL & PACIFIC RAILROAD CO. et al."
380 U.S. 449,MCKINNIE et al. v. TENNESSEE
380 U.S. 678,COMMISSIONER OF INTERNAL REVENUE v. ESTATE OF NOEL et al.
380 U.S. 685,WARREN TRADING POST CO. v. ARIZONA TAX COMMISSION et al.
380 U.S. 693,ONE 1958 PLYMOUTH SEDAN v. PENNSYLVANIA
381 U.S. 1,"ZEMEL v. RUSK, SECRETARY OF STATE, et al."
381 U.S. 41,"MARYLAND, FOR THE USE OF LEVIN, et al. v. UNITED STATES"
381 U.S. 54,UNITED STATES v. MIDLAND-ROSS CORP.
381 U.S. 68,DIXON et al. v. UNITED STATES
381 U.S. 81,"SIMONS v. MIAMI BEACH FIRST NATIONAL BANK, EXECUTOR"
381 U.S. 90,FEDERAL POWER COMMISSION v. UNION ELECTRIC CO.
381 U.S. 124,"CORBETT, GUARDIAN v. STERGIOS, AKA STERYIAKIS"
381 U.S. 126,WATTS et al. v. SEWARD SCHOOL BOARD et al.
381 U.S. 129,PARROT et al. v. CITY OF TALLAHASSEE
381 U.S. 125,SUSSER et al. v. CARVEL CORP. et al.
381 U.S. 131,HOLT et al. v. VIRGINIA
381 U.S. 139,UNITED STATES v. CALIFORNIA
381 U.S. 214,JABEN v. UNITED STATES
381 U.S. 233,UNITED STATES v. ATLAS LIFE INSURANCE CO.
381 U.S. 252,WATERMAN STEAMSHIP CORP. v. UNITED STATES
381 U.S. 279,FEDERAL COMMUNICATIONS COMMISSION v. SCHREIBER et al.
381 U.S. 301,"LAMONT, DBA BASIC PAMPHLETS v. POSTMASTER GENERAL"
381 U.S. 301,"FIXA, POSTMASTER, SAN FRANCISCO, et al. v. HEILBERG"
381 U.S. 311,MINNESOTA MINING & MANUFACTURING CO. v. NEW JERSEY WOOD FINISHING CO.
381 U.S. 336,CASE v. NEBRASKA
381 U.S. 274,COMMISSIONER OF INTERNAL REVENUE v. COOPER et al.
381 U.S. 357,ATLANTIC REFINING CO. v. FEDERAL TRADE COMMISSION
381 U.S. 357,GOODYEAR TIRE & RUBBER CO. v. FEDERAL TRADE COMMISSION
381 U.S. 392,UNITED GAS IMPROVEMENT CO. v. CONTINENTAL OIL CO. et al.
381 U.S. 392,FEDERAL POWER COMMISSION v. MARR et al.
381 U.S. 420,"HEARNE et al. v. SMYLIE, GOVERNOR OF IDAHO, et al."
381 U.S. 407,"SCOTT, TREASURER OF ILLINOIS, et al. v. GERMANO et al."
381 U.S. 431,"TRAVIA et al. v. LOMENZO, SECRETARY OF STATE OF NEW YORK, et al."
381 U.S. 437,UNITED STATES v. BROWN
381 U.S. 479,GRISWOLD et al. v. CONNECTICUT
381 U.S. 532,ESTES v. TEXAS
381 U.S. 618,"LINKLETTER v. WALKER, WARDEN"
381 U.S. 654,"ANGELET v. FAY, WARDEN"
381 U.S. 657,UNITED MINE WORKERS OF AMERICA v. PENNINGTON et al.
381 U.S. 676,"LOCAL UNION NO. 189, AMALGAMATED MEAT CUTTERS & BUTCHER WORKMEN OF NORTH AMERICA, AFL-CIO, et al. v. JEWEL TEA CO., INC."
381 U.S. 348,COLUMBIA ARTISTS MANAGEMENT INC. et al. v. UNITED STATES et al.
381 U.S. 355,WALKER v. GEORGIA
381 U.S. 415,"JORDAN, SECRETARY OF STATE OF CALIFORNIA, et al. v. SILVER"
381 U.S. 414,KENNECOTT COPPER CORP. v. UNITED STATES
381 U.S. 421,DREWS et al. v. MARYLAND
381 U.S. 760,CALIFORNIA v. HURST.
381 U.S. 761,"ASSOCIATED FOOD RETAILERS OF GREATER CHICAGO, INC., et al. v. JEWEL TEA CO., INC."
381 U.S. 741,"CAMERON et al. v. JOHNSON, GOVERNOR OF MISSISSIPPI, et al."
382 U.S. 4,"WMCA, INC., et al. v. LOMENZO, SECRETARY OF STATE OF NEW YORK, et al."
382 U.S. 1,"FAIRFAX FAMILY FUND, INC. v. CALIFORNIA"
382 U.S. 25,"GONDECK v. PAN AMERICAN WORLD AIRWAYS, INC., et al."
382 U.S. 32,JONES & LAUGHLIN STEEL CORP. v. GRIDIRON STEEL CO.
382 U.S. 34,FIRST SECURITY NATIONAL BANK & TRUST CO. OF LEXINGTON et al. v. UNITED STATES
382 U.S. 36,JAMES v. LOUISIANA
382 U.S. 46,FEDERAL TRADE COMMISSION v. MARY CARTER PAINT CO. et al.
382 U.S. 54,LEH et al. v. GENERAL PETROLEUM CORP. et al.
382 U.S. 68,RICHMOND TELEVISION CORP. v. UNITED STATES
382 U.S. 70,ALBERTSON et al. v. SUBVERSIVE ACTIVITIES CONTROL BOARD
382 U.S. 87,SHUTTLESWORTH v. CITY OF BIRMINGHAM
382 U.S. 103,BRADLEY et al. v. SCHOOL BOARD OF CITY OF RICHMOND et al.
382 U.S. 103,GILLIAM et al. v. SCHOOL BOARD OF CITY OF HOPEWELL et al.
382 U.S. 111,"SWIFT & CO., INC., et al. v. WICKHAM, COMMISSIONER OF AGRICULTURE & MARKETS OF NEW YORK"
382 U.S. 136,UNITED STATES v. ROMANO et al.
382 U.S. 145,"UNITED STEELWORKERS OF AMERICA, AFL-CIO v. R. H. BOULIGNY, INC."
382 U.S. 154,SEABOARD AIR LINE RAILROAD CO. et al. v. UNITED STATES et al.
382 U.S. 154,INTERSTATE COMMERCE COMMISSION v. FLORIDA EAST COAST RAILWAY CO. et al.
382 U.S. 158,UNITED STATES v. MARYLAND FOR THE USE OF MEYER et al.
382 U.S. 159,MARYLAND FOR THE USE OF LEVIN et al. v. UNITED STATES
382 U.S. 162,HARRIS v. UNITED STATES
