usCite,caseName
329 U.S. 1,"HALLIBURTON OIL WELL CEMENTING CO. v. WALKER ET AL., DOING BUSINESS AS DEPTHOGRAPH CO."
329 U.S. 14,CLEVELAND v. UNITED STATES
329 U.S. 14,CLEVELAND v. UNITED STATES
329 U.S. 14,CLEVELAND v. UNITED STATES
329 U.S. 14,CLEVELAND v. UNITED STATES
329 U.S. 14,CLEVELAND v. UNITED STATES
329 U.S. 14,CLEVELAND v. UNITED STATES
329 U.S. 14,CLEVELAND v. UNITED STATES
329 U.S. 14,CLEVELAND v. UNITED STATES
329 U.S. 29,CHAMPLIN REFINING CO. v. UNITED STATES ET AL.
329 U.S. 40,UNITED STATES v. ALCEA BAND OF TILLAMOOKS ET AL.
329 U.S. 64,"UNITED STATES v. HOWARD P. FOLEY CO., INC."
329 U.S. 69,RICHFIELD OIL CORP. v. STATE BOARD OF EQUALIZATION
329 U.S. 90,AMERICAN POWER & LIGHT CO. v. SECURITIES & EXCHANGE COMMISSION
329 U.S. 90,AMERICAN POWER & LIGHT CO. v. SECURITIES & EXCHANGE COMMISSION
329 U.S. 129,ALMA MOTOR CO. v. TIMKEN-DETROIT AXLE CO. ET AL.
329 U.S. 143,UNEMPLOYMENT COMPENSATION COMMISSION OF ALASKA ET AL. v. ARAGON ET AL.
329 U.S. 156,VANSTON BONDHOLDERS PROTECTIVE COMMITTEE v. GREEN ET AL.
329 U.S. 156,VANSTON BONDHOLDERS PROTECTIVE COMMITTEE v. GREEN ET AL.
329 U.S. 156,VANSTON BONDHOLDERS PROTECTIVE COMMITTEE v. GREEN ET AL.
329 U.S. 156,VANSTON BONDHOLDERS PROTECTIVE COMMITTEE v. GREEN ET AL.
329 U.S. 173,CARTER v. ILLINOIS
329 U.S. 187,BALLARD ET AL. v. UNITED STATES
329 U.S. 207,UNITED STATES v. BRUNO
329 U.S. 211,FISWICK ET AL. v. UNITED STATES
329 U.S. 223,"FEDERAL COMMUNICATIONS COMMISSION v. WOKO, INC."
329 U.S. 230,UNITED STATES v. CARMACK
329 U.S. 249,"FREEMAN, TRUSTEE, v. HEWIT, DIRECTOR OF GROSS INCOME TAX DIVISION"
329 U.S. 287,"UNITED STATES v. RUZICKA ET AL., TRADING AS SEELEY DAIRY"
329 U.S. 296,"ROTHENSIES, COLLECTOR OF INTERNAL REVENUE, v. ELECTRIC STORAGE BATTERY CO."
329 U.S. 304,"EAGLES, POST COMMANDING OFFICER, v. UNITED STATES EX REL. SAMUELS"
329 U.S. 317,"EAGLES, POST COMMANDING OFFICER, v. UNITED STATES EX REL. HOROWITZ"
329 U.S. 324,NATIONAL LABOR RELATIONS BOARD v. A. J. TOWER CO.
329 U.S. 338,GIBSON v. UNITED STATES
329 U.S. 338,GIBSON v. UNITED STATES
329 U.S. 362,"ILLINOIS EX REL. GORDON, DIRECTOR OF LABOR, v. CAMPBELL, COLLECTOR OF INTERNAL REVENUE"
329 U.S. 379,UNITED STATES v. SHERIDAN
329 U.S. 394,EDWARD KATZINGER CO. v. CHICAGO METALLIC MANUFACTURING CO.
329 U.S. 394,EDWARD KATZINGER CO. v. CHICAGO METALLIC MANUFACTURING CO.
329 U.S. 402,MacGREGOR v. WESTINGHOUSE ELECTRIC & MANUFACTURING CO.
329 U.S. 416,"INTERNATIONAL HARVESTER CO. v. EVATT, TAX COMMISSIONER"
329 U.S. 424,"UNITED STATES ET AL. v. SEATRAIN LINES, INC."
329 U.S. 433,"STEELE v. GENERAL MILLS, INC."
329 U.S. 441,BOARD OF GOVERNORS OF THE FEDERAL RESERVE SYSTEM ET AL. v. AGNEW ET AL.
329 U.S. 452,"JESIONOWSKI, ADMINISTRATRIX, v. BOSTON & MAINE RAILROAD"
329 U.S. 459,"LOUISIANA EX REL. FRANCIS v. RESWEBER, SHERIFF, ET AL."
329 U.S. 482,"ANDERSON, RECEIVER, v. YUNGKAU, EXECUTOR, ET AL."
329 U.S. 495,"HICKMAN, ADMINISTRATOR, v. TAYLOR ET AL., TRADING AS TAYLOR & ANDERSON TOWING & LIGHTERAGE CO., ET AL."
329 U.S. 520,ORDER OF RAILWAY CONDUCTORS OF AMERICA ET AL. v. SWAN ET AL.
329 U.S. 520,ORDER OF RAILWAY CONDUCTORS OF AMERICA ET AL. v. SWAN ET AL.
329 U.S. 531,"PARKER ET AL. v. FLEMING, TEMPORARY CONTROLS ADMINISTRATOR"
329 U.S. 539,"PATTERSON, SECRETARY OF WAR, ET AL. v. LAMB"
329 U.S. 545,"MORRIS v. JONES, DIRECTOR OF INSURANCE"
329 U.S. 565,"GARDNER, TRUSTEE, v. NEW JERSEY"
329 U.S. 585,UNITED STATES v. THAYER-WEST POINT HOTEL CO.
329 U.S. 591,"KRUG, SECRETARY OF THE INTERIOR, ET AL. v. SANTA FE PACIFIC RAILROAD CO."
329 U.S. 591,"KRUG, SECRETARY OF THE INTERIOR, ET AL. v. SANTA FE PACIFIC RAILROAD CO."
329 U.S. 599,ALBRECHT ET AL. v. UNITED STATES
329 U.S. 599,ALBRECHT ET AL. v. UNITED STATES
329 U.S. 599,ALBRECHT ET AL. v. UNITED STATES
329 U.S. 599,ALBRECHT ET AL. v. UNITED STATES
329 U.S. 599,ALBRECHT ET AL. v. UNITED STATES
329 U.S. 607,INSURANCE GROUP COMMITTEE ET AL. v. DENVER & RIO GRANDE WESTERN RAILROAD CO. ET AL.
329 U.S. 637,TRANSPARENT-WRAP MACHINE CORP. v. STOKES & SMITH CO.
329 U.S. 649,ELLIS v. UNION PACIFIC RAILROAD CO.
329 U.S. 654,"UNITED STATES v. N. Y. RAYON IMPORTING CO., INC. (#2) ET AL."
329 U.S. 654,"UNITED STATES v. N. Y. RAYON IMPORTING CO., INC. (#2) ET AL."
329 U.S. 663,De MEERLEER v. MICHIGAN
330 U.S. 1,EVERSON v. BOARD OF EDUCATION OF THE TOWNSHIP OF EWING ET AL.
330 U.S. 75,UNITED PUBLIC WORKERS OF AMERICA (C. I. O.) ET AL. v. MITCHELL ET AL.
330 U.S. 127,OKLAHOMA v. UNITED STATES CIVIL SERVICE COMMISSION
330 U.S. 158,"WALLING, WAGE AND HOUR ADMINISTRATOR, v. NASHVILLE, CHATTANOOGA & ST. LOUIS RAILWAY"
330 U.S. 160,BOZZA v. UNITED STATES
330 U.S. 169,CONFEDERATED BANDS OF UTE INDIANS v. UNITED STATES
330 U.S. 183,ANGEL v. BULLINGTON
330 U.S. 212,CONE v. WEST VIRGINIA PULP & PAPER CO.
330 U.S. 219,NATIONAL LABOR RELATIONS BOARD v. DONNELLY GARMENT CO. ET AL.
330 U.S. 219,NATIONAL LABOR RELATIONS BOARD v. DONNELLY GARMENT CO. ET AL.
330 U.S. 238,"UNITED STATES v. POWELL ET AL., RECEIVERS"
330 U.S. 238,"UNITED STATES v. POWELL ET AL., RECEIVERS"
330 U.S. 248,NORTHERN PACIFIC RAILWAY CO. v. UNITED STATES
330 U.S. 258,UNITED STATES v. UNITED MINE WORKERS OF AMERICA
330 U.S. 258,UNITED STATES v. UNITED MINE WORKERS OF AMERICA
330 U.S. 258,UNITED STATES v. UNITED MINE WORKERS OF AMERICA
330 U.S. 258,UNITED STATES v. UNITED MINE WORKERS OF AMERICA
330 U.S. 258,UNITED STATES v. UNITED MINE WORKERS OF AMERICA
330 U.S. 386,TESTA ET AL. v. KATT
330 U.S. 395,UNITED BROTHERHOOD OF CARPENTERS AND JOINERS OF AMERICA v. UNITED STATES
330 U.S. 395,UNITED BROTHERHOOD OF CARPENTERS AND JOINERS OF AMERICA v. UNITED STATES
330 U.S. 395,UNITED BROTHERHOOD OF CARPENTERS AND JOINERS OF AMERICA v. UNITED STATES
330 U.S. 395,UNITED BROTHERHOOD OF CARPENTERS AND JOINERS OF AMERICA v. UNITED STATES
330 U.S. 395,UNITED BROTHERHOOD OF CARPENTERS AND JOINERS OF AMERICA v. UNITED STATES
330 U.S. 422,"JOSEPH, COMPTROLLER, ET AL. v. CARTER & WEEKES STEVEDORING CO."
330 U.S. 422,"JOSEPH, COMPTROLLER, ET AL. v. CARTER & WEEKES STEVEDORING CO."
330 U.S. 446,"AMERICAN STEVEDORES, INC. v. PORELLO ET AL."
330 U.S. 446,"AMERICAN STEVEDORES, INC. v. PORELLO ET AL."
330 U.S. 464,AETNA CASUALTY & SURETY CO. ET AL. v. FLOWERS
330 U.S. 469,"CARDILLO, DEPUTY COMMISSIONER, UNITED STATES EMPLOYEES' COMPENSATION COMMISSION, v. LIBERTY MUTUAL INSURANCE CO. ET AL."
330 U.S. 485,PACKARD MOTOR CAR CO. v. NATIONAL LABOR RELATIONS BOARD
330 U.S. 501,"GULF OIL CORP. v. GILBERT, DOING BUSINESS AS GILBERT STORAGE & TRANSFER CO."
330 U.S. 518,KOSTER v. (AMERICAN) LUMBERMENS MUTUAL CASUALTY CO.
330 U.S. 539,"UNITED STATES DEPARTMENT OF AGRICULTURE, EMERGENCY CROP AND FEED LOANS v. REMUND, ADMINISTRATOR"
330 U.S. 545,"WALLING, WAGE AND HOUR ADMINISTRATOR, v. GENERAL INDUSTRIES CO."
330 U.S. 552,KOTCH ET AL. v. BOARD OF RIVER PORT PILOT COMMISSIONERS FOR THE PORT OF NEW ORLEANS ET AL.
330 U.S. 567,"INTERSTATE COMMERCE COMMISSION v. MECHLING, DOING BUSINESS AS A. L. MECHLING BARGE LINE, ET AL."
330 U.S. 585,PENFIELD COMPANY OF CALIFORNIA ET AL. v. SECURITIES & EXCHANGE COMMISSION
330 U.S. 610,NEW YORK EX REL. HALVEY v. HALVEY
330 U.S. 622,INDUSTRIAL COMMISSION OF WISCONSIN ET AL. v. McCARTIN ET AL.
330 U.S. 631,HAUPT v. UNITED STATES
330 U.S. 649,LEVINSON v. SPECTOR MOTOR SERVICE
330 U.S. 695,PYRAMID MOTOR FREIGHT CORP. v. ISPASS ET AL.
330 U.S. 709,"UNITED STATES v. OGILVIE HARDWARE CO., INC."
330 U.S. 724,UNITED STATES v. LEM HOY
330 U.S. 731,"LAND, CHAIRMAN, UNITED STATES MARITIME COMMISSION, ET AL. v. DOLLAR ET AL."
330 U.S. 743,"BRUCE'S JUICES, INC. v. AMERICAN CAN CO."
330 U.S. 767,BETHLEHEM STEEL CO. ET AL. v. NEW YORK STATE LABOR RELATIONS BOARD
330 U.S. 767,BETHLEHEM STEEL CO. ET AL. v. NEW YORK STATE LABOR RELATIONS BOARD
331 U.S. 1,CRANE v. COMMISSIONER OF INTERNAL REVENUE
331 U.S. 17,"WALLING, WAGE AND HOUR ADMINISTRATOR, v. HALLIBURTON OIL WELL CEMENTING CO."
331 U.S. 28,UNITED STATES NATIONAL BANK ET AL. v. CHASE NATIONAL BANK ET AL.
331 U.S. 40,TRAILMOBILE COMPANY ET AL. v. WHIRLS
331 U.S. 70,"INDEPENDENT WAREHOUSES, INC. ET AL. v. SCHEELE, RECORDER OF THE TOWNSHIP OF SADDLE RIVER, ET AL."
331 U.S. 96,McCULLOUGH v. KAMMERER CORPORATION ET AL.
331 U.S. 100,"FLEMING, TEMPORARY CONTROLS ADMINISTRATOR, v. RHODES, SHERIFF, ET AL."
331 U.S. 111,"FLEMING, TEMPORARY CONTROLS ADMINISTRATOR, v. MOHAWK WRECKING & LUMBER CO. ET AL."
331 U.S. 111,"FLEMING, TEMPORARY CONTROLS ADMINISTRATOR, v. MOHAWK WRECKING & LUMBER CO. ET AL."
331 U.S. 125,"CHAMPION SPARK PLUG CO. v. SANDERS ET AL., DOING BUSINESS AS PERFECT RECONDITION SPARK PLUG CO."
331 U.S. 132,AYRSHIRE COLLIERIES CORP. ET AL. v. UNITED STATES ET AL.
331 U.S. 145,HARRIS v. UNITED STATES
331 U.S. 199,149 MADISON AVENUE CORP. ET AL. v. ASSELTA ET AL.
331 U.S. 210,COMMISSIONER OF INTERNAL REVENUE v. MUNTER
331 U.S. 210,COMMISSIONER OF INTERNAL REVENUE v. MUNTER
331 U.S. 218,RICE ET AL. v. SANTA FE ELEVATOR CORP. ET AL.
331 U.S. 218,RICE ET AL. v. SANTA FE ELEVATOR CORP. ET AL.
331 U.S. 247,RICE ET AL. v. BOARD OF TRADE OF THE CITY OF CHICAGO
331 U.S. 247,RICE ET AL. v. BOARD OF TRADE OF THE CITY OF CHICAGO
331 U.S. 256,UNITED STATES v. FULLARD-LEO ET AL.
331 U.S. 284,NEW YORK ET AL. v. UNITED STATES ET AL.
331 U.S. 284,NEW YORK ET AL. v. UNITED STATES ET AL.
331 U.S. 284,NEW YORK ET AL. v. UNITED STATES ET AL.
331 U.S. 367,"CRAIG ET AL. v. HARNEY, SHERIFF"
331 U.S. 398,NATIONAL LABOR RELATIONS BOARD v. E. C. ATKINS & CO.
331 U.S. 416,NATIONAL LABOR RELATIONS BOARD v. JONES & LAUGHLIN STEEL CORP.
331 U.S. 432,"UNITED STATES v. WALSH, TRADING AS KELP LABORATORIES"
331 U.S. 461,"COPE v. ANDERSON, RECEIVER"
331 U.S. 461,"COPE v. ANDERSON, RECEIVER"
331 U.S. 469,"UNITED STATES v. SMITH, U.S. DISTRICT JUDGE, ET AL."
331 U.S. 477,MYERS v. READING COMPANY
331 U.S. 486,"GREENOUGH ET AL., TRUSTEES, v. TAX ASSESSORS OF NEWPORT ET AL."
331 U.S. 503,"CLARK, ATTORNEY GENERAL, AS SUCCESSOR TO THE ALIEN PROPERTY CUSTODIAN, v. ALLEN ET AL."
331 U.S. 519,BROTHERHOOD OF RAILROAD TRAINMEN v. BALTIMORE & OHIO RAILROAD CO. ET AL.
331 U.S. 532,UNITED STATES v. BAYER ET AL.
331 U.S. 543,GOSPEL ARMY v. LOS ANGELES ET AL.
331 U.S. 549,RESCUE ARMY ET AL. v. MUNICIPAL COURT OF LOS ANGELES
331 U.S. 586,ORDER OF UNITED COMMERCIAL TRAVELERS OF AMERICA v. WOLFE
331 U.S. 642,"WILLIAMS ET AL. v. AUSTRIAN ET AL., TRUSTEES"
331 U.S. 682,"INTERSTATE NATURAL GAS CO., INC. v. FEDERAL POWER COMMISSION et al."
331 U.S. 694,McWILLIAMS v. COMMISSIONER OF INTERNAL REVENUE
331 U.S. 694,McWILLIAMS v. COMMISSIONER OF INTERNAL REVENUE
331 U.S. 694,McWILLIAMS v. COMMISSIONER OF INTERNAL REVENUE
331 U.S. 704,"UNITED STATES v. SILK, DOING BUSINESS AS ALBERT SILK COAL CO."
331 U.S. 704,"UNITED STATES v. SILK, DOING BUSINESS AS ALBERT SILK COAL CO."
331 U.S. 722,"RUTHERFORD FOOD CORP. ET AL. v. McCOMB, WAGE AND HOUR ADMINISTRATOR"
331 U.S. 731,"MEXICAN LIGHT & POWER CO., LTD. v. TEXAS MEXICAN RAILWAY CO."
331 U.S. 737,BAZLEY v. COMMISSIONER OF INTERNAL REVENUE
331 U.S. 737,BAZLEY v. COMMISSIONER OF INTERNAL REVENUE
331 U.S. 745,UNITED STATES v. DICKINSON
331 U.S. 745,UNITED STATES v. DICKINSON
331 U.S. 752,AIRCRAFT & DIESEL EQUIPMENT CORP. v. HIRSCH ET AL.
332 U.S. 1,UNITED STATES v. PETRILLO
332 U.S. 46,ADAMSON v. CALIFORNIA
332 U.S. 126,"BARTELS ET AL., DOING BUSINESS AS CRYSTAL BALLROOM, v. BIRMINGHAM, COLLECTOR OF INTERNAL REVENUE, ET AL."
332 U.S. 126,"BARTELS ET AL., DOING BUSINESS AS CRYSTAL BALLROOM, v. BIRMINGHAM, COLLECTOR OF INTERNAL REVENUE, ET AL."
332 U.S. 134,FOSTER et al. v. ILLINOIS
332 U.S. 145,GAYES v. NEW YORK
332 U.S. 155,"CALDAROLA v. ECKERT ET AL., DOING BUSINESS AS THOR ECKERT & CO."
332 U.S. 168,"ATLANTIC COAST LINE RAILROAD CO. v. PHILLIPS, STATE REVENUE COMMISSIONER"
332 U.S. 174,"SUNAL v. LARGE, SUPERINTENDENT, FEDERAL PRISON CAMP"
332 U.S. 174,"SUNAL v. LARGE, SUPERINTENDENT, FEDERAL PRISON CAMP"
332 U.S. 194,SECURITIES & EXCHANGE COMMISSION v. CHENERY CORPORATION ET AL.
332 U.S. 194,SECURITIES & EXCHANGE COMMISSION v. CHENERY CORPORATION ET AL.
332 U.S. 218,UNITED STATES v. YELLOW CAB CO. et al.
332 U.S. 234,"UNITED STATES v. MUNSEY TRUST CO., RECEIVER"
332 U.S. 245,"FAHEY, FEDERAL HOME LOAN BANK COMMISSIONER, ET AL. v. MALLONEE ET AL."
332 U.S. 258,"EX PARTE FAHEY, FEDERAL HOME LOAN BANK COMMISSIONER, ET AL."
332 U.S. 261,FAY v. NEW YORK
332 U.S. 261,FAY v. NEW YORK
332 U.S. 301,UNITED STATES v. STANDARD OIL COMPANY OF CALIFORNIA ET AL.
332 U.S. 319,UNITED STATES v. NATIONAL LEAD CO. ET AL.
332 U.S. 319,UNITED STATES v. NATIONAL LEAD CO. ET AL.
332 U.S. 319,UNITED STATES v. NATIONAL LEAD CO. ET AL.
332 U.S. 371,RODGERS v. UNITED STATES
332 U.S. 380,"FEDERAL CROP INSURANCE CORP. v. MERRILL ET AL., DOING BUSINESS AS MERRILL BROS."
332 U.S. 388,"DELGADILLO v. CARMICHAEL, DISTRICT DIRECTOR, IMMIGRATION AND NATURALIZATION SERVICE"
332 U.S. 392,"INTERNATIONAL SALT CO., INC. v. UNITED STATES"
332 U.S. 407,"PRIEBE & SONS, INC. v. UNITED STATES"
332 U.S. 422,"MORRIS v. McCOMB, WAGE AND HOUR ADMINISTRATOR"
332 U.S. 442,COX v. UNITED STATES
332 U.S. 442,COX v. UNITED STATES
332 U.S. 442,COX v. UNITED STATES
332 U.S. 459,"LILLIE v. THOMPSON, TRUSTEE"
332 U.S. 463,PATTON v. MISSISSIPPI
332 U.S. 469,"SILESIAN-AMERICAN CORP. ET AL. v. CLARK, ATTORNEY GENERAL, AS SUCCESSOR TO THE ALIEN PROPERTY CUSTODIAN"
332 U.S. 480,"CLARK, ATTORNEY GENERAL, AS SUCCESSOR TO THE ALIEN PROPERTY CUSTODIAN, v. UEBERSEE FINANZ-KORPORATION, A. G."
332 U.S. 490,"WILLIAMS ET AL. v. FANNING, POSTMASTER OF LOS ANGELES"
332 U.S. 495,AERO MAYFLOWER TRANSIT CO. v. BOARD OF RAILROAD COMMISSIONERS OF MONTANA ET AL.
332 U.S. 507,PANHANDLE EASTERN PIPE LINE CO. v. PUBLIC SERVICE COMMISSION OF INDIANA ET AL.
332 U.S. 524,"JONES, COLLECTOR OF INTERNAL REVENUE, v. LIBERTY GLASS CO."
332 U.S. 535,"KAVANAGH, COLLECTOR OF INTERNAL REVENUE, v. NOBLE"
332 U.S. 539,BLUMENTHAL v. UNITED STATES
332 U.S. 539,BLUMENTHAL v. UNITED STATES
332 U.S. 539,BLUMENTHAL v. UNITED STATES
332 U.S. 539,BLUMENTHAL v. UNITED STATES
332 U.S. 561,"MARINO v. RAGEN, WARDEN"
332 U.S. 571,"GLOBE LIQUOR CO., INC. v. SAN ROMAN ET AL., DOING BUSINESS AS INTERNATIONAL INDUSTRIES"
332 U.S. 575,SEALFON v. UNITED STATES
332 U.S. 581,UNITED STATES v. Di RE
332 U.S. 596,HALEY v. OHIO
332 U.S. 625,CALLEN v. PENNSYLVANIA RAILROAD CO.
332 U.S. 631,SIPUEL v. BOARD OF REGENTS OF THE UNIVERSITY OF OKLAHOMA ET AL.
332 U.S. 633,OYAMA ET AL. v. CALIFORNIA
332 U.S. 689,"UNITED STATES v. SULLIVAN, TRADING AS SULLIVAN'S PHARMACY"
332 U.S. 708,"VON MOLTKE v. GILLIES, SUPERINTENDENT OF THE DETROIT HOUSE OF CORRECTION"
332 U.S. 742,LEE v. MISSISSIPPI
333 U.S. 1,LE MAISTRE v. LEFFERS ET AL.
333 U.S. 6,"FONG HAW TAN v. PHELAN, ACTING DISTRICT DIRECTOR, IMMIGRATION AND NATURALIZATION SERVICE"
333 U.S. 10,JOHNSON v. UNITED STATES
333 U.S. 18,UNITED STATES v. BROWN
333 U.S. 28,BOB-LO EXCURSION CO. v. MICHIGAN
333 U.S. 46,JOHNSON v. UNITED STATES
333 U.S. 56,"MAGGIO v. ZEITZ, TRUSTEE IN BANKRUPTCY"
333 U.S. 95,MUSSER ET AL. v. UTAH
333 U.S. 103,"CHICAGO & SOUTHERN AIR LINES, INC. v. WATERMAN STEAMSHIP CORP."
333 U.S. 103,"CHICAGO & SOUTHERN AIR LINES, INC. v. WATERMAN STEAMSHIP CORP."
333 U.S. 118,"SEABOARD AIR LINE RAILROAD CO. v. DANIEL, ATTORNEY GENERAL, ET AL."
333 U.S. 127,FUNK BROTHERS SEED CO. v. KALO INOCULANT CO.
333 U.S. 138,"WOODS, HOUSING EXPEDITER, v. CLOYD W. MILLER CO. ET AL."
333 U.S. 147,"FISHER v. HURST, CHIEF JUSTICE, ET AL."
333 U.S. 153,KING v. ORDER OF UNITED COMMERCIAL TRAVELERS OF AMERICA
333 U.S. 163,"SUTTLE, ADMINISTRATRIX, v. REICH BROS. CONSTRUCTION CO. ET AL."
333 U.S. 169,UNITED STATES ET AL. v. BALTIMORE & OHIO RAILROAD CO. ET AL.
333 U.S. 178,"DONALDSON, POSTMASTER GENERAL, v. READ MAGAZINE, INC. ET AL."
333 U.S. 196,COLE ET AL. v. ARKANSAS
333 U.S. 203,"ILLINOIS EX REL. McCOLLUM v. BOARD OF EDUCATION OF SCHOOL DISTRICT NO. 71, CHAMPAIGN COUNTY, ILLINOIS, ET AL."
333 U.S. 257,IN RE OLIVER
333 U.S. 287,UNITED STATES v. LINE MATERIAL CO. ET AL.
333 U.S. 364,UNITED STATES v. UNITED STATES GYPSUM CO. ET AL.
333 U.S. 411,"MITCHELL ET AL., MEMBERS OF THE CIVIL SERVICE COMMISSION, v. COHEN"
333 U.S. 411,"MITCHELL ET AL., MEMBERS OF THE CIVIL SERVICE COMMISSION, v. COHEN"
333 U.S. 424,MOGALL v. UNITED STATES
333 U.S. 426,"ECCLES ET AL. v. PEOPLES BANK OF LAKEWOOD VILLAGE, CALIFORNIA"
333 U.S. 437,"BAKERY SALES DRIVERS LOCAL UNION NO. 33 ET AL. v. WAGSHAL, TRADING AS WAGSHAL'S DELICATESSEN"
333 U.S. 445,FRANCIS ET AL. v. SOUTHERN PACIFIC CO.
333 U.S. 472,"WOODS, HOUSING EXPEDITER, v. STONE"
333 U.S. 483,UNITED STATES v. EVANS
333 U.S. 496,COMMISSIONER OF INTERNAL REVENUE v. SOUTH TEXAS LUMBER CO.
333 U.S. 507,WINTERS v. NEW YORK
333 U.S. 541,"CONNECTICUT MUTUAL LIFE INSURANCE CO. ET AL. v. MOORE, COMPTROLLER OF THE STATE OF NEW YORK"
333 U.S. 565,MOORE ET AL. v. NEW YORK
333 U.S. 571,PARKER v. ILLINOIS
333 U.S. 586,SHADE v. DOWNING ET AL.
333 U.S. 591,COMMISSIONER OF INTERNAL REVENUE v. SUNNEN
333 U.S. 611,MASSACHUSETTS ET AL. v. UNITED STATES
333 U.S. 640,BUTE v. ILLINOIS
333 U.S. 683,FEDERAL TRADE COMMISSION v. CEMENT INSTITUTE ET AL.
333 U.S. 683,FEDERAL TRADE COMMISSION v. CEMENT INSTITUTE ET AL.
333 U.S. 683,FEDERAL TRADE COMMISSION v. CEMENT INSTITUTE ET AL.
333 U.S. 683,FEDERAL TRADE COMMISSION v. CEMENT INSTITUTE ET AL.
333 U.S. 683,FEDERAL TRADE COMMISSION v. CEMENT INSTITUTE ET AL.
333 U.S. 683,FEDERAL TRADE COMMISSION v. CEMENT INSTITUTE ET AL.
333 U.S. 683,FEDERAL TRADE COMMISSION v. CEMENT INSTITUTE ET AL.
333 U.S. 683,FEDERAL TRADE COMMISSION v. CEMENT INSTITUTE ET AL.
333 U.S. 683,FEDERAL TRADE COMMISSION v. CEMENT INSTITUTE ET AL.
333 U.S. 683,FEDERAL TRADE COMMISSION v. CEMENT INSTITUTE ET AL.
333 U.S. 683,FEDERAL TRADE COMMISSION v. CEMENT INSTITUTE ET AL.
333 U.S. 683,FEDERAL TRADE COMMISSION v. CEMENT INSTITUTE ET AL.
333 U.S. 740,ANDRES v. UNITED STATES
333 U.S. 771,UNITED STATES v. SOUTH BUFFALO RAILWAY CO. ET AL.
333 U.S. 795,UNITED STATES v. SCOPHONY CORPORATION OF AMERICA ET AL.
333 U.S. 821,"ANDERSON, ADMINISTRATRIX, v. ATCHISON, TOPEKA & SANTA FE RAILWAY CO."
334 U.S. 1,SHELLEY ET UX. v. KRAEMER ET UX.
334 U.S. 1,SHELLEY ET UX. v. KRAEMER ET UX.
334 U.S. 24,HURD ET UX. v. HODGE ET AL.
334 U.S. 24,HURD ET UX. v. HODGE ET AL.
334 U.S. 37,FEDERAL TRADE COMMISSION v. MORTON SALT CO.
334 U.S. 62,REPUBLIC NATURAL GAS CO. v. OKLAHOMA ET AL.
334 U.S. 100,UNITED STATES v. GRIFFITH ET AL.
334 U.S. 110,"SCHINE CHAIN THEATRES, INC. ET AL. v. UNITED STATES"
334 U.S. 131,"UNITED STATES v. PARAMOUNT PICTURES, INC. ET AL."
334 U.S. 131,"UNITED STATES v. PARAMOUNT PICTURES, INC. ET AL."
334 U.S. 131,"UNITED STATES v. PARAMOUNT PICTURES, INC. ET AL."
334 U.S. 131,"UNITED STATES v. PARAMOUNT PICTURES, INC. ET AL."
334 U.S. 131,"UNITED STATES v. PARAMOUNT PICTURES, INC. ET AL."
334 U.S. 131,"UNITED STATES v. PARAMOUNT PICTURES, INC. ET AL."
334 U.S. 131,"UNITED STATES v. PARAMOUNT PICTURES, INC. ET AL."
334 U.S. 131,"UNITED STATES v. PARAMOUNT PICTURES, INC. ET AL."
334 U.S. 182,SCHWABACHER ET AL. v. UNITED STATES ET AL.
334 U.S. 210,"WOODS, HOUSING EXPEDITER, v. HILLS"
334 U.S. 219,"MANDEVILLE ISLAND FARMS, INC. ET AL. v. AMERICAN CRYSTAL SUGAR CO."
334 U.S. 249,KENNEDY ET AL. v. SILAS MASON CO.
334 U.S. 258,UNITED STATES v. UNITED STATES DISTRICT COURT FOR THE SOUTHERN DISTRICT OF NEW YORK ET AL.
334 U.S. 266,"PRICE v. JOHNSTON, WARDEN"
334 U.S. 302,"HUNTER, WARDEN, v. MARTIN"
334 U.S. 304,"BRIGGS, ADMINISTRATRIX, v. PENNSYLVANIA RAILROAD CO."
334 U.S. 314,"PATERNO v. LYONS, COMMISSIONER OF CORRECTION"
334 U.S. 323,"HILTON v. SULLIVAN, SECRETARY OF THE NAVY, ET AL."
334 U.S. 343,SHERRER v. SHERRER
334 U.S. 378,COE v. COE
334 U.S. 385,TOOMER ET AL. v. WITSELL ET AL.
334 U.S. 410,TAKAHASHI v. FISH AND GAME COMMISSION ET AL.
334 U.S. 431,"PHYLE v. DUFFY, WARDEN"
334 U.S. 446,"BAY RIDGE OPERATING CO., INC. v. AARON ET AL."
334 U.S. 446,"BAY RIDGE OPERATING CO., INC. v. AARON ET AL."
334 U.S. 495,UNITED STATES v. COLUMBIA STEEL CO. ET AL.
334 U.S. 541,ESTIN v. ESTIN
334 U.S. 555,KREIGER v. KREIGER
334 U.S. 558,SAIA v. NEW YORK
334 U.S. 573,"UNITED STATES v. NATIONAL CITY LINES, INC. ET AL."
334 U.S. 602,UNITED STATES v. ZAZOVE
334 U.S. 624,"UNITED STATES v. JOHN J. FELIN & CO., INC."
334 U.S. 653,"CENTRAL GREYHOUND LINES, INC. v. MEALEY ET AL."
334 U.S. 672,"WADE v. MAYO, STATE PRISON CUSTODIAN"
334 U.S. 699,TRUPIANO ET AL. v. UNITED STATES
334 U.S. 717,WEST v. OKLAHOMA TAX COMMISSION
334 U.S. 728,"GRYGER v. BURKE, WARDEN"
334 U.S. 736,"TOWNSEND v. BURKE, WARDEN"
334 U.S. 742,"LICHTER ET AL., DOING BUSINESS AS SOUTHERN FIREPROOFING CO., v. UNITED STATES"
334 U.S. 742,"LICHTER ET AL., DOING BUSINESS AS SOUTHERN FIREPROOFING CO., v. UNITED STATES"
334 U.S. 742,"LICHTER ET AL., DOING BUSINESS AS SOUTHERN FIREPROOFING CO., v. UNITED STATES"
334 U.S. 806,HEDGEBETH v. NORTH CAROLINA
335 U.S. 1,SHAPIRO v. UNITED STATES
335 U.S. 77,UNITED STATES v. HOFFMAN
335 U.S. 80,"MEMPHIS NATURAL GAS CO. v. STONE, CHAIRMAN, STATE TAX COMMISSION"
335 U.S. 106,UNITED STATES v. CONGRESS OF INDUSTRIAL ORGANIZATIONS ET AL.
335 U.S. 160,"LUDECKE v. WATKINS, DISTRICT DIRECTOR OF IMMIGRATION"
335 U.S. 188,"AHRENS ET AL. v. CLARK, ATTORNEY GENERAL"
335 U.S. 211,COMSTOCK v. GROUP OF INSTITUTIONAL INVESTORS ET AL.
335 U.S. 211,COMSTOCK v. GROUP OF INSTITUTIONAL INVESTORS ET AL.
335 U.S. 211,COMSTOCK v. GROUP OF INSTITUTIONAL INVESTORS ET AL.
335 U.S. 211,COMSTOCK v. GROUP OF INSTITUTIONAL INVESTORS ET AL.
335 U.S. 252,TAYLOR v. ALABAMA
335 U.S. 281,"MacDOUGALL ET AL. v. GREEN, GOVERNOR OF ILLINOIS, ET AL."
335 U.S. 291,"MANDEL BROTHERS, INC. v. WALLACE"
335 U.S. 297,HOINESS v. UNITED STATES
335 U.S. 303,FORD MOTOR CO. v. UNITED STATES
335 U.S. 303,FORD MOTOR CO. v. UNITED STATES
335 U.S. 329,"ECKENRODE, ADMINISTRATRIX, v. PENNSYLVANIA RAILROAD CO."
335 U.S. 331,"ADKINS, ADMINISTRATRIX, v. E. I. DuPONT de NEMOURS & CO., INC. UNITED STATES, INTERVENOR"
335 U.S. 345,KORDEL v. UNITED STATES
335 U.S. 355,UNITED STATES v. URBUTEIT
335 U.S. 359,GRAND RIVER DAM AUTHORITY v. GRAND-HYDRO
335 U.S. 377,"VERMILYA-BROWN CO., INC. ET AL. v. CONNELL ET AL."
335 U.S. 410,UPSHAW v. UNITED STATES
335 U.S. 437,UVEGES v. PENNSYLVANIA
335 U.S. 451,McDONALD ET AL. v. UNITED STATES
335 U.S. 464,"GOESAERT ET AL. v. CLEARY ET AL., MEMBERS OF THE LIQUOR CONTROL COMMISSION OF MICHIGAN"
335 U.S. 469,MICHELSON v. UNITED STATES
335 U.S. 497,FRAZIER v. UNITED STATES
335 U.S. 520,"CORAY, ANCILLARY ADMINISTRATOR, v. SOUTHERN PACIFIC CO."
335 U.S. 525,LINCOLN FEDERAL LABOR UNION ET AL. v. NORTHWESTERN IRON & METAL CO. ET AL.
335 U.S. 525,LINCOLN FEDERAL LABOR UNION ET AL. v. NORTHWESTERN IRON & METAL CO. ET AL.
335 U.S. 538,AMERICAN FEDERATION OF LABOR ET AL. v. AMERICAN SASH & DOOR CO. ET AL.
335 U.S. 560,JUNGERSEN v. OSTBY & BARTON CO. ET AL.
335 U.S. 560,JUNGERSEN v. OSTBY & BARTON CO. ET AL.
335 U.S. 560,JUNGERSEN v. OSTBY & BARTON CO. ET AL.
335 U.S. 573,AYRSHIRE COLLIERIES CORP. ET AL. v. UNITED STATES ET AL.
335 U.S. 595,"HENSLEE, COLLECTOR OF INTERNAL REVENUE, v. UNION PLANTERS NATIONAL BANK & TRUST CO. ET AL."
335 U.S. 601,KLAPPROTT v. UNITED STATES
335 U.S. 632,COMMISSIONER OF INTERNAL REVENUE v. ESTATE OF CHURCH
335 U.S. 701,ESTATE OF SPIEGEL ET AL. v. COMMISSIONER OF INTERNAL REVENUE
336 U.S. 1,LEIMAN ET AL. v. GUTTMAN ET AL.
336 U.S. 18,La CROSSE TELEPHONE CORP. v. WISCONSIN EMPLOYMENT RELATIONS BOARD ET AL.
336 U.S. 18,La CROSSE TELEPHONE CORP. v. WISCONSIN EMPLOYMENT RELATIONS BOARD ET AL.
336 U.S. 28,COMMISSIONER OF INTERNAL REVENUE v. JACOBSON
336 U.S. 28,COMMISSIONER OF INTERNAL REVENUE v. JACOBSON
336 U.S. 53,"WILKERSON v. McCARTHY ET AL., TRUSTEES"
336 U.S. 77,"KOVACS v. COOPER, JUDGE"
336 U.S. 106,"RAILWAY EXPRESS AGENCY, INC. ET AL. v. NEW YORK"
336 U.S. 118,"GOGGIN, TRUSTEE IN BANKRUPTCY, v. DIVISION OF LABOR LAW ENFORCEMENT OF CALIFORNIA"
336 U.S. 132,"CALLAWAY, TRUSTEE, ET AL. v. BENTON ET AL."
336 U.S. 155,"FISHER v. PACE, SHERIFF"
336 U.S. 169,"OTT, COMMISSIONER OF PUBLIC FINANCE, ET AL. v. MISSISSIPPI VALLEY BARGE LINE CO. ET AL."
336 U.S. 176,WISCONSIN ELECTRIC POWER CO. v. UNITED STATES
336 U.S. 187,"McCOMB, WAGE AND HOUR ADMINISTRATOR, v. JACKSONVILLE PAPER CO. ET AL."
336 U.S. 198,"LAWSON, DEPUTY COMMISSIONER, UNITED STATES EMPLOYEES' COMPENSATION COMMISSION, v. SUWANNEE FRUIT & STEAMSHIP CO. ET AL."
336 U.S. 207,"REYNOLDS, ADMINISTRATRIX, v. ATLANTIC COAST LINE RAILROAD CO."
336 U.S. 210,"UNITED STATES EX REL. HIRSHBERG v. COOKE, COMMANDING OFFICER"
336 U.S. 220,"DANIEL, ATTORNEY GENERAL, ET AL. v. FAMILY SECURITY LIFE INSURANCE CO. ET AL."
336 U.S. 226,NATIONAL LABOR RELATIONS BOARD v. STOWE SPINNING CO. ET AL.
336 U.S. 245,"INTERNATIONAL UNION, U. A. W. A., A. F. OF L., LOCAL 232, ET AL. v. WISCONSIN EMPLOYMENT RELATIONS BOARD ET AL."
336 U.S. 245,"INTERNATIONAL UNION, U. A. W. A., A. F. OF L., LOCAL 232, ET AL. v. WISCONSIN EMPLOYMENT RELATIONS BOARD ET AL."
336 U.S. 271,"GRAVER TANK & MFG. CO., INC. ET AL. v. LINDE AIR PRODUCTS CO."
336 U.S. 271,"GRAVER TANK & MFG. CO., INC. ET AL. v. LINDE AIR PRODUCTS CO."
336 U.S. 281,"FOLEY BROS., INC. ET AL. v. FILARDO"
336 U.S. 301,ALGOMA PLYWOOD & VENEER CO. v. WISCONSIN EMPLOYMENT RELATIONS BOARD
336 U.S. 328,"CITY OF NEW YORK v. SAPER, TRUSTEE IN BANKRUPTCY"
336 U.S. 328,"CITY OF NEW YORK v. SAPER, TRUSTEE IN BANKRUPTCY"
336 U.S. 328,"CITY OF NEW YORK v. SAPER, TRUSTEE IN BANKRUPTCY"
336 U.S. 342,OKLAHOMA TAX COMMISSION v. TEXAS COMPANY
336 U.S. 342,OKLAHOMA TAX COMMISSION v. TEXAS COMPANY
336 U.S. 368,"STAINBACK, GOVERNOR OF THE TERRITORY OF HAWAII, ET AL. v. MO HOCK KE LOK PO, AN ELEEMOSYNARY CORPORATION, ET AL."
336 U.S. 368,"STAINBACK, GOVERNOR OF THE TERRITORY OF HAWAII, ET AL. v. MO HOCK KE LOK PO, AN ELEEMOSYNARY CORPORATION, ET AL."
336 U.S. 386,"BLACK DIAMOND STEAMSHIP CORP. v. ROBERT STEWART & SONS, LTD. ET AL."
336 U.S. 386,"BLACK DIAMOND STEAMSHIP CORP. v. ROBERT STEWART & SONS, LTD. ET AL."
336 U.S. 410,COMMISSIONER OF INTERNAL REVENUE v. PHIPPS
336 U.S. 422,NATIONAL CARBIDE CORP. v. COMMISSIONER OF INTERNAL REVENUE
336 U.S. 422,NATIONAL CARBIDE CORP. v. COMMISSIONER OF INTERNAL REVENUE
336 U.S. 422,NATIONAL CARBIDE CORP. v. COMMISSIONER OF INTERNAL REVENUE
336 U.S. 440,KRULEWITCH v. UNITED STATES
